Tail Number,SWA Aircraft Type Code,IATA Aircraft Type Code,ICAO Aircraft Type Code,ICAO Aircraft Type Description,Seats,Obs Seat,Entry Date,ADSB ID,Aircraft Name,Operational Empty Weight,Maximum Zero Fuel Weight,Maximum Taxi Weight,Maximum Takeoff Weight,Maximum Landing Weight,SECLAID,Aircraft Manufacturer,Aircraft Certificate Expiration,Active Date,Inactive Date,Exit Date,ELT Fixed Count,ELT Portable Count,HF Count,HGS,SATCOM Count,Raft Count,Equipment Type,ETOPS,Aircraft Registration,Space Bins,ADSB Equipment Type,WiFi Vendor,Country Exclusions,Satvoice Box,C1
N218WN,7S7,7S7,B737,737-700,137,2,6/30/2005,A1D93B,,85487,121700,155000,154500,129200,,Boeing,10/31/2027 0:00,05/17/2005,,,0,2,0,HGS-4000,0,0,C+,NOT ETOPS,PERM,NO,SBAS,Anuvu,,,
N550WN,73W,73W,B737,737-700,143,2,11/28/2001,A7016C,,85270,121700,155000,154500,129200,,Boeing,2001-11-28,04/25/2007,12/11/2024,,0,2,0,CAT I,0,0,C1,NOT ETOPS,PERM,NO,SA-ON,Anuvu,MEX,,true
N8539V,7A8,73H,B738,737-800,175,2,6/19/2017,ABB624,,91400,138300,174700,174200,146300,DJ-HS,Boeing,7/31/2027 0:00,06/26/2017,,,1,1,0,HGS-4000,0,0,C+,NOT ETOPS,PERM,NO,SBAS,Anuvu,,,
N7819A,73R,73W,B737,737-700,143,2,1/21/2002,AA97D1,,86301,121700,155000,154500,129200,DH-GP,Boeing,11/30/2027,07/09/2015,02/26/2025,,0,2,0,CAT I,0,3,C1,NOT ETOPS,PERM,NO,SBAS,Anuvu,MEX,,true
N8315C,7R8,73H,B738,737-800,175,2,7/13/2012,AB5F1B,,94316,138300,174700,174200,146300,BE-GP,Boeing,7/31/2028 0:00,07/16/2012,,,1,1,2,HGS-4000,1,4,ET,ETOPS,PERM,NO,SBAS,Anuvu,,,
N239WN,73W,73W,B737,737-700,143,2,5/26/2006,A22BF0,,85693,121700,155000,154500,129200,,Boeing,10/31/2027,05/30/2006,10/24/2025,,0,2,0,HGS-4000,0,0,C1,NOT ETOPS,PERM,NO,SBAS,Anuvu,,,true
N8713M,7V8,7M8,B38M,737 MAX 8,175,2,9/29/2017,ABFCDA,,99083,145400,181700,181200,152800,HM-BP,Boeing,2017-09-29,09/27/2017,,,1,1,2,HGS-6000,1,4,ET,ETOPS,PERM,NO,SBAS,Anuvu,,,
N8562Z,7A8,73H,B738,737-800,175,2,2/9/2018,ABC058,,91867,138300,174700,174200,146300,BP-KQ,Boeing,4/3/2026 0:00,02/11/2018,,,1,1,0,HGS-4000,0,0,C+,NOT ETOPS,PERM,NO,SBAS,Anuvu,,,
N8862Q,7U8,7M8,B38M,737 MAX 8,175,2,5/1/2023,AC36CC,,98806,145400,181700,181200,152800,BS-HP,Boeing,2023-05-01,05/03/2023,,,1,1,0,HGS-6000,1,0,C+,NOT ETOPS,PERM,YES,SBAS,ViaSat,,,
N7867A,73W,73W,B737,737-700,143,1,10/7/2002,AAAA1E,,85912,121700,155000,154500,129200,LM-HR,Boeing,11/30/2027,12/03/2017,12/26/2025,,0,2,0,HGS-4000,0,0,C1,NOT ETOPS,PERM,NO,SBAS,Anuvu,,,true
N213WN,7S7,7S7,B737,737-700,137,2,5/26/2005,A1C6A8,,85547,121700,155000,154500,129200,,Boeing,8/31/2027 0:00,04/19/2005,,,0,2,0,HGS-4000,0,0,C+,NOT ETOPS,PERM,NO,SBAS,Anuvu,,,
N8673F,7P8,73H,B738,737-800,175,2,12/1/2015,ABEB9F,,93451,138300,174700,174200,146300,MQ-CD,Boeing,12/31/2025 0:00,12/03/2015,,,1,1,0,HGS,0,0,C+,NOT ETOPS,PERM,NO,SBAS,Anuvu,,,
N8668A,7P8,73H,B738,737-800,175,2,5/17/2015,ABE892,,93001,138300,174700,174200,146300,MP-FG,Boeing,6/30/2028 0:00,05/19/2015,,,1,1,0,HGS-4000,0,0,C+,NOT ETOPS,PERM,YES,SBAS,Anuvu,,,
N8803L,7U8,7M8,B38M,737 MAX 8,175,2,2/25/2021,AC20A1,,98523,145400,181700,181200,152800,EP-CD,Boeing,2021-02-25,02/26/2021,,,1,1,0,HGS-6000,0,0,C+,NOT ETOPS,PERM,NO,SBAS,Anuvu,,,
N464WN,7S7,7S7,B737,737-700,137,2,6/8/2004,A5AA78,,85614,121700,155000,154500,129200,,Boeing,10/31/2027 0:00,06/06/2004,,,0,2,0,HGS-2350,0,0,C+,NOT ETOPS,PERM,NO,SBAS,Anuvu,,,
N209WN,7S7,7S7,B737,737-700,137,2,4/22/2005,A1B573,,85547,121700,155000,154500,129200,,Boeing,6/30/2027 0:00,03/13/2005,,,0,2,0,HGS-4000,0,0,C+,NOT ETOPS,PERM,NO,SBAS,Anuvu,,,
N8979L,7X8,7M8,B38M,737 MAX 8,175,2,10/20/2025,AC62F3,,99501,145400,181700,181200,152800,RS-CP,Boeing,,10/23/2025,,,1,1,0,HGS-6000,1,0,C+,NOT ETOPS,PERM,YES,SBAS,ViaSat,JAM MEX PLS,,
N954WN,7S7,7S7,B737,737-700,137,2,2/10/2011,AD4584,,84718,121700,155000,154500,129200,,Boeing,3/31/2027,02/10/2011,,,0,1,0,HGS-4000,0,0,C1,NOT ETOPS,PERM,NO,SBAS,Anuvu,MEX,,
N8682B,7P8,73H,B738,737-800,175,2,3/8/2016,ABEF2F,,93051,138300,174700,174200,146300,AS-JP,Boeing,4/30/2026 0:00,03/08/2016,,,1,1,0,HGS-4000,0,0,C+,NOT ETOPS,PERM,YES,SBAS,Anuvu,,,
N8978G,7X8,7M8,B38M,737 MAX 8,175,2,10/17/2025,AC62CC,,99494,145400,181700,181200,152800,EM-BR,Boeing,,10/21/2025,,,1,1,0,HGS,1,0,C+,NOT ETOPS,PERM,YES,SBAS,VIA,JAM MEX PLS,NO,
N8980Q,7X8,7M8,B38M,737 MAX 8,175,2,10/27/2025,AC6573,,99503,145400,181700,181200,152800,FJ-ER,Boeing,,10/29/2025,,,1,1,0,HGS-6000,1,0,C+,NOT ETOPS,PERM,YES,SBAS,ViaSat,JAM MEX PLS,,
N937WN,7S7,7S7,B737,737-700,137,2,6/2/2009,AD01AB,,85223,121700,155000,154500,129200,,Boeing,8/31/2027,06/04/2009,,,0,1,0,HGS-4000,0,0,C1,NOT ETOPS,PERM,NO,SBAS,Anuvu,MEX,,
N8893L,7U8,7M8,B38M,737 MAX 8,175,2,11/16/2023,AC4210,,98809,145400,181700,181200,152800,HM-JQ,Boeing,2023-11-16,11/21/2023,,,1,1,0,HGS-6000,1,0,C+,NOT ETOPS,PERM,YES,SBAS,ViaSat,,,
N8814K,7U8,7M8,B38M,737 MAX 8,175,2,5/17/2021,AC247A,,98326,145400,181700,181200,152800,CP-DQ,Boeing,2021-05-17,05/18/2021,,,1,1,0,HGS-6000,0,0,C+,NOT ETOPS,PERM,NO,SBAS,Anuvu,,,
N8943Q,7U8,7M8,B38M,737 MAX 8,175,2,3/7/2025,AC5700,,99131,145400,181700,181200,152800,CM-ER,Boeing,2025-03-07,03/13/2025,,,1,1,0,HGS-6000,1,0,C+,NOT ETOPS,PERM,YES,SBAS,ViaSat,PLS,,
N8712L,7V8,7M8,B38M,737 MAX 8,175,2,9/26/2017,ABFCB6,,99187,145400,181700,181200,152800,PS-KL,Boeing,10/31/2027,09/26/2017,,,1,1,2,HGS-6000,1,4,ET,ETOPS,PERM,NO,SBAS,Anuvu,,,
N8625A,73H,73H,B738,737-800,175,2,3/9/2014,ABD94D,,91308,138300,174700,174200,146300,asmr,Boeing,4/30/2027,03/28/2014,01/13/2026,,1,1,0,HGS-4000,0,0,C1,NOT ETOPS,PERM,NO,SBAS,Anuvu,,,true
N927WN,7S7,7S7,B737,737-700,137,2,7/22/2008,ACDA2C,,85672,121700,155000,154500,129200,,Boeing,2/29/2028,07/22/2008,,,0,1,0,HGS-4000,0,0,C1,NOT ETOPS,PERM,NO,SBAS,Anuvu,MEX,,
N8828L,7U8,7M8,B38M,737 MAX 8,175,2,12/21/2022,AC28BE,,98601,145400,181700,181200,152800,DK-BL,Boeing,12/31/2029 0:00,01/10/2023,,,1,1,0,HGS-6000,1,0,C+,NOT ETOPS,PERM,YES,SBAS,Anuvu,,,
N8607M,7P8,73H,B738,737-800,175,2,1/19/2013,ABD230,,93548,138300,174700,174200,146300,BF-AL,Boeing,2/28/2026 0:00,01/23/2013,,,1,1,0,HGS-4000,0,0,C+,NOT ETOPS,PERM,NO,SBAS,Anuvu,,,
N8543Z,7A8,73H,B738,737-800,175,2,7/31/2017,ABB90D,,91791,138300,174700,174200,146300,JK-AC,Boeing,8/31/2027 0:00,08/01/2017,,,1,1,0,HGS-4000,0,0,C+,NOT ETOPS,PERM,NO,SBAS,Anuvu,,,
N7824A,73W,73W,B737,737-700,143,2,2/7/2016,AA9AD9,,85924,121700,155000,154500,129200,CSLR,Boeing,12/31/2025,04/09/2016,01/28/2026,,0,2,0,HGS-4000,0,0,C1,NOT ETOPS,PERM,NO,SBAS,Anuvu,,,true
N908WN,7S7,7S7,B737,737-700,137,2,2/6/2008,AC8EE5,,85492,121700,155000,154500,129200,,Boeing,3/31/2027 0:00,02/11/2008,,,0,2,0,HGS-4000,1,0,C+,NOT ETOPS,PERM,NO,SBAS,Anuvu,,,
N569WN,7S7,7S7,B737,737-700,137,2,11/21/2002,A74A5A,,85850,121700,155000,154500,129200,GM-CQ,Boeing,11/30/2027 0:00,04/28/2015,,,0,2,0,HGS-4000,0,0,C+,NOT ETOPS,PERM,NO,SBAS,Anuvu,,,
N8630B,7P8,73H,B738,737-800,175,2,5/17/2014,ABDC56,,93508,138300,174700,174200,146300,DR-EH,Boeing,6/30/2027 0:00,05/20/2014,,,1,1,0,HGS-4000,0,0,C+,NOT ETOPS,PERM,NO,SBAS,Anuvu,,,
N8905Q,7U8,7M8,B38M,737 MAX 8,175,2,8/9/2024,AC486A,,98899,145400,181700,181200,152800,JP-DM,Boeing,2024-08-09,08/13/2024,,,1,1,0,HGS-6000,1,0,C+,NOT ETOPS,PERM,YES,SBAS,ViaSat,PLS,,
N8874Q,7U8,7M8,B38M,737 MAX 8,175,2,7/13/2023,AC3AC9,,98742,145400,181700,181200,152800,GQ-BH,Boeing,10/15/2023,07/17/2023,,,1,1,0,HGS-6000,1,0,C+,NOT ETOPS,PERM,YES,SBAS,ViaSat,,,
N8763L,7V8,7M8,B38M,737 MAX 8,175,2,6/23/2022,AC0F6C,,99320,145400,181700,181200,152800,CP-JS,Boeing,2022-06-23,06/27/2022,,,1,1,2,HGS-6000,1,4,ET,ETOPS,PERM,NO,SBAS,Anuvu,,YES,
N8709Q,7V8,7M8,B38M,737 MAX 8,175,2,9/26/2017,ABF9F8,,99102,145400,181700,181200,152800,FM-GQ,Boeing,2017-09-26,09/25/2017,,,1,1,2,HGS-6000,1,4,ET,ETOPS,PERM,NO,SBAS,Anuvu,,,
N498WN,7S7,7S7,B737,737-700,137,2,1/17/2005,A62FD1,,85256,121700,155000,154500,129200,,Boeing,9/30/2026 0:00,12/14/2004,,,0,2,0,HGS-2350,0,0,C+,NOT ETOPS,PERM,NO,SBAS,Anuvu,,,
N7873A,7S7,7S7,B737,737-700,137,1,2/21/2004,AAAD49,,85865,121700,155000,154500,129200,AE-KS,Boeing,10/31/2028 0:00,04/20/2016,,,0,2,0,HGS-4000,0,0,C+,NOT ETOPS,PERM,NO,SBAS,Anuvu,,,
N8508W,7A8,73H,B738,737-800,175,2,11/8/2016,ABAADD,,90947,138300,174700,174200,146300,CJ-GQ,Boeing,12/31/2026 0:00,11/09/2016,,,1,1,0,HGS-4000,0,0,C+,NOT ETOPS,PERM,NO,SBAS,Anuvu,,,
N242WN,7S7,7S7,B737,737-700,137,2,6/11/2006,A2396E,,85387,121700,155000,154500,129200,,Boeing,10/31/2027 0:00,06/12/2006,,,0,2,0,HGS-4000,0,0,C+,NOT ETOPS,PERM,NO,SBAS,Anuvu,,,
N8615E,73H,73H,B738,737-800,175,2,9/16/2013,ABD59A,,92167,138300,174700,174200,146300,AC-BQ,Boeing,11/30/2026,09/17/2013,09/26/2025,,1,1,0,HGS-4000,0,0,C1,NOT ETOPS,PERM,NO,SBAS,Anuvu,,,true
N1802U,7V8,7M8,B38M,737 MAX 8,175,2,5/17/2022,A1435D,,99387,145400,181700,181200,152800,CG-DH,Boeing,2022-05-17,08/24/2022,,,1,1,2,HGS-6000,1,4,ET,ETOPS,PERM,NO,SBAS,Anuvu,,YES,
N290WN,7S7,7S7,B737,737-700,137,2,8/23/2007,A2F77B,,85451,121700,155000,154500,129200,,Boeing,5/31/2028 0:00,08/23/2007,,,0,2,0,HGS-4000,0,0,C+,NOT ETOPS,PERM,NO,SBAS,Anuvu,,,
N8996Q,7M8,7M8,B38M,737 MAX 8,175,2,3/25/2025,,,90000,145000,174700,174200,151500,,Boeing,,,,,,,,,,,C1,NOT ETOPS,PERM,,,,,,
N7733B,7R7,7S7,B737,737-700,137,2,9/21/2006,AA76EF,,86465,121700,155000,154500,129200,CM-HK,Boeing,5/31/2029 0:00,10/20/2014,,,0,2,0,HGS-4000,1,3,OW,NOT ETOPS,PERM,NO,SBAS,Anuvu,,,
N8704Q,7V8,7M8,B38M,737 MAX 8,175,2,12/26/2017,ABF949,,99539,145400,181700,181200,152800,AK-MS,Boeing,1/31/2028 0:00,12/26/2017,,,1,1,2,HGS-6000,1,4,ET,ETOPS,PERM,YES,SBAS,Anuvu,,,
N495WN,7S7,7S7,B737,737-700,137,2,12/22/2004,A624AC,,85718,121700,155000,154500,129200,,Boeing,6/30/2026 0:00,11/14/2004,,,0,2,0,HGS-2350,0,0,C+,NOT ETOPS,PERM,NO,SBAS,Anuvu,,,
N8760L,7V8,7M8,B38M,737 MAX 8,175,2,6/23/2022,AC0F03,,99256,145400,181700,181200,152800,EP-DG,Boeing,6/30/2029,06/28/2022,,,1,1,2,HGS-6000,1,4,ET,ETOPS,PERM,NO,SBAS,Anuvu,,YES,
N412WN,73W,73W,B737,737-700,143,2,8/2/2001,,,85484,121700,155000,154500,129200,,Boeing,2001-10-01,08/02/2001,04/18/2025,,0,2,0,HGS-2350,0,0,C1,NOT ETOPS,PERM,NO,SBAS,Anuvu,MEX,,true
N7737E,7R7,7S7,B737,737-700,137,1,12/5/2006,AA777E,,86211,121700,155000,154500,129200,DE-BC,Boeing,8/31/2027 0:00,08/17/2014,,,0,2,0,HGS-4000,0,3,OW,NOT ETOPS,PERM,NO,SBAS,Anuvu,,,
N962WN,7S7,7S7,B737,737-700,137,2,7/27/2011,AD6595,,85261,121700,155000,154500,129200,,Boeing,8/31/2027,07/29/2011,,,0,1,0,HGS-4000,0,0,C1,NOT ETOPS,PERM,NO,SBAS,Anuvu,MEX,,
N8899H,7U8,7M8,B38M,737 MAX 8,175,2,8/15/2023,AC42DF,,98845,145400,181700,181200,152800,JL-CH,Boeing,2023-08-15,09/29/2023,,,1,1,0,HGS-6000,1,0,C+,NOT ETOPS,PERM,YES,SBAS,ViaSat,,,
N7751A,7R7,7S7,B737,737-700,137,1,2/20/2008,AA7E16,,86278,121700,155000,154500,129200,QR-BD,Boeing,6/30/2027 0:00,02/14/2014,,,0,2,0,HGS-4000,0,3,OW,NOT ETOPS,PERM,NO,SBAS,Anuvu,,,
N8510E,7A8,73H,B738,737-800,175,2,11/17/2016,ABAD6C,,91863,138300,174700,174200,146300,DK-FR,Boeing,12/31/2026 0:00,11/22/2016,,,1,1,0,HGS-4000,0,0,C+,NOT ETOPS,PERM,NO,SBAS,Anuvu,,,
N255WN,7S7,7S7,B737,737-700,137,2,9/12/2006,A26C12,,85025,121700,155000,154500,129200,,Boeing,8/31/2028 0:00,09/18/2006,,,0,2,0,HGS-4000,0,0,C+,NOT ETOPS,PERM,NO,SBAS,Anuvu,,,
N914WN,7S7,7S7,B737,737-700,137,2,3/7/2008,ACA788,,85462,121700,155000,154500,129200,,Boeing,3/31/2027,03/07/2008,,,0,2,0,HGS-4000,1,0,C+,NOT ETOPS,PERM,NO,SBAS,Anuvu,,,
N289CT,7S7,7S7,B737,737-700,137,2,8/14/2007,A2EFAE,,85221,121700,155000,154500,129200,,Boeing,5/31/2028 0:00,08/15/2007,,,0,2,0,HGS-4000,0,0,C+,NOT ETOPS,PERM,NO,SBAS,Anuvu,,,
N474WN,7S7,7S7,B737,737-700,137,2,7/23/2004,A5D1F7,,85519,121700,155000,154500,129200,,Boeing,2/29/2028 0:00,07/15/2004,,,0,2,0,HGS-2350,0,0,C+,NOT ETOPS,PERM,NO,SBAS,Anuvu,,,
N8759Q,7V8,7M8,B38M,737 MAX 8,175,2,5/25/2022,AC0C8B,,99301,145400,181700,181200,152800,CD-AP,Boeing,2022-05-25,05/31/2022,,,1,1,2,HGS-6000,1,4,ET,ETOPS,PERM,NO,SBAS,Anuvu,,YES,
N8551Q,7A8,73H,B738,737-800,175,2,10/24/2017,ABBC75,,90745,138300,174700,174200,146300,DE-KS,Boeing,11/30/2027 0:00,10/24/2017,,,1,1,0,HGS-4000,0,0,C+,NOT ETOPS,PERM,NO,SBAS,Anuvu,,,
N420WN,73W,73W,B737,737-700,143,2,1/7/2002,A4FDA0,,85635,121700,155000,154500,129200,,Boeing,6/30/2027,01/09/2002,09/03/2025,,0,2,0,HGS-2350,0,0,C1,NOT ETOPS,PERM,NO,SBAS,Anuvu,,,true
N295WN,7S7,7S7,B737,737-700,137,2,10/27/2007,A30A0E,,85531,121700,155000,154500,129200,,Boeing,10/20/2028,10/29/2007,,,0,2,0,HGS-4000,1,0,C+,NOT ETOPS,PERM,NO,SBAS,Anuvu,,,
N924WN,7S7,7S7,B737,737-700,137,2,6/26/2008,ACCF07,,85551,121700,155000,154500,129200,,Boeing,10/31/2027 0:00,06/24/2008,,,0,2,0,HGS-4000,0,0,C+,NOT ETOPS,PERM,NO,SBAS,Anuvu,,,
N7846A,73W,73W,B737,737-700,143,2,8/7/2007,AAA28D,,86607,121700,155000,154500,129200,GR-AF,Boeing,8/31/2028,02/05/2016,11/14/2025,,0,2,0,HGS-4000,0,0,C1,NOT ETOPS,PERM,NO,SBAS,Anuvu,,,true
N8519R,7A8,73H,B738,737-800,175,2,1/24/2017,ABAEB2,,91956,138300,174700,174200,146300,GM-JQ,Boeing,2/28/2027 0:00,01/25/2017,,,1,1,0,HGS-4000,0,0,C+,NOT ETOPS,PERM,NO,SBAS,Anuvu,,,
N932WN,7S7,7S7,B737,737-700,137,2,3/12/2009,ACEF18,,85438,121700,155000,154500,129200,,Boeing,6/1/2026,03/17/2009,,,0,1,0,HGS-4000,0,0,C1,NOT ETOPS,PERM,NO,SBAS,Anuvu,MEX,,
N8761L,7V8,7M8,B38M,737 MAX 8,175,2,6/1/2022,AC0F26,,99304,145400,181700,181200,152800,JL-FH,Boeing,2022-06-01,06/06/2022,,,1,1,2,HGS-6000,1,4,ET,ETOPS,PERM,NO,SBAS,Anuvu,,YES,
N8915Q,7U8,7M8,B38M,737 MAX 8,175,2,1/17/2024,AC4C21,,99060,145400,181700,181200,152800,LP-FM,Boeing,,01/25/2024,,,1,1,0,HGS-6000,1,0,C+,NOT ETOPS,PERM,YES,SBAS,ViaSat,PLS,,
N8669B,7P8,73H,B738,737-800,175,2,6/5/2015,ABE8B6,,93618,138300,174700,174200,146300,MP-FK,Boeing,6/30/2028 0:00,06/03/2015,,,1,1,0,HGS-4000,0,0,C+,NOT ETOPS,PERM,NO,SBAS,Anuvu,,,
N279WN,7S7,7S7,B737,737-700,137,2,6/11/2007,A2C9EC,,85761,121700,155000,154500,129200,,Boeing,8/31/2027 0:00,06/11/2007,,,0,2,0,HGS-4000,0,0,C+,NOT ETOPS,PERM,NO,SBAS,Anuvu,,,
N8554X,7A8,73H,B738,737-800,175,2,12/6/2017,ABBCE5,,91415,138300,174700,174200,146300,JL-EK,Boeing,12/31/2027 0:00,12/08/2017,,,1,1,0,HGS-4000,0,0,C+,NOT ETOPS,PERM,NO,SBAS,Anuvu,,,
N8518R,7A8,73H,B738,737-800,175,2,12/20/2016,ABAE8F,,91956,138300,174700,174200,146300,FS-BP,Boeing,1/31/2027 0:00,12/21/2016,,,1,1,0,HGS-4000,0,0,C+,NOT ETOPS,PERM,NO,SBAS,Anuvu,,,
N463WN,7S7,7S7,B737,737-700,137,2,6/4/2004,A5A6C1,,85922,121700,155000,154500,129200,,Boeing,10/31/2027 0:00,06/06/2004,,,0,2,0,HGS-2350,0,0,C+,NOT ETOPS,PERM,NO,SBAS,Anuvu,,,
N8742M,7V8,7M8,B38M,737 MAX 8,175,2,1/11/2021,AC07DC,,98073,145400,181700,181200,152800,AJ-HP,Boeing,2021-01-11,01/18/2021,,,1,1,2,HGS-6000,1,4,C2,ETOPS,PERM,NO,SBAS,Anuvu,,,
N8694E,7A8,73H,B738,737-800,175,2,8/4/2016,ABF32F,,90937,138300,174700,174200,146300,AE-BS,Boeing,9/30/2026 0:00,08/05/2016,,,1,1,0,HGS-4000,0,0,C+,NOT ETOPS,PERM,NO,SBAS,Anuvu,,,
N280WN,7S7,7S7,B737,737-700,137,2,6/20/2007,A2CFFC,Missouri One,85789,121700,155000,154500,129200,,Boeing,8/31/2027 0:00,06/20/2007,,,0,2,0,HGS-4000,0,0,C+,NOT ETOPS,PERM,NO,SBAS,Anuvu,,,
N292WN,7S7,7S7,B737,737-700,137,2,9/14/2007,A2FEE9,,85256,121700,155000,154500,129200,,Boeing,8/31/2025 0:00,09/18/2007,,,0,2,0,HGS-4000,1,0,C+,NOT ETOPS,PERM,NO,SBAS,Anuvu,,,
N8686A,7P8,73H,B738,737-800,175,2,5/2/2016,ABEFBA,,92809,138300,174700,174200,146300,CD-KS,Boeing,6/30/2026,05/06/2016,,,1,1,0,HGS-4000,0,0,C+,NOT ETOPS,PERM,NO,SBAS,Anuvu,,,
N8567Z,7A8,73H,B738,737-800,175,2,3/19/2018,ABC107,,91756,138300,174700,174200,146300,PQ-BL,Boeing,2018-03-19,03/20/2018,,,1,1,0,HGS-4000,0,0,C+,NOT ETOPS,PERM,NO,SBAS,Anuvu,,,
N8737L,7V8,7M8,B38M,737 MAX 8,175,2,12/3/2020,AC04D3,,98313,145400,181700,181200,152800,HM-GP,Boeing,2020-12-03,12/19/2020,,,1,1,2,HGS-6000,1,4,ET,ETOPS,PERM,NO,SBAS,Anuvu,,,
N8621A,73H,73H,B738,737-800,175,2,11/26/2013,ABD8C1,,92315,138300,174700,174200,146300,HP-BJ,Boeing,1/31/2027,12/02/2013,11/01/2024,,1,1,0,CAT I,0,0,C1,NOT ETOPS,PERM,NO,SBAS,Anuvu,MEX,,true
N8973S,7X8,7M8,B38M,737 MAX 8,175,2,10/4/2025,AC6227,,99448,145400,181700,181200,152800,HS-AP,Boeing,,10/08/2025,,,1,1,0,HGS-6000,1,0,C+,NOT ETOPS,PERM,YES,SBAS,VIA,JAM MEX PLS,,
N8561Z,7A8,73H,B738,737-800,175,2,1/21/2018,ABC035,,91265,138300,174700,174200,146300,CL-EP,Boeing,7/31/2027 0:00,01/22/2018,,,1,1,0,HGS-4000,0,0,C+,NOT ETOPS,PERM,NO,SBAS,Anuvu,,,
N8617E,73H,73H,B738,737-800,175,2,9/24/2013,ABD5E0,,92048,138300,174700,174200,146300,AF-MR,Boeing,11/30/2026,09/29/2013,09/10/2025,,1,1,0,HGS-4000,0,0,C1,NOT ETOPS,PERM,NO,SBAS,Anuvu,,,true
N7704B,7S7,7S7,B737,737-700,137,1,9/14/2004,AA6BED,,85804,121700,155000,154500,129200,BQ-HL,Boeing,7/31/2028 0:00,07/11/2012,,,0,2,0,HGS-4000,0,0,C+,NOT ETOPS,PERM,NO,SBAS,Anuvu,,,
N951WN,7S7,7S7,B737,737-700,137,2,8/28/2010,AD3A5F,,85531,121700,155000,154500,129200,,Boeing,5/31/2028,08/26/2010,,,0,1,0,HGS-4000,0,0,C1,NOT ETOPS,PERM,NO,SBAS,Anuvu,MEX,,
N7749B,7R7,7S7,B737,737-700,137,1,2/23/2009,AA7B78,,86355,121700,155000,154500,129200,PR-KS,Boeing,9/30/2027,09/18/2014,,,1,1,0,HGS-4000,0,3,OW,NOT ETOPS,PERM,NO,SBAS,Anuvu,,,
N8948Q,7U8,7M8,B38M,737 MAX 8,175,2,4/15/2025,AC57AF,,98943,145400,181700,181200,152800,CR-FJ,Boeing,2025-04-15,04/21/2025,,,1,1,0,HGS-6000,1,0,C+,NOT ETOPS,PERM,YES,SBAS,ViaSat,PLS,,
N8971L,7U8,7M8,B38M,737 MAX 8,175,2,9/11/2025,AC61DB,,99099,145400,181700,181200,152800,CL-DM,Boeing,,09/16/2025,,,1,1,0,HGS-6000,1,0,C+,NOT ETOPS,PERM,YES,SBAS,ViaSat,JAM MEX PLS,,
N8715Q,7V8,7M8,B38M,737 MAX 8,175,2,11/6/2017,ABFD23,,99351,145400,181700,181200,152800,AG-BQ,Boeing,2017-11-06,11/06/2017,,,1,1,2,HGS-6000,1,4,OW,ETOPS,PERM,YES,SBAS,Anuvu,,,
N8960L,7U8,7M8,B38M,737 MAX 8,175,2,6/23/2025,AC5E01,,98886,145400,181700,181200,152800,AM-ES,Boeing,2025-06-23,06/25/2025,,,1,1,0,HGS-6000,1,0,C+,NOT ETOPS,PERM,YES,SBAS,ViaSat,MEX PLS,,
N7738A,7S7,7S7,B737,737-700,137,1,12/20/2006,AA779D,,86159,121700,155000,154500,129200,DE-BF,Boeing,10/31/2028 0:00,09/29/2012,,,0,2,0,HGS-4000,0,0,C+,NOT ETOPS,PERM,NO,SBAS,Anuvu,,,
N237WN,73W,73W,B737,737-700,143,2,4/26/2006,A22482,,85640,121700,155000,154500,129200,,Boeing,8/31/2027,03/20/2006,01/16/2026,,0,2,0,HGS-4000,0,0,C1,NOT ETOPS,PERM,NO,SBAS,Anuvu,,,true
N8649A,7A8,73H,B738,737-800,175,2,9/23/2014,ABE147,,92687,138300,174700,174200,146300,LM-BP,Boeing,10/31/2027 0:00,09/23/2014,,,1,1,0,HGS-4000,0,0,C+,NOT ETOPS,PERM,NO,SBAS,Anuvu,,,
N8870K,7U8,7M8,B38M,737 MAX 8,175,2,5/4/2023,AC3A38,,98763,145400,181700,181200,152800,GM-DR,Boeing,2023-05-04,05/10/2023,,,1,1,0,HGS-6000,1,0,C+,NOT ETOPS,PERM,YES,SBAS,ViaSat,,,
N8317M,7R8,73H,B738,737-800,175,2,7/31/2012,AB5F6A,,92056,138300,174700,174200,146300,AJ-MR,Boeing,8/31/2028,08/01/2012,,,1,1,2,HGS-4000,1,4,ET,ETOPS,PERM,NO,SBAS,Anuvu,,,
N8545V,7A8,73H,B738,737-800,175,2,8/30/2017,ABB94F,,92835,138300,174700,174200,146300,KM-AE,Boeing,2017-08-30,08/31/2017,,,1,1,0,HGS-4000,0,0,C+,NOT ETOPS,PERM,NO,SBAS,Anuvu,,,
N8771D,7V8,7M8,B38M,737 MAX 8,175,2,9/9/2022,AC12D6,,99451,145400,181700,181200,152800,KM-GH,Boeing,2022-09-09,09/13/2022,,,1,1,2,HGS-6000,1,4,ET,ETOPS,PERM,NO,SBAS,Anuvu,,YES,
N8783L,7V8,7M8,B38M,737 MAX 8,175,2,9/26/2022,AC16DA,,99494,145400,181700,181200,152800,GL-CE,Boeing,10/31/2029,09/29/2022,,,1,1,2,HGS-6000,1,4,ET,ETOPS,PERM,NO,SBAS,Anuvu,,YES,
N8745K,7V8,7M8,B38M,737 MAX 8,175,2,12/16/2020,AC0843,,97938,145400,181700,181200,152800,AR-ES,Boeing,2020-12-16,12/28/2020,,,1,1,2,HGS-6000,1,4,ET,ETOPS,PERM,NO,SBAS,Anuvu,,,
N8664J,7P8,73H,B738,737-800,175,2,4/6/2015,ABE80E,,92898,138300,174700,174200,146300,GS-KR,Boeing,4/30/2028,04/09/2015,,,1,1,0,HGS-4000,0,0,C+,NOT ETOPS,PERM,YES,SBAS,Anuvu,,,
N7735A,7S7,7S7,B737,737-700,137,1,10/29/2006,AA7734,,86001,121700,155000,154500,129200,CR-EQ,Boeing,9/30/2028 0:00,08/31/2012,,,0,2,0,HGS-4000,0,0,C+,NOT ETOPS,PERM,NO,SBAS,Anuvu,,,
N8937Q,7U8,7M8,B38M,737 MAX 8,175,2,12/30/2024,AC53D5,,98887,145400,181700,181200,152800,CJ-HL,Boeing,2024-12-30,01/08/2025,,,1,1,0,HGS-6000,1,0,C+,NOT ETOPS,PERM,YES,SBAS,ViaSat,PLS,,
N254WN,7S7,7S7,B737,737-700,137,2,9/1/2006,A2685B,,85624,121700,155000,154500,129200,,Boeing,5/31/2028 0:00,09/06/2006,,,0,2,0,HGS-4000,0,0,C+,NOT ETOPS,PERM,NO,SBAS,Anuvu,,,
N243WN,7S7,7S7,B737,737-700,137,2,6/17/2006,A23D25,,85234,121700,155000,154500,129200,,Boeing,10/31/2027 0:00,06/20/2006,,,0,2,0,HGS-4000,0,0,C+,NOT ETOPS,PERM,NO,SBAS,Anuvu,,,
N563WN,7R7,7S7,B737,737-700,137,1,10/4/2005,A73410,,86267,121700,155000,154500,129200,AC-BS,Boeing,2005-10-04,03/05/2015,,,0,2,0,HGS-4000,0,3,OW,NOT ETOPS,PERM,NO,SBAS,Anuvu,,,
N7843A,7S7,7S7,B737,737-700,137,1,11/4/2006,AAA224,,85768,121700,155000,154500,129200,MR-DK,Boeing,8/31/2025 0:00,11/20/2015,,,0,2,0,HGS-4000,0,0,C+,NOT ETOPS,PERM,NO,SBAS,Anuvu,,,
N8716B,7V8,7M8,B38M,737 MAX 8,175,2,10/30/2017,ABFD39,,99188,145400,181700,181200,152800,MQ-GP,Boeing,2017-10-30,10/31/2017,,,1,1,2,HGS-6000,1,4,ET,ETOPS,PERM,NO,SBAS,Anuvu,,,
N8698B,7A8,73H,B738,737-800,175,2,9/7/2016,ABF3B8,,91682,138300,174700,174200,146300,BD-ER,Boeing,10/31/2026 0:00,09/12/2016,,,1,1,0,HGS-4000,0,0,C+,NOT ETOPS,PERM,NO,SBAS,Anuvu,,,
N8904L,7U8,7M8,B38M,737 MAX 8,175,2,9/13/2023,AC4843,,98875,145400,181700,181200,152800,JP-BE,Boeing,2023-09-13,09/20/2023,,,1,1,0,HGS-6000,1,0,C+,NOT ETOPS,PERM,YES,SBAS,ViaSat,,,
N8635F,7A8,73H,B738,737-800,175,2,6/17/2014,ABDD09,,91344,138300,174700,174200,146300,FJ-EQ,Boeing,7/31/2027 0:00,06/19/2014,,,1,1,0,HGS-4000,0,0,C+,NOT ETOPS,PERM,NO,SBAS,Anuvu,,,
N400WN,73W,73W,B737,737-700,143,2,3/26/2001,A4AEA2,Adopt-A-Pilot 25th,85922,121700,155000,154500,129200,,Boeing,6/30/2027,02/05/2001,01/01/2025,,1,1,0,YES,0,0,C1,NOT ETOPS,PERM,NO,SA-ON,Anuvu,MEX,,true
N925WN,7S7,7S7,B737,737-700,137,2,6/30/2008,ACD2BE,,85926,121700,155000,154500,129200,,Boeing,9/30/2027 0:00,06/26/2008,,,0,2,0,CAT I,0,0,C+,NOT ETOPS,PERM,NO,SBAS,Anuvu,,,
N8787K,7V8,7M8,B38M,737 MAX 8,175,2,10/14/2022,AC1765,,99328,145400,181700,181200,152800,GJ-CL,Boeing,10/31/2029,10/19/2022,,,1,1,2,HGS-6000,1,4,ET,ETOPS,PERM,NO,SBAS,Anuvu,,YES,
N8623F,7A8,73H,B738,737-800,175,2,12/19/2013,ABD90C,,92098,138300,174700,174200,146300,KR-GQ,Boeing,1/31/2027 0:00,12/19/2013,,,1,1,0,HGS-4000,0,0,C+,NOT ETOPS,PERM,NO,SBAS,Anuvu,,,
N8932Q,7U8,7M8,B38M,737 MAX 8,175,2,8/29/2024,AC5326,,99021,145400,181700,181200,152800,FK-BG,Boeing,9/3/2025,09/03/2024,,,1,1,0,HGS-6000,1,0,C+,NOT ETOPS,PERM,YES,SBAS,ViaSat,PLS,,
N417WN,73W,73W,B737,737-700,143,2,11/8/2001,,Rollin King,85594,121700,155000,154500,129200,,Boeing,3/31/2027,01/29/2002,06/19/2025,,0,2,0,HGS-2350,0,0,C1,NOT ETOPS,PERM,NO,SBAS,Anuvu,,,true
N468WN,7S7,7S7,B737,737-700,137,2,6/23/2004,A5B954,,85464,121700,155000,154500,129200,,Boeing,10/31/2027 0:00,06/06/2004,,,0,2,0,HGS-2350,0,0,C+,NOT ETOPS,PERM,NO,SBAS,Anuvu,,,
N8785L,7V8,7M8,B38M,737 MAX 8,175,2,10/11/2022,AC1720,,99480,145400,181700,181200,152800,GL-BE,Boeing,2022-10-11,10/14/2022,,,1,1,2,HGS-6000,1,4,ET,ETOPS,PERM,NO,SBAS,Anuvu,,,
N8790Q,7V8,7M8,B38M,737 MAX 8,175,2,12/9/2022,AC1A2C,,99344,145400,181700,181200,152800,FL-EK,Boeing,12/31/2029,12/13/2022,,,1,1,2,HGS-6000,1,4,ET,ETOPS,PERM,NO,SBAS,Anuvu,,,
N442WN,7S7,7S7,B737,737-700,137,2,8/25/2003,A5540C,,85545,121700,155000,154500,129200,,Boeing,8/31/2028 0:00,09/02/2003,,,0,2,0,HGS-2350,0,0,C+,NOT ETOPS,PERM,NO,SBAS,Anuvu,,,
N8941Q,7U8,7M8,B38M,737 MAX 8,175,2,3/4/2025,AC56BA,,98960,145400,181700,181200,152800,CM-AB,Boeing,2025-03-04,03/07/2025,,,1,1,0,HGS-6000,1,0,C+,NOT ETOPS,PERM,YES,SBAS,ViaSat,PLS,,
N8878L,7U8,7M8,B38M,737 MAX 8,175,2,8/14/2023,AC3B51,,98724,145400,181700,181200,152800,GQ-MR,Boeing,8/17/2024 0:00,08/18/2023,,,1,1,0,HGS-6000,1,0,C+,NOT ETOPS,PERM,YES,SBAS,ViaSat,,,
N286WN,7S7,7S7,B737,737-700,137,2,7/13/2004,A2E646,,84791,121700,155000,154500,129200,,Boeing,2/29/2028 0:00,08/31/2006,,,0,2,0,HGS-2350,0,0,C+,NOT ETOPS,PERM,NO,SBAS,Anuvu,,,
N8613K,7A8,73H,B738,737-800,175,2,3/28/2013,ABD559,,92172,138300,174700,174200,146300,HJ-GK,Boeing,4/30/2026 0:00,03/28/2013,,,1,1,0,HGS-4000,0,0,C+,NOT ETOPS,PERM,NO,SBAS,Anuvu,,,
N444WN,7S7,7S7,B737,737-700,137,2,9/12/2003,A55B7A,,85264,121700,155000,154500,129200,,Boeing,,09/02/2003,,,0,2,0,HGS-2350,0,0,C+,NOT ETOPS,PERM,NO,SBAS,Anuvu,,,
N228WN,7S7,7S7,B737,737-700,137,2,12/14/2005,A200BA,,85207,121700,155000,154500,129200,,Boeing,6/30/2026 0:00,10/27/2005,,,0,2,0,HGS-4000,0,0,C+,NOT ETOPS,PERM,NO,SBAS,Anuvu,,,
N8849Q,7U8,7M8,B38M,737 MAX 8,175,2,2/27/2023,AC3053,,98776,145400,181700,181200,152800,BM-DF,Boeing,5/30/2023,03/01/2023,,,1,1,0,HGS-6000,1,0,C+,NOT ETOPS,PERM,YES,SBAS,ViaSat,,,
N1801U,7V8,7M8,B38M,737 MAX 8,175,2,4/5/2022,A1433A,,99150,145400,181700,181200,152800,BQ-KL,Boeing,2022-04-05,07/15/2022,,,1,1,2,HGS-6000,1,4,C2,ETOPS,PERM,NO,SBAS,Anuvu,,YES,
N8816Q,7U8,7M8,B38M,737 MAX 8,175,2,5/28/2021,AC24C5,,98513,145400,181700,181200,152800,QR-KP,Boeing,2021-05-28,06/04/2021,,,1,1,0,HGS-6000,0,0,C+,NOT ETOPS,PERM,NO,SBAS,Anuvu,,,
N8611F,7A8,73H,B738,737-800,175,2,2/27/2013,ABD50F,,92127,138300,174700,174200,146300,JM-BK,Boeing,3/31/2026 0:00,03/04/2013,,,1,1,0,HGS-4000,0,0,C+,NOT ETOPS,PERM,NO,SBAS,Anuvu,,,
N8989L,7X8,7M8,B38M,737 MAX 8,175,2,12/15/2025,AC66AA,,99553,145400,181700,181200,152800,DS-CK,Boeing,,12/18/2025,,,1,1,0,HGS-6000,1,0,C+,NOT ETOPS,PERM,YES,SBAS,VIA,JAM MEX PLS,,
N8614M,7A8,73H,B738,737-800,175,2,4/15/2013,ABD57E,,92482,138300,174700,174200,146300,EL-BG,Boeing,5/31/2026 0:00,04/16/2013,,,1,1,0,HGS-4000,0,0,C+,NOT ETOPS,PERM,YES,SBAS,Anuvu,,,
N968WN,7S7,7S7,B737,737-700,137,2,12/16/2011,AD7BDF,,85584,121700,155000,154500,129200,,Boeing,1/31/2028,12/19/2011,,,0,1,0,HGS-4000,0,0,C1,NOT ETOPS,PERM,NO,SBAS,Anuvu,MEX,,
N943WN,7S7,7S7,B737,737-700,137,2,3/3/2010,AD1A4E,,85594,121700,155000,154500,129200,,Boeing,12/31/2026,03/04/2010,,,0,1,0,HGS-4000,0,0,C1,NOT ETOPS,PERM,NO,SBAS,Anuvu,MEX,,
N8789Q,7V8,7M8,B38M,737 MAX 8,175,2,11/10/2022,AC17B0,,99442,145400,181700,181200,152800,FM-AH,Boeing,2022-11-10,11/15/2022,,,1,1,2,HGS-6000,1,4,ET,ETOPS,PERM,NO,SBAS,Anuvu,,,
N906WN,7R7,7S7,B737,737-700,137,2,1/21/2008,AC8777,,86186,121700,155000,154500,129200,,Boeing,9/30/2026,01/23/2008,,,0,2,0,HGS-4000,1,3,OW,NOT ETOPS,PERM,NO,SBAS,Anuvu,,,
N8868L,7U8,7M8,B38M,737 MAX 8,175,2,5/15/2023,AC379A,,98715,145400,181700,181200,152800,FS-AK,Boeing,2023-05-15,05/18/2023,,,1,1,0,HGS-6000,1,0,C+,NOT ETOPS,PERM,YES,SBAS,ViaSat,,,
N233LV,73W,73W,B737,737-700,143,2,3/11/2006,A214B3,,85460,121700,155000,154500,129200,,Boeing,3/31/2027,03/13/2006,12/19/2025,,0,2,0,HGS-4000,0,0,C1,NOT ETOPS,PERM,NO,SBAS,Anuvu,,,true
N407WN,73W,73W,B737,737-700,143,2,7/26/2001,A4C8A3,,85164,121700,155000,154500,129200,,Boeing,2/29/2028,01/01/1995,01/31/2025,,0,2,0,CAT I,0,0,C1,NOT ETOPS,PERM,NO,SBAS,Anuvu,MEX,,true
N7865A,73W,73W,B737,737-700,143,1,6/15/2002,AAA9D8,,85940,121700,155000,154500,129200,GS-JL,Boeing,8/31/2027,01/07/2018,12/26/2025,,0,2,0,HGS-4000,0,0,C1,NOT ETOPS,PERM,NO,SBAS,Anuvu,,,true
N8970Q,7U8,7M8,B38M,737 MAX 8,175,2,9/5/2025,AC61BC,,99156,145400,181700,181200,152800,DQ-EP,Boeing,,09/12/2025,,,1,1,0,HGS-6000,1,0,C+,NOT ETOPS,PERM,YES,SBAS,ViaSat,JAM MEX PLS,,
N920WN,7S7,7S7,B737,737-700,137,2,4/30/2008,ACC02B,,84955,121700,155000,154500,129200,,Boeing,8/31/2027 0:00,05/01/2008,,,0,2,0,HGS-4000,1,0,C+,NOT ETOPS,PERM,NO,SBAS,Anuvu,,,
N8857Q,7U8,7M8,B38M,737 MAX 8,175,2,3/16/2023,AC33C4,,98661,145400,181700,181200,152800,AH-CE,Boeing,2023-03-16,03/21/2023,,,1,1,0,HGS-6000,1,0,C+,NOT ETOPS,PERM,YES,SBAS,ViaSat,,,
N291WN,7S7,7S7,B737,737-700,137,2,9/9/2007,A2FB32,,85801,121700,155000,154500,129200,,Boeing,5/31/2028 0:00,09/12/2007,,,0,2,0,HGS-4000,1,0,C+,NOT ETOPS,PERM,NO,SBAS,Anuvu,,,
N8775Q,7V8,7M8,B38M,737 MAX 8,175,2,9/14/2022,AC136D,,99484,145400,181700,181200,152800,JL-DK,Boeing,9/30/2029,09/20/2022,,,1,1,2,HGS-6000,1,4,ET,ETOPS,PERM,NO,SBAS,Anuvu,,YES,
N7878A,7S7,7S7,B737,737-700,137,2,8/6/2005,AAADF8,,85868,121700,155000,154500,129200,MS-HR,Boeing,12/31/2026 0:00,09/16/2016,,,0,2,0,HGS-4000,0,0,C+,NOT ETOPS,PERM,NO,SBAS,Anuvu,,,
N8969S,7U8,7M8,B38M,737 MAX 8,175,2,9/5/2025,AC5F42,,98989,145400,181700,181200,152800,CK-LP,Boeing,,09/10/2025,,,1,1,0,HGS-6000,1,0,C+,NOT ETOPS,PERM,YES,SBAS,ViaSat,JAM MEX PLS,,
N8720L,7V8,7M8,B38M,737 MAX 8,175,2,7/29/2018,AC0027,,99109,145400,181700,181200,152800,AF-BQ,Boeing,2018-07-29,06/12/2018,,,1,1,2,HGS-6000,1,4,C2,ETOPS,PERM,YES,SBAS,Anuvu,,,
N8829Q,7U8,7M8,B38M,737 MAX 8,175,2,12/14/2022,AC28E5,,98904,145400,181700,181200,152800,DJ-GL,Boeing,12/31/2029,12/20/2022,,,1,1,0,HGS-6000,1,0,C+,NOT ETOPS,PERM,NO,SBAS,Anuvu,,,
N7746C,7R7,7S7,B737,737-700,137,1,6/14/2007,AA7B10,,86584,121700,155000,154500,129200,DG-JL,Boeing,7/31/2026 0:00,06/05/2013,,,0,2,0,HGS-4000,0,3,OW,NOT ETOPS,PERM,NO,SBAS,Anuvu,,,
N7849A,73W,73W,B737,737-700,143,2,3/19/2006,AAA2F6,,86108,121700,155000,154500,129200,PR-AK,Boeing,3/31/2026,07/29/2016,10/28/2025,,0,2,0,HGS-4000,0,0,C1,NOT ETOPS,PERM,NO,SBAS,Anuvu,,,true
N8568Z,7A8,73H,B738,737-800,175,2,4/13/2018,ABC12A,,91550,138300,174700,174200,146300,MP-JS,Boeing,5/31/2028,04/13/2018,,,1,1,0,HGS-4000,0,0,C+,NOT ETOPS,PERM,NO,SBAS,Anuvu,,,
N8565Z,7A8,73H,B738,737-800,175,2,2/19/2018,ABC0C1,,91065,138300,174700,174200,146300,BK-DM,Boeing,7/31/2027 0:00,02/21/2018,,,1,1,0,HGS-4000,0,0,C+,NOT ETOPS,PERM,NO,SBAS,Anuvu,,,
N8907L,7U8,7M8,B38M,737 MAX 8,175,2,2/15/2024,AC48AC,,98976,145400,181700,181200,152800,JQ-DR,Boeing,2024-02-15,02/22/2024,,,1,1,0,HGS-6000,1,0,C+,NOT ETOPS,PERM,YES,SBAS,ViaSat,PLS,,
N8858K,7U8,7M8,B38M,737 MAX 8,175,2,3/28/2023,AC33E2,,98746,145400,181700,181200,152800,AS-HP,Boeing,6/28/2023 0:00,03/30/2023,,,1,1,0,HGS-6000,1,0,C+,NOT ETOPS,PERM,YES,SBAS,ViaSat,,,
N8777Q,7V8,7M8,B38M,737 MAX 8,175,2,9/9/2022,AC13B3,,99421,145400,181700,181200,152800,HK-DJ,Boeing,9/30/2029,09/14/2022,,,1,1,2,HGS-6000,1,4,ET,ETOPS,PERM,NO,SBAS,Anuvu,,YES,
N7820L,7R7,7S7,B737,737-700,137,2,11/21/2002,AA9A57,,86377,121700,155000,154500,129200,DH-MP,Boeing,12/31/2027 0:00,07/22/2015,,,0,2,0,HGS-4000,0,3,OW,NOT ETOPS,PERM,NO,SBAS,Anuvu,,,
N903WN,7S7,7S7,B737,737-700,137,2,1/5/2008,AC7C52,,85081,121700,155000,154500,129200,,Boeing,1/31/2028 0:00,01/08/2008,,,0,2,0,HGS-4000,0,0,C+,NOT ETOPS,PERM,NO,SBAS,Anuvu,,,
N8537Z,7A8,73H,B738,737-800,175,2,6/18/2017,ABB5E2,,91468,138300,174700,174200,146300,CG-ER,Boeing,7/31/2027 0:00,06/20/2017,,,1,1,0,HGS-4000,0,0,C+,NOT ETOPS,PERM,NO,SBAS,Anuvu,,,
N8310C,7R8,73H,B738,737-800,175,2,5/30/2012,AB5E6C,,91690,138300,174700,174200,146300,GP-CS,Boeing,2012-05-30,06/04/2012,,,1,1,2,HGS-4000,1,4,ET,ETOPS,PERM,NO,SBAS,Anuvu,,,
N288WN,7S7,7S7,B737,737-700,137,2,8/15/2007,A2EDB4,,85684,121700,155000,154500,129200,,Boeing,5/31/2028 0:00,08/13/2007,,,0,2,0,HGS-4000,1,0,C+,NOT ETOPS,PERM,NO,SBAS,Anuvu,,,
N8912Q,7U8,7M8,B38M,737 MAX 8,175,2,12/6/2023,AC4BB8,,98923,145400,181700,181200,152800,KQ-JM,Boeing,2023-12-06,12/11/2023,,,1,1,0,HGS-6000,1,0,C+,NOT ETOPS,PERM,YES,SBAS,ViaSat,,,
N294WN,7S7,7S7,B737,737-700,137,2,9/25/2007,A30657,,85366,121700,155000,154500,129200,,Boeing,8/31/2025 0:00,10/01/2007,,,0,2,0,HGS-4000,1,0,C+,NOT ETOPS,PERM,NO,SBAS,Anuvu,,,
N7852A,7S7,7S7,B737,737-700,137,2,10/2/2006,AAA5B8,,86054,121700,155000,154500,129200,MS-CQ,Boeing,10/31/2026 0:00,02/20/2017,,,0,2,0,HGS-4000,0,0,C+,NOT ETOPS,PERM,NO,SBAS,Anuvu,,,
N8983Q,7X8,7M8,B38M,737 MAX 8,175,2,11/20/2025,AC65DC,,99649,145400,181700,181200,152800,EP-BD,Boeing,,11/25/2025,,,1,1,0,HGS-6000,1,0,C+,NOT ETOPS,PERM,YES,SBAS,VIA,JAM MEX PLS,NO,
N8997Q,7M8,7M8,B38M,737 MAX 8,175,2,3/25/2025,,,90000,145000,174700,174200,151500,,Boeing,,,,,,,,,,,C1,NOT ETOPS,PERM,,,,,,
N8681M,7A8,73H,B738,737-800,175,2,2/19/2016,ABEF16,Triple Crown,92339,138300,174700,174200,146300,AQ-GS,Boeing,3/31/2026 0:00,02/23/2016,,,1,1,0,HGS-4000,0,0,C+,NOT ETOPS,PERM,NO,SBAS,Anuvu,,,
N7845A,73W,73W,B737,737-700,143,2,2/14/2006,AAA26A,,85108,121700,155000,154500,129200,PR-BF,Boeing,2/28/2026,08/17/2016,12/19/2025,,0,2,0,HGS-4000,0,0,C1,NOT ETOPS,PERM,NO,SBAS,Anuvu,,,true
N934WN,73W,73W,B737,737-700,143,2,4/21/2009,ACF686,,85044,121700,155000,154500,129200,,Boeing,8/31/2027,04/20/2009,04/13/2025,,0,1,0,HGS-4000,0,0,C1,NOT ETOPS,PERM,NO,SBAS,Anuvu,MEX,,
N8719Q,7V8,7M8,B38M,737 MAX 8,175,2,7/20/2018,ABFDAF,,98816,145400,181700,181200,152800,AD-EH,Boeing,2018-07-20,06/12/2018,,,1,1,2,HGS-6000,1,4,ET,ETOPS,PERM,NO,SBAS,Anuvu,,,
N258WN,7S7,7S7,B737,737-700,137,2,10/14/2006,A27737,,85592,121700,155000,154500,129200,,Boeing,11/30/2025 0:00,10/17/2006,,,0,2,0,HGS-4000,0,0,C+,NOT ETOPS,PERM,NO,SBAS,Anuvu,,,
N8314L,7R8,73H,B738,737-800,175,2,7/9/2012,AB5F00,,93310,138300,174700,174200,146300,BD-FS,Boeing,2012-07-09,07/10/2012,,,1,1,2,HGS-4000,1,4,ET,ETOPS,PERM,NO,SBAS,Anuvu,,,
N8642E,73H,73H,B738,737-800,175,2,7/31/2014,ABE056,Heart One,92573,138300,174700,174200,146300,HL-ES,Boeing,8/31/2027,08/06/2014,01/30/2026,,1,1,0,HGS-4000,0,0,C1,NOT ETOPS,PERM,NO,SBAS,Anuvu,,,true
N244WN,7S7,7S7,B737,737-700,137,2,6/24/2006,A240DC,,85567,121700,155000,154500,129200,,Boeing,2/28/2025,06/28/2006,,,0,2,0,HGS-4000,0,0,C+,NOT ETOPS,PERM,NO,SBAS,Anuvu,,,
N566WN,7S7,7S7,B737,737-700,137,2,10/18/2002,A73F35,,85620,121700,155000,154500,129200,ES-FK,Boeing,10/31/2027 0:00,03/01/2015,,,0,2,0,HGS-4000,0,0,C+,NOT ETOPS,PERM,NO,SBAS,Anuvu,,,
N410WN,73W,73W,B737,737-700,143,2,9/24/2001,A4D621,,86107,121700,155000,154500,129200,,Boeing,12/31/2026,10/01/2001,09/05/2025,,0,2,0,HGS-2350,0,0,C1,NOT ETOPS,PERM,NO,SBAS,Anuvu,,,true
N443WN,7S7,7S7,B737,737-700,137,2,9/2/2003,A557C3,Ronald McDonald - Spirit of Hope,85385,121700,155000,154500,129200,,Boeing,10/27/2028 0:00,09/02/2003,,,0,2,0,HGS-2350,0,0,C+,NOT ETOPS,PERM,NO,SBAS,Anuvu,,,
N8302F,7R8,73H,B738,737-800,175,2,3/25/2012,AB5AFE,,92997,138300,174700,174200,146300,GP-DQ,Boeing,2012-03-25,03/26/2012,,,1,1,2,HGS-4000,1,4,ET,ETOPS,PERM,NO,SBAS,Anuvu,,,
N8657B,7P8,73H,B738,737-800,175,2,1/11/2015,ABE4B9,,93091,138300,174700,174200,146300,CG-LQ,Boeing,1/31/2028 0:00,12/24/2014,,,1,1,0,HGS-4000,0,0,C+,NOT ETOPS,PERM,YES,SBAS,Anuvu,,,
N8569Z,7A8,73H,B738,737-800,175,2,4/18/2018,ABC14D,,91323,138300,174700,174200,146300,MP-DS,Boeing,5/31/2028 0:00,04/19/2018,,,1,1,0,HGS-4000,0,0,C+,NOT ETOPS,PERM,NO,SBAS,Anuvu,,,
N7825A,7S7,7S7,B737,737-700,137,2,3/4/2003,AA9AFC,,85905,121700,155000,154500,129200,DQ-AS,Boeing,2/29/2028 0:00,08/11/2015,,,0,2,0,HGS-4000,0,0,C+,NOT ETOPS,PERM,NO,SBAS,Anuvu,,,
N8641B,7A8,73H,B738,737-800,175,2,7/25/2014,ABE030,,92542,138300,174700,174200,146300,QR-KM,Boeing,8/31/2027 0:00,07/25/2014,,,1,1,0,HGS-4000,0,0,C+,NOT ETOPS,PERM,YES,SBAS,Anuvu,,,
N8667D,7P8,73H,B738,737-800,175,2,5/4/2015,ABE872,,93746,138300,174700,174200,146300,MP-ES,Boeing,6/30/2028,05/06/2015,,,1,1,0,HGS-4000,0,0,C+,NOT ETOPS,PERM,YES,SBAS,Anuvu,,,
N8832H,7U8,7M8,B38M,737 MAX 8,175,2,12/27/2022,AC2BA0,,98937,145400,181700,181200,152800,DH-CE,Boeing,1/31/2034 0:00,01/10/2023,,,1,1,0,HGS-6000,1,0,C+,NOT ETOPS,PERM,YES,SBAS,Anuvu,,,
N917WN,7S7,7S7,B737,737-700,137,2,4/1/2008,ACB2AD,,84917,121700,155000,154500,129200,,Boeing,6/30/2027 0:00,04/02/2008,,,0,2,0,HGS-4000,1,0,C+,NOT ETOPS,PERM,NO,SBAS,Anuvu,,,
N8947Q,7U8,7M8,B38M,737 MAX 8,175,2,4/7/2025,AC578C,,99003,145400,181700,181200,152800,CR-DP,Boeing,2025-04-07,04/10/2025,,,1,1,0,HGS,1,0,C+,NOT ETOPS,PERM,YES,SBAS,ViaSat,PLS,,
N408WN,73W,73W,B737,737-700,143,2,9/2/2001,A4CC5A,,85539,121700,155000,154500,129200,,Boeing,8/31/2025,07/24/2001,02/20/2025,,0,2,0,CAT I,0,0,C1,NOT ETOPS,PERM,NO,SBAS,Anuvu,MEX,,true
N8552Z,7A8,73H,B738,737-800,175,2,11/16/2017,ABBCA1,,91290,138300,174700,174200,146300,KM-CE,Boeing,12/31/2027 0:00,11/16/2017,,,1,1,0,HGS-4000,0,0,C+,NOT ETOPS,PERM,NO,SBAS,Anuvu,,,
N436WN,7S7,7S7,B737,737-700,137,2,6/26/2003,A53B69,,85557,121700,155000,154500,129200,,Boeing,5/31/2028 0:00,06/29/2003,,,0,2,0,HGS-2350,0,0,C+,NOT ETOPS,PERM,NO,SBAS,Anuvu,,,
N257WN,7S7,7S7,B737,737-700,137,2,9/23/2006,A27380,,85621,121700,155000,154500,129200,,Boeing,8/31/2028 0:00,09/27/2006,,,0,2,0,HGS-4000,0,0,C+,NOT ETOPS,PERM,NO,SBAS,Anuvu,,,
N8711Q,7V8,7M8,B38M,737 MAX 8,175,2,9/13/2017,ABFC97,,99171,145400,181700,181200,152800,LM-EP,Boeing,2017-09-13,08/28/2017,,,1,1,2,HGS-6000,1,4,ET,ETOPS,PERM,NO,SBAS,Anuvu,,,
N959WN,7S7,7S7,B737,737-700,137,2,6/28/2011,AD5817,,84946,121700,155000,154500,129200,,Boeing,7/31/2027,06/29/2011,,,0,1,0,HGS-4000,0,0,C1,NOT ETOPS,PERM,NO,SBAS,Anuvu,MEX,,
N8723Q,7V8,7M8,B38M,737 MAX 8,175,2,10/29/2018,AC0094,,99268,145400,181700,181200,152800,BG-EL,Boeing,2018-10-29,10/22/2018,,,1,1,2,HGS-6000,1,4,ET,ETOPS,PERM,NO,SBAS,Anuvu,,,
N7822A,73W,73W,B737,737-700,143,2,12/1/2001,AA9A93,,86078,121700,155000,154500,129200,MQ-ES,Boeing,2/29/2028,09/14/2015,08/15/2025,,0,2,0,HGS-4000,0,0,C1,NOT ETOPS,PERM,NO,SBAS,Anuvu,,,true
N7745A,7R7,7S7,B737,737-700,137,1,5/24/2007,AA7AEB,,86561,121700,155000,154500,129200,DG-EP,Boeing,8/31/2027 0:00,08/19/2014,,,0,2,0,HGS-4000,0,3,OW,NOT ETOPS,PERM,NO,SBAS,Anuvu,,,
N8563Z,7A8,73H,B738,737-800,175,2,2/12/2018,ABC07B,,91962,138300,174700,174200,146300,BM-DL,Boeing,7/31/2027 0:00,02/13/2018,,,1,1,0,HGS-4000,0,0,C+,NOT ETOPS,PERM,NO,SBAS,Anuvu,,,
N570WN,7S7,7S7,B737,737-700,137,2,12/9/2002,A7506A,,86018,121700,155000,154500,129200,LQ-GJ,Boeing,11/30/2027 0:00,05/11/2015,,,0,2,0,CAT I,0,0,C+,NOT ETOPS,PERM,NO,SBAS,Anuvu,,,
N457WN,7S7,7S7,B737,737-700,137,2,4/8/2004,A58E1E,,85030,121700,155000,154500,129200,,Boeing,6/30/2027 0:00,04/08/2004,,,0,2,0,HGS-2350,0,0,C+,NOT ETOPS,PERM,NO,SBAS,Anuvu,,,
N7715E,7S7,7S7,B737,737-700,137,1,8/25/2005,AA6FCA,,85277,121700,155000,154500,129200,CG-AH,Boeing,12/31/2026 0:00,11/20/2013,,,0,2,0,HGS-4000,0,0,C+,NOT ETOPS,PERM,NO,SBAS,Anuvu,,,
N438WN,7S7,7S7,B737,737-700,137,2,7/21/2003,A542D7,,85767,121700,155000,154500,129200,,Boeing,5/31/2028 0:00,07/17/2003,,,0,2,0,HGS-2350,0,0,C+,NOT ETOPS,PERM,NO,SBAS,Anuvu,,,
N8796L,7V8,7M8,B38M,737 MAX 8,175,2,12/16/2022,AC1AFA,,99398,145400,181700,181200,152800,EL-BC,Boeing,2022-12-16,12/22/2022,,,1,1,2,HGS-6000,1,4,ET,ETOPS,PERM,NO,SBAS,Anuvu,,,
N7720F,73W,73W,B737,737-700,143,1,1/10/2006,AA72D3,,85858,121700,155000,154500,129200,CH-AB,Boeing,1/31/2027,01/17/2006,09/19/2025,,0,2,0,HGS-4000,0,0,C1,NOT ETOPS,PERM,NO,SBAS,Anuvu,,,true
N200WN,7S7,7S7,B737,737-700,137,2,1/24/2005,A19404,,85380,121700,155000,154500,129200,,Boeing,9/30/2026,12/14/2004,,,1,2,0,HGS-2350,0,0,C+,NOT ETOPS,PERM,NO,SBAS,Anuvu,,,
N8770Q,7V8,7M8,B38M,737 MAX 8,175,2,9/22/2022,AC12BE,,99422,145400,181700,181200,152800,LM-AC,Boeing,9/30/2029,09/24/2022,,,1,1,2,HGS-6000,1,4,ET,ETOPS,PERM,NO,SBAS,Anuvu,,,
N8974K,7X8,7M8,B38M,737 MAX 8,175,2,10/7/2025,AC6243,,99528,145400,181700,181200,152800,KL-BD,Boeing,,10/14/2025,,,1,1,0,HGS,1,0,C+,NOT ETOPS,PERM,YES,SBAS,ViaSat,JAM MEX PLS,,
N8911Q,7U8,7M8,B38M,737 MAX 8,175,2,11/27/2023,AC4B95,,98895,145400,181700,181200,152800,KQ-FG,Boeing,2023-11-27,11/29/2023,,,1,1,0,HGS-6000,1,0,C+,NOT ETOPS,PERM,YES,SBAS,ViaSat,,,
N489WN,7S7,7S7,B737,737-700,137,2,10/14/2004,A60C09,,85554,121700,155000,154500,129200,,Boeing,10/25/2028 0:00,10/13/2004,,,0,2,0,HGS-2350,0,0,C+,NOT ETOPS,PERM,NO,SBAS,Anuvu,,,
N8988S,7X8,7M8,B38M,737 MAX 8,175,2,12/14/2025,AC668D,,99631,145400,181700,181200,152800,LR-PS,Boeing,,12/17/2025,,,1,1,0,HGS-6000,1,0,C+,NOT ETOPS,PERM,YES,SBAS,VIA,JAM MEX PLS,,
N930WN,7S7,7S7,B737,737-700,137,2,1/29/2009,ACE7AA,,84623,121700,155000,154500,129200,,Boeing,2/28/2027,01/29/2009,,,0,1,0,HGS-4000,0,0,C1,NOT ETOPS,PERM,NO,SBAS,Anuvu,MEX,,
N473WN,7S7,7S7,B737,737-700,137,2,7/19/2004,A5CE40,,85632,121700,155000,154500,129200,,Boeing,2/29/2028 0:00,07/15/2004,,,0,2,0,HGS-2350,0,0,C+,NOT ETOPS,PERM,NO,SBAS,Anuvu,,,
N1805U,7V8,7M8,B38M,737 MAX 8,175,2,7/19/2022,A143C6,,99545,145400,181700,181200,152800,BS-MQ,Boeing,2022-07-19,09/29/2022,,,1,1,2,HGS-6000,1,4,ET,ETOPS,PERM,NO,SBAS,Anuvu,,YES,
N8515X,7A8,73H,B738,737-800,175,2,12/20/2016,ABAE2C,,91903,138300,174700,174200,146300,FJ-LR,Boeing,1/31/2027 0:00,12/20/2016,,,1,1,0,HGS-4000,0,0,C+,NOT ETOPS,PERM,NO,SBAS,Anuvu,,,
N449WN,7S7,7S7,B737,737-700,137,2,12/19/2003,A56E0D,,85584,121700,155000,154500,129200,,Boeing,6/30/2026 0:00,12/14/2003,,,0,2,0,HGS-2350,0,0,C+,NOT ETOPS,PERM,NO,SBAS,Anuvu,,,
N8889Q,7U8,7M8,B38M,737 MAX 8,175,2,11/30/2023,AC3F2F,,98768,145400,181700,181200,152800,HK-CE,Boeing,2023-11-30,12/04/2023,,,1,1,0,HGS-6000,1,0,C+,NOT ETOPS,PERM,YES,SBAS,ViaSat,,,
N936WN,7S7,7S7,B737,737-700,137,2,5/19/2009,ACFDF4,,85664,121700,155000,154500,129200,,Boeing,8/31/2027,05/20/2009,,,0,1,0,HGS-4000,0,0,C1,NOT ETOPS,PERM,NO,SBAS,Anuvu,MEX,,
N8852Q,7U8,7M8,B38M,737 MAX 8,175,2,3/27/2023,AC3315,,98783,145400,181700,181200,152800,JK-BS,Boeing,2023-03-27,03/29/2023,,,1,1,0,HGS-6000,1,0,C+,NOT ETOPS,PERM,YES,SBAS,ViaSat,,,
N8581Z,7A8,73H,B738,737-800,175,2,8/13/2018,ABC7A3,,91135,138300,174700,174200,146300,PR-AM,Boeing,6/30/2027 0:00,08/13/2018,,,1,1,0,HGS-4000,0,0,C+,NOT ETOPS,PERM,NO,SBAS,Anuvu,,,
N8687A,7A8,73H,B738,737-800,175,2,5/16/2016,ABEFDD,,91732,138300,174700,174200,146300,CP-LS,Boeing,7/31/2026,05/18/2016,,,1,1,0,HGS-4000,0,0,C+,NOT ETOPS,PERM,NO,SBAS,Anuvu,,,
N8850Q,7U8,7M8,B38M,737 MAX 8,175,2,3/10/2023,AC32CF,,98726,145400,181700,181200,152800,BM-DJ,Boeing,6/12/2023 0:00,03/15/2023,,,1,1,0,HGS-6000,1,0,C+,NOT ETOPS,PERM,YES,SBAS,ViaSat,,,
N7823A,7S7,7S7,B737,737-700,137,2,2/17/2003,AA9AB6,,85895,121700,155000,154500,129200,DQ-AR,Boeing,2/29/2028,06/30/2015,,,0,2,0,HGS-4000,0,0,C+,NOT ETOPS,PERM,NO,SBAS,Anuvu,,,
N7864B,73W,73W,B737,737-700,143,1,5/29/2001,AAA9B6,,85938,121700,155000,154500,129200,FS-GL,Boeing,7/31/2027,12/16/2017,12/14/2025,,0,2,0,HGS-4000,0,0,C1,NOT ETOPS,PERM,NO,SBAS,Anuvu,,,true
N8714Q,7V8,7M8,B38M,737 MAX 8,175,2,9/30/2017,ABFD00,,98741,145400,181700,181200,152800,LP-AM,Boeing,2017-09-30,09/30/2017,,,1,1,2,HGS-6000,1,4,ET,ETOPS,PERM,NO,SBAS,Anuvu,,,
N8603F,7A8,73H,B738,737-800,175,2,6/6/2012,ABD19E,,91449,138300,174700,174200,146300,EF-DP,Boeing,11/30/2026 0:00,06/11/2012,,,1,1,0,HGS-4000,0,0,C+,NOT ETOPS,PERM,NO,SBAS,Anuvu,,,
N460WN,7S7,7S7,B737,737-700,137,2,5/7/2004,A59B9C,,85491,121700,155000,154500,129200,,Boeing,8/31/2027 0:00,05/04/2004,,,0,2,0,HGS-2350,0,0,C+,NOT ETOPS,PERM,NO,SBAS,Anuvu,,,
N8670A,7P8,73H,B738,737-800,175,2,6/11/2015,ABEB31,,93578,138300,174700,174200,146300,MP-FL,Boeing,7/31/2028,06/09/2015,,,1,1,0,HGS-4000,0,0,C+,NOT ETOPS,PERM,NO,SBAS,Anuvu,,,
N246LV,7S7,7S7,B737,737-700,137,2,6/30/2006,A24757,,84847,121700,155000,154500,129200,,Boeing,2/29/2028 0:00,07/06/2006,,,0,2,0,HGS-4000,0,0,C+,NOT ETOPS,PERM,NO,SBAS,Anuvu,,,
N8748Q,7V8,7M8,B38M,737 MAX 8,175,2,12/21/2020,AC08B1,,99203,145400,181700,181200,152800,CE-DP,Boeing,2020-12-21,12/29/2020,,,1,1,2,HGS-6000,1,4,C2,ETOPS,PERM,NO,SBAS,Anuvu,,,
N8512U,7A8,73H,B738,737-800,175,2,12/2/2016,ABADC0,,91893,138300,174700,174200,146300,EL-GS,Boeing,12/31/2026,12/06/2016,,,1,1,0,HGS-4000,0,0,C+,NOT ETOPS,PERM,NO,SBAS,Anuvu,,,
N8697C,7A8,73H,B738,737-800,175,2,8/22/2016,ABF396,,91742,138300,174700,174200,146300,AH-QS,Boeing,9/30/2026 0:00,08/25/2016,,,1,1,0,HGS-4000,0,0,C+,NOT ETOPS,PERM,NO,SBAS,Anuvu,,,
N8550Q,7A8,73H,B738,737-800,175,2,10/28/2017,ABBC52,,91305,138300,174700,174200,146300,CS-BQ,Boeing,11/30/2027 0:00,10/30/2017,,,1,1,0,HGS-4000,0,0,C+,NOT ETOPS,PERM,NO,SBAS,Anuvu,,,
N1803U,7V8,7M8,B38M,737 MAX 8,175,2,5/20/2022,A14380,,99400,145400,181700,181200,152800,BJ-LP,Boeing,2022-05-20,08/24/2022,,,1,1,2,HGS-6000,1,4,ET,ETOPS,PERM,NO,SBAS,Anuvu,,YES,
N8981Q,7X8,7M8,B38M,737 MAX 8,175,2,11/6/2025,AC6596,,99574,145400,181700,181200,152800,BR-AK,Boeing,,11/10/2025,,,1,1,0,HGS,1,0,C+,NOT ETOPS,PERM,YES,SBAS,VIA,JAM MEX PLS,NO,
N7880D,7S7,7S7,B737,737-700,137,1,5/9/2007,AAB09A,,86475,121700,155000,154500,129200,PQ-BM,Boeing,4/30/2029 0:00,09/07/2016,,,0,2,0,HGS-4000,0,0,C+,NOT ETOPS,PERM,NO,SBAS,Anuvu,,,
N8791D,7V8,7M8,B38M,737 MAX 8,175,2,11/23/2022,AC1A44,,99489,145400,181700,181200,152800,FK-CM,Boeing,2022-11-23,11/30/2022,,,1,1,2,HGS-6000,1,4,ET,ETOPS,PERM,NO,SBAS,Anuvu,,,
N8992L,7X8,7M8,B38M,737 MAX 8,175,2,11/14/2025,AC696C,,99566,145400,181700,181200,152800,ER-KS,Boeing,,11/17/2025,,,1,1,0,HGS-6000,1,0,C+,NOT ETOPS,PERM,YES,SBAS,ViaSat,,,
N791SW,73W,73W,B737,737-700,143,2,12/23/2000,AABD61,,85822,121700,155000,154500,129200,,Boeing,9/30/2026,12/05/2000,01/01/2025,,1,2,0,YES,0,0,C1,NOT ETOPS,PERM,NO,SA-ON,Anuvu,MEX,,true
N230WN,73W,73W,B737,737-700,143,2,2/8/2006,A20A81,Colorado One,85270,121700,155000,154500,129200,,Boeing,12/31/2026,01/08/2006,06/30/2025,,0,2,0,HGS-4000,0,0,C1,NOT ETOPS,PERM,NO,SBAS,Anuvu,,,true
N269WN,7S7,7S7,B737,737-700,137,2,3/7/2007,A2A26D,,85646,121700,155000,154500,129200,,Boeing,3/31/2027 0:00,03/12/2007,,,0,2,0,HGS-4000,0,0,C+,NOT ETOPS,PERM,NO,SBAS,Anuvu,,,
N7832A,7R7,7S7,B737,737-700,137,2,5/6/2003,AA9E4A,,86108,121700,155000,154500,129200,MR-EF,Boeing,6/30/2028 0:00,10/28/2015,,,0,2,0,HGS-4000,0,3,OW,NOT ETOPS,PERM,NO,SBAS,Anuvu,,,
N7741C,7R7,7S7,B737,737-700,137,1,2/7/2007,AA7A61,,86291,121700,155000,154500,129200,DE-LR,Boeing,8/31/2026 0:00,07/18/2013,,,0,2,0,HGS-4000,0,3,OW,NOT ETOPS,PERM,NO,SBAS,Anuvu,,,
N8634A,7A8,73H,B738,737-800,175,2,6/13/2014,ABDCE1,,91739,138300,174700,174200,146300,ES-DJ,Boeing,7/31/2027 0:00,06/18/2014,,,1,1,0,HGS-4000,0,0,C+,NOT ETOPS,PERM,NO,SBAS,Anuvu,,,
N7729A,7R7,7S7,B737,737-700,137,2,6/13/2006,AA7409,,86320,121700,155000,154500,129200,CL-BE,Boeing,10/31/2027 0:00,01/28/2015,,,0,2,0,HGS-4000,1,3,OW,NOT ETOPS,PERM,NO,SBAS,Anuvu,,,
N8702L,7V8,7M8,B38M,737 MAX 8,175,2,9/30/2018,ABF8FF,,99413,145400,181700,181200,152800,AD-MP,Boeing,6/30/2027,09/28/2018,,,1,1,2,HGS-6000,1,4,ET,ETOPS,PERM,NO,SBAS,Anuvu,,,
N419WN,73W,73W,B737,737-700,143,2,12/3/2001,A4F790,,85679,121700,155000,154500,129200,,Boeing,6/30/2027,01/29/2002,07/10/2025,,0,2,0,HGS-2350,0,0,C1,NOT ETOPS,PERM,NO,SBAS,Anuvu,,,true
N7728D,73R,73W,B737,737-700,143,1,6/12/2006,AA73E9,,85908,121700,155000,154500,129200,CK-HM,Boeing,4/30/2027,03/27/2014,01/24/2026,,0,2,0,HGS-4000,0,3,C1,NOT ETOPS,PERM,NO,SBAS,Anuvu,,,true
N8326F,7R8,73H,B738,737-800,175,2,11/21/2012,AB62F8,,92491,138300,174700,174200,146300,EQ-BS,Boeing,12/31/2025,11/28/2012,,,1,1,2,HGS-4000,1,4,ET,ETOPS,PERM,NO,SBAS,Anuvu,,,
N8987Q,7X8,7M8,B38M,737 MAX 8,175,2,12/16/2025,AC6668,,99570,145400,181700,181200,152800,CH-FR,Boeing,,12/18/2025,,,1,1,0,HGS-6000,1,0,C+,NOT ETOPS,PERM,YES,SBAS,VIA,JAM MEX PLS,,
N8961K,7U8,7M8,B38M,737 MAX 8,175,2,6/25/2025,AC5E23,,98954,145400,181700,181200,152800,AS-CE,Boeing,,06/30/2025,,,1,1,0,HGS-6000,1,0,C+,NOT ETOPS,PERM,YES,SBAS,ViaSat,MEX PLS,,
N8786Q,7V8,7M8,B38M,737 MAX 8,175,2,10/7/2022,AC1747,,99519,145400,181700,181200,152800,GK-AH,Boeing,10/31/2029 0:00,10/11/2022,,,1,1,2,HGS-6000,1,4,ET,ETOPS,PERM,YES,SBAS,Anuvu,,,
N919WN,7S7,7S7,B737,737-700,137,2,4/29/2008,ACBA1B,,85533,121700,155000,154500,129200,,Boeing,8/31/2027 0:00,05/01/2008,,,0,2,0,HGS-4000,1,0,C+,NOT ETOPS,PERM,NO,SBAS,Anuvu,,,
N216WR,7S7,7S7,B737,737-700,137,2,6/25/2005,A1D1D0,,85447,121700,155000,154500,129200,,Boeing,10/31/2027 0:00,06/07/2005,,,0,2,0,HGS-4000,0,0,C+,NOT ETOPS,PERM,NO,SBAS,Anuvu,,,
N969WN,7S7,7S7,B737,737-700,137,2,12/18/2011,AD7F96,,84914,121700,155000,154500,129200,,Boeing,1/31/2028,12/21/2011,,,0,1,0,HGS-4000,0,0,C1,NOT ETOPS,PERM,NO,SBAS,Anuvu,MEX,,
N8747Q,7V8,7M8,B38M,737 MAX 8,175,2,12/28/2020,AC088E,,99138,145400,181700,181200,152800,BF-EQ,Boeing,2020-12-28,12/30/2020,,,1,1,2,HGS-6000,1,4,ET,ETOPS,PERM,NO,SBAS,Anuvu,,,
N458WN,7S7,7S7,B737,737-700,137,2,4/22/2004,A591D5,,85738,121700,155000,154500,129200,,Boeing,6/30/2027 0:00,04/19/2004,,,0,2,0,HGS-2350,0,0,C+,NOT ETOPS,PERM,NO,SBAS,Anuvu,,,
N7841A,73W,73W,B737,737-700,143,1,2/28/2001,,,85862,121700,155000,154500,129200,,Boeing,,03/01/2001,08/27/2024,08/29/2024,0,0,0,CAT I,,,C1,NOT ETOPS,PERM,NO,,,,,
N8651A,7A8,73H,B738,737-800,175,2,10/16/2014,ABE3E6,,92662,138300,174700,174200,146300,LP-BF,Boeing,10/31/2027 0:00,10/14/2014,,,1,1,0,HGS-4000,0,0,C+,NOT ETOPS,PERM,YES,SBAS,Anuvu,,,
N278WN,7S7,7S7,B737,737-700,137,2,5/30/2007,A2C635,,85789,121700,155000,154500,129200,,Boeing,10/31/2027 0:00,05/31/2007,,,0,2,0,HGS-4000,0,0,C+,NOT ETOPS,PERM,NO,SBAS,Anuvu,,,
N8871Q,7U8,7M8,B38M,737 MAX 8,175,2,6/14/2023,AC3A60,,98838,145400,181700,181200,152800,GM-EH,Boeing,2023-06-14,06/20/2023,,,1,1,0,HGS-6000,1,0,C+,NOT ETOPS,PERM,YES,SBAS,ViaSat,,,
N8859Q,7U8,7M8,B38M,737 MAX 8,175,2,4/4/2023,AC340A,,98771,145400,181700,181200,152800,BC-LR,Boeing,2023-04-04,04/06/2023,,,1,1,0,HGS-6000,1,0,C+,NOT ETOPS,PERM,YES,SBAS,ViaSat,,,
N8825Q,7U8,7M8,B38M,737 MAX 8,175,2,12/13/2022,AC2859,,98783,145400,181700,181200,152800,DL-BK,Boeing,12/31/2029 0:00,12/15/2022,,,1,1,0,HGS-6000,1,0,C+,NOT ETOPS,PERM,YES,SBAS,Anuvu,,,
N8928Q,7U8,7M8,B38M,737 MAX 8,175,2,7/3/2024,AC5041,,98893,145400,181700,181200,152800,CP-HJ,Boeing,2024-07-03,07/15/2024,,,1,1,0,HGS-6000,1,0,C+,NOT ETOPS,PERM,YES,SBAS,ViaSat,PLS,,
N564WN,7R7,7S7,B737,737-700,137,1,5/31/2002,A737C7,,86251,121700,155000,154500,129200,KS-AE,Boeing,1/31/2026,03/30/2015,,,0,2,0,HGS-4000,0,3,OW,NOT ETOPS,PERM,NO,SBAS,Anuvu,,,
N8544Z,7A8,73H,B738,737-800,175,2,8/16/2017,ABB930,,92030,138300,174700,174200,146300,JL-DE,Boeing,8/31/2027 0:00,08/15/2017,,,1,1,0,HGS-4000,0,0,C+,NOT ETOPS,PERM,NO,SBAS,Anuvu,,,
N8701Q,7V8,7M8,B38M,737 MAX 8,175,2,6/19/2018,ABF8E0,,99273,145400,181700,181200,152800,AD-ER,Boeing,2018-06-19,05/20/2021,,,1,1,2,HGS-6000,1,4,ET,ETOPS,PERM,YES,SBAS,Anuvu,,,
N8882Q,7U8,7M8,B38M,737 MAX 8,175,2,6/21/2023,AC3E3A,,98714,145400,181700,181200,152800,GR-JS,Boeing,2023-06-21,06/23/2023,,,1,1,0,HGS-6000,1,0,C+,NOT ETOPS,PERM,YES,SBAS,ViaSat,,,
N8930S,7U8,7M8,B38M,737 MAX 8,175,2,10/21/2024,AC52E2,,98913,145400,181700,181200,152800,MR-JL,Boeing,,10/28/2024,,,1,1,0,HGS-6000,1,0,C+,NOT ETOPS,PERM,YES,SBAS,ViaSat,PLS,,
N8908Q,7U8,7M8,B38M,737 MAX 8,175,2,11/16/2023,AC48D3,,98857,145400,181700,181200,152800,JQ-KR,Boeing,2023-11-16,11/20/2023,,,1,1,0,HGS-6000,1,0,C+,NOT ETOPS,PERM,YES,SBAS,ViaSat,,,
N8888M,7U8,7M8,B38M,737 MAX 8,175,2,11/21/2023,AC3F09,,98798,145400,181700,181200,152800,HK-BR,Boeing,2023-11-21,11/27/2023,,,1,1,0,HGS-6000,1,0,C+,NOT ETOPS,PERM,YES,SBAS,ViaSat,,,
N8804L,7U8,7M8,B38M,737 MAX 8,175,2,3/23/2021,AC20C4,,98391,145400,181700,181200,152800,BM-AC,Boeing,2021-03-23,03/24/2021,,,1,1,0,HGS-6000,0,0,C+,NOT ETOPS,PERM,NO,SBAS,Anuvu,,,
N8324A,7R8,73H,B738,737-800,175,2,11/2/2012,AB62AD,,93463,138300,174700,174200,146300,EL-KP,Boeing,2012-11-02,03/26/2014,,,1,1,2,HGS-4000,1,4,ET,ETOPS,PERM,NO,SBAS,Anuvu,,,
N8573Z,7A8,73H,B738,737-800,175,2,5/29/2018,ABC432,,91513,138300,174700,174200,146300,LR-DS,Boeing,7/31/2028 0:00,05/14/2018,,,1,1,0,HGS-4000,0,0,C+,NOT ETOPS,PERM,NO,SBAS,Anuvu,,,
N8957Q,7U8,7M8,B38M,737 MAX 8,175,2,6/5/2025,AC5B43,,98941,145400,181700,181200,152800,AE-BM,Boeing,2025-06-05,06/11/2025,,,1,1,0,HGS-6000,1,0,C+,NOT ETOPS,PERM,YES,SBAS,ViaSat,MEX PLS,,
N8945Q,7U8,7M8,B38M,737 MAX 8,175,2,3/31/2025,AC5746,,98944,145400,181700,181200,152800,CQ-KR,Boeing,2025-03-31,04/03/2025,,,1,1,0,HGS-6000,1,0,C+,NOT ETOPS,PERM,YES,SBAS,ViaSat,PLS,,
N8964L,7U8,7M8,B38M,737 MAX 8,175,2,8/22/2025,AC5E8D,,99140,145400,181700,181200,152800,BF-DE,Boeing,,08/26/2025,,,1,1,0,HGS-6000,1,0,C+,NOT ETOPS,PERM,YES,SBAS,ViaSat,JAM MEX PLS,,
N478WN,7S7,7S7,B737,737-700,137,2,8/14/2004,A5E0D3,,85577,121700,155000,154500,129200,,Boeing,5/31/2028 0:00,08/10/2004,,,0,2,0,HGS-2350,0,0,C+,NOT ETOPS,PERM,NO,SBAS,Anuvu,,,
N8555Z,7A8,73H,B738,737-800,175,2,12/7/2017,ABBD0A,Tennessee One,91981,138300,174700,174200,146300,HM-BL,Boeing,1/31/2028,12/03/2017,,,1,1,0,HGS-4000,0,0,C+,NOT ETOPS,PERM,NO,SBAS,Anuvu,,,
N263WN,7S7,7S7,B737,737-700,137,2,1/17/2007,A28C23,,85414,121700,155000,154500,129200,,Boeing,9/30/2026 0:00,01/12/2007,,,0,2,0,HGS-4000,0,0,C+,NOT ETOPS,PERM,NO,SBAS,Anuvu,,,
N7826B,7R7,7S7,B737,737-700,137,2,3/1/2003,AA9B20,,86418,121700,155000,154500,129200,MR-AF,Boeing,3/31/2028 0:00,09/27/2015,,,0,2,0,HGS-4000,0,3,OW,NOT ETOPS,PERM,NO,SBAS,Anuvu,,,
N435WN,7S7,7S7,B737,737-700,137,2,6/1/2003,A537B2,,85685,121700,155000,154500,129200,,Boeing,10/31/2027 0:00,05/28/2003,,,0,2,0,HGS-2350,0,0,C+,NOT ETOPS,PERM,NO,SBAS,Anuvu,,,
N252WN,7S7,7S7,B737,737-700,137,2,8/18/2006,A260ED,,85195,121700,155000,154500,129200,,Boeing,5/31/2025 0:00,08/21/2006,,,0,2,0,HGS-4000,0,0,C+,NOT ETOPS,PERM,NO,SBAS,Anuvu,,,
N8706W,7V8,7M8,B38M,737 MAX 8,175,2,8/31/2017,ABF995,,99257,145400,181700,181200,152800,BH-DQ,Boeing,2017-08-31,09/14/2017,,,1,1,2,HGS,1,4,ET,ETOPS,PERM,NO,SBAS,Anuvu,,,
N556WN,7R7,7S7,B737,737-700,137,1,4/8/2011,A717B6,,86491,121700,155000,154500,129200,PR-DM,Boeing,5/31/2027,06/01/2011,,,1,1,0,HGS-4000,1,3,OW,NOT ETOPS,PERM,NO,SBAS,Anuvu,,,
N8600F,7A8,73H,B738,737-800,175,2,4/16/2012,ABD135,,91619,138300,174700,174200,146300,DR-HL,Boeing,5/31/2028 0:00,04/18/2012,,,1,1,0,HGS-4000,0,0,C+,NOT ETOPS,PERM,NO,SBAS,Anuvu,,,
N7821L,7S7,7S7,B737,737-700,137,2,1/16/2003,AA9A7A,,86111,121700,155000,154500,129200,MP-AK,Boeing,12/31/2027 0:00,06/03/2015,,,0,2,0,HGS-4000,0,0,C+,NOT ETOPS,PERM,NO,SBAS,Anuvu,,,
N7853B,73W,73W,B737,737-700,143,1,10/16/2001,AAA5DC,,85858,121700,155000,154500,129200,CS-MQ,Boeing,11/30/2026,03/08/2017,02/24/2025,,0,2,0,CAT I,0,0,C1,NOT ETOPS,PERM,NO,SBAS,Anuvu,,,true
N8860S,7U8,7M8,B38M,737 MAX 8,175,2,3/28/2023,AC3688,,98791,145400,181700,181200,152800,BE-AR,Boeing,2023-03-28,04/05/2023,,,1,1,0,HGS-6000,1,0,C+,NOT ETOPS,PERM,YES,SBAS,ViaSat,,,
N8560Z,7A8,73H,B738,737-800,175,2,1/11/2018,ABC012,,91345,138300,174700,174200,146300,DG-FJ,Boeing,7/31/2027 0:00,01/17/2018,,,1,1,0,HGS-4000,0,0,C+,NOT ETOPS,PERM,NO,SBAS,Anuvu,,,
N296WN,7S7,7S7,B737,737-700,137,2,10/22/2007,A30DC5,,84954,121700,155000,154500,129200,,Boeing,10/19/2028 0:00,10/23/2007,,,0,2,0,HGS-4000,1,0,C+,NOT ETOPS,PERM,NO,SBAS,Anuvu,,,
N8811L,7U8,7M8,B38M,737 MAX 8,175,2,3/31/2021,AC2412,,98604,145400,181700,181200,152800,ES-HQ,Boeing,2021-03-31,04/01/2021,,,1,1,0,HGS-6000,0,0,C+,NOT ETOPS,PERM,NO,SBAS,Anuvu,,,
N8659D,7P8,73H,B738,737-800,175,2,2/9/2015,ABE501,,92878,138300,174700,174200,146300,CQ-DP,Boeing,2/29/2028 0:00,02/10/2015,,,1,1,0,HGS-4000,0,0,C+,NOT ETOPS,PERM,NO,SBAS,Anuvu,,,
N7860A,7S7,7S7,B737,737-700,137,2,5/18/2005,AAA929,,85948,121700,155000,154500,129200,MR-HJ,Boeing,5/31/2027 0:00,07/31/2017,,,0,2,0,HGS-4000,0,0,C+,NOT ETOPS,PERM,NO,SBAS,Anuvu,,,
N404WN,73W,73W,B737,737-700,143,2,6/27/2001,A4BD7E,,85630,121700,155000,154500,129200,,Boeing,10/31/2027,02/05/2001,01/23/2025,,0,2,0,CAT I,0,0,C1,NOT ETOPS,PERM,NO,SBAS,Anuvu,MEX,,true
N8853Q,7U8,7M8,B38M,737 MAX 8,175,2,3/14/2023,AC3338,,98810,145400,181700,181200,152800,HL-GK,Boeing,2023-03-14,03/16/2023,,,1,1,0,HGS-6000,1,0,C+,NOT ETOPS,PERM,YES,SBAS,ViaSat,,,
N221WN,7S7,7S7,B737,737-700,137,2,8/23/2005,A1E6B9,,85209,121700,155000,154500,129200,,Boeing,5/31/2025 0:00,07/11/2005,,,0,2,0,HGS-4000,0,0,C+,NOT ETOPS,PERM,NO,SBAS,Anuvu,,,
N483WN,7S7,7S7,B737,737-700,137,2,9/13/2004,A5F5BF,,85724,121700,155000,154500,129200,,Boeing,8/31/2028 0:00,08/25/2004,,,0,2,0,HGS-2350,0,0,C+,NOT ETOPS,PERM,NO,SBAS,Anuvu,,,
N8863Q,7U8,7M8,B38M,737 MAX 8,175,2,5/12/2023,AC36EF,,98799,145400,181700,181200,152800,CE-GR,Boeing,2023-05-12,05/16/2023,,,1,1,0,HGS-6000,1,0,C+,NOT ETOPS,PERM,YES,SBAS,ViaSat,,,
N8645A,7A8,73H,B738,737-800,175,2,8/6/2014,ABE0BB,Heart Two,92391,138300,174700,174200,146300,HR-GK,Boeing,8/31/2027,08/11/2014,,,1,1,0,HGS-4000,0,0,C+,NOT ETOPS,PERM,YES,SBAS,Anuvu,,,
N8757L,7V8,7M8,B38M,737 MAX 8,175,2,5/2/2022,AC0C41,,99329,145400,181700,181200,152800,JP-BK,Boeing,8/7/2026,05/10/2022,,,1,1,2,HGS-6000,1,4,ET,ETOPS,PERM,NO,SBAS,Anuvu,,YES,
N8824Q,7U8,7M8,B38M,737 MAX 8,175,2,12/20/2022,AC2836,,98701,145400,181700,181200,152800,DL-CE,Boeing,2022-12-20,12/22/2022,,,1,1,0,HGS-6000,1,0,C+,NOT ETOPS,PERM,YES,SBAS,Anuvu,,,
N1806U,7V8,7M8,B38M,737 MAX 8,175,2,8/1/2022,A143E9,,99500,145400,181700,181200,152800,CD-AH,Boeing,2022-08-01,10/13/2022,,,1,1,2,HGS-6000,1,4,C2,ETOPS,PERM,NO,SBAS,Anuvu,,YES,
N8867Q,7U8,7M8,B38M,737 MAX 8,175,2,5/24/2023,AC377B,,98701,145400,181700,181200,152800,EQ-CJ,Boeing,2023-05-24,05/30/2023,,,1,1,0,HGS-6000,1,0,C+,NOT ETOPS,PERM,YES,SBAS,ViaSat,,,
N250WN,7S7,7S7,B737,737-700,137,2,8/9/2006,A2597F,,85406,121700,155000,154500,129200,,Boeing,5/31/2028 0:00,08/11/2006,,,0,2,0,HGS-4000,0,0,C+,NOT ETOPS,PERM,NO,SBAS,Anuvu,,,
N8812Q,7U8,7M8,B38M,737 MAX 8,175,2,5/18/2021,AC2439,,98341,145400,181700,181200,152800,GP-EL,Boeing,2021-05-18,05/15/2021,,,1,1,0,HGS-6000,0,0,C+,NOT ETOPS,PERM,NO,SBAS,Anuvu,,,
N203WN,7S7,7S7,B737,737-700,137,2,2/22/2005,A19F29,,85928,121700,155000,154500,129200,,Boeing,12/31/2026,01/27/2005,,,0,2,0,CAT I,0,0,C+,NOT ETOPS,PERM,NO,SBAS,Anuvu,,,
N8788L,7V8,7M8,B38M,737 MAX 8,175,2,11/1/2022,AC1789,,99455,145400,181700,181200,152800,FM-HK,Boeing,11/30/2029 0:00,11/03/2022,,,1,1,2,HGS-6000,1,4,ET,ETOPS,PERM,YES,SBAS,Anuvu,,,
N8717M,7V8,7M8,B38M,737 MAX 8,175,2,3/29/2018,ABFD66,,99061,145400,181700,181200,152800,LP-EJ,Boeing,2018-03-29,03/29/2018,,,1,1,2,HGS-6000,1,4,ET,ETOPS,PERM,YES,SBAS,Anuvu,,,
N8638A,7A8,73H,B738,737-800,175,2,7/20/2014,ABDD6D,,92254,138300,174700,174200,146300,GM-AP,Boeing,8/31/2027 0:00,07/23/2014,,,1,1,0,HGS-4000,0,0,C+,NOT ETOPS,PERM,NO,SBAS,Anuvu,,,
N946WN,7S7,7S7,B737,737-700,137,2,4/24/2010,AD2573,,85581,121700,155000,154500,129200,,Boeing,8/31/2027,04/22/2010,,,0,1,0,HGS-4000,0,0,C1,NOT ETOPS,PERM,NO,SBAS,Anuvu,MEX,,
N459WN,7S7,7S7,B737,737-700,137,2,4/29/2004,A5958C,,85476,121700,155000,154500,129200,,Boeing,8/31/2027 0:00,04/26/2004,,,0,2,0,HGS-2350,0,0,C+,NOT ETOPS,PERM,NO,SBAS,Anuvu,,,
N8629A,7P8,73H,B738,737-800,175,2,5/6/2014,ABD9D9,,93208,138300,174700,174200,146300,DJ-GS,Boeing,5/31/2027 0:00,05/06/2014,,,1,1,0,HGS-4000,0,0,C+,NOT ETOPS,PERM,NO,SBAS,Anuvu,,,
N8329B,7R8,73H,B738,737-800,175,2,12/15/2012,AB635D,,92268,138300,174700,174200,146300,LP-CK,Boeing,2012-12-15,12/19/2012,,,1,1,2,HGS-4000,1,4,ET,ETOPS,PERM,NO,SBAS,Anuvu,,,
N8692F,7A8,73H,B738,737-800,175,2,7/16/2016,ABF2EA,,91622,138300,174700,174200,146300,FS-BJ,Boeing,8/31/2026 0:00,07/20/2016,,,1,1,0,HGS-4000,0,0,C+,NOT ETOPS,PERM,NO,SBAS,Anuvu,,,
N8522P,7A8,73H,B738,737-800,175,2,1/30/2017,ABB172,,90385,138300,174700,174200,146300,HS-LP,Boeing,2/28/2027 0:00,02/02/2017,,,1,1,0,HGS-4000,0,0,C+,NOT ETOPS,PERM,NO,SBAS,Anuvu,,,
N8906K,7U8,7M8,B38M,737 MAX 8,175,2,12/7/2023,AC4888,,98850,145400,181700,181200,152800,JP-GK,Boeing,2023-12-07,12/12/2023,,,1,1,0,HGS-6000,1,0,C+,NOT ETOPS,PERM,YES,SBAS,ViaSat,,,
N8511K,7A8,73H,B738,737-800,175,2,11/28/2016,ABAD94,,92440,138300,174700,174200,146300,DQ-FJ,Boeing,12/31/2026 0:00,11/29/2016,,,1,1,0,HGS-4000,0,0,C+,NOT ETOPS,PERM,NO,SBAS,Anuvu,,,
N901WN,7R7,7S7,B737,737-700,137,2,12/10/2007,AC74E4,,85702,121700,155000,154500,129200,,Boeing,3/31/2026,12/12/2007,,,0,2,0,HGS-4000,1,3,OW,NOT ETOPS,PERM,NO,SBAS,Anuvu,,,
N7869A,7S7,7S7,B737,737-700,137,2,1/5/2006,AAAA64,,86334,121700,155000,154500,129200,MQ-AC,Boeing,1/31/2028 0:00,08/21/2018,,,0,2,0,HGS-4000,0,0,C+,NOT ETOPS,PERM,NO,SBAS,Anuvu,,,
N265WN,7S7,7S7,B737,737-700,137,2,2/2/2007,A29391,,85756,121700,155000,154500,129200,,Boeing,12/31/2026 0:00,02/06/2007,,,0,2,0,HGS-4000,0,0,C+,NOT ETOPS,PERM,NO,SBAS,Anuvu,,,
N8966S,7U8,7M8,B38M,737 MAX 8,175,2,8/27/2025,AC5ED9,,99035,145400,181700,181200,152800,AQ-HJ,Boeing,,08/29/2025,,,1,1,0,HGS-6000,1,0,C+,NOT ETOPS,Flywire,YES,SBAS,ViaSat,JAM MEX PLS,,
N8935Q,7U8,7M8,B38M,737 MAX 8,175,2,1/2/2025,AC538F,,98934,145400,181700,181200,152800,JQ-PS,Boeing,2025-01-02,01/10/2025,,,1,1,0,HGS-6000,1,0,C+,NOT ETOPS,PERM,YES,SBAS,ViaSat,PLS,,
N8821S,7U8,7M8,B38M,737 MAX 8,175,2,11/14/2022,AC27CF,,98572,145400,181700,181200,152800,DM-AC,Boeing,11/30/2029 0:00,11/16/2022,,,1,1,0,HGS-6000,1,0,C+,NOT ETOPS,PERM,YES,SBAS,Anuvu,,,
N8583Z,7A8,73H,B738,737-800,175,2,9/30/2018,ABC7E9,,92268,138300,174700,174200,146300,PS-LR,Boeing,6/30/2027 0:00,09/28/2018,,,1,1,0,HGS-4000,0,0,C+,NOT ETOPS,PERM,NO,SBAS,Anuvu,,,
N8772M,7V8,7M8,B38M,737 MAX 8,175,2,8/24/2022,AC1301,,99412,145400,181700,181200,152800,KM-CD,Boeing,8/31/2029,08/26/2022,,,1,1,2,HGS-6000,1,4,ET,ETOPS,PERM,NO,SBAS,Anuvu,,YES,
N8535S,7A8,73H,B738,737-800,175,2,6/9/2017,ABB595,,91100,138300,174700,174200,146300,DH-GK,Boeing,7/31/2027 0:00,06/14/2017,,,1,1,0,HGS-4000,0,0,C+,NOT ETOPS,PERM,NO,SBAS,Anuvu,,,
N7732A,7S7,7S7,B737,737-700,137,1,9/9/2006,AA76CB,,85761,121700,155000,154500,129200,CM-GK,Boeing,7/31/2028 0:00,07/23/2012,,,0,2,0,HGS-4000,0,0,C+,NOT ETOPS,PERM,NO,SBAS,Anuvu,,,
N950WN,7S7,7S7,B737,737-700,137,2,8/5/2010,AD36A8,,85454,121700,155000,154500,129200,,Boeing,2/29/2028,08/01/2010,,,0,1,0,HGS-4000,0,0,C1,NOT ETOPS,PERM,NO,SBAS,Anuvu,MEX,,
N488WN,7S7,7S7,B737,737-700,137,2,10/13/2004,A60852,,85434,121700,155000,154500,129200,,Boeing,11/30/2025 0:00,10/07/2004,,,0,2,0,HGS-2350,0,0,C+,NOT ETOPS,PERM,NO,SBAS,Anuvu,,,
N416WN,73W,73W,B737,737-700,143,2,11/1/2001,,,85784,121700,155000,154500,129200,,Boeing,2026-12-01,01/29/2002,05/19/2025,,0,2,0,HGS-2350,0,0,C1,NOT ETOPS,PERM,NO,SBAS,Anuvu,,,true
N7727A,73R,73W,B737,737-700,143,2,5/11/2006,AA73C3,,86426,121700,155000,154500,129200,CK-EG,Boeing,11/11/2025,12/25/2014,01/23/2026,,0,2,0,HGS-4000,1,3,C1,NOT ETOPS,PERM,NO,SBAS,Anuvu,,,true
N8779Q,7V8,7M8,B38M,737 MAX 8,175,2,9/20/2022,AC13F9,,99558,145400,181700,181200,152800,HJ-CD,Boeing,12/21/2022,09/22/2022,,,1,1,2,HGS-6000,1,4,ET,ETOPS,PERM,NO,SBAS,Anuvu,,YES,
N8721J,7V8,7M8,B38M,737 MAX 8,175,2,9/20/2018,AC0048,,99186,145400,181700,181200,152800,BG-CJ,Boeing,2018-09-20,09/20/2018,,,1,1,2,HGS-6000,1,4,ET,ETOPS,PERM,NO,SBAS,Anuvu,,,
N439WN,7S7,7S7,B737,737-700,137,2,7/29/2003,A5468E,Donald Ogden,85311,121700,155000,154500,129200,,Boeing,5/31/2028 0:00,07/31/2003,,,0,2,0,HGS-2350,0,0,C+,NOT ETOPS,PERM,NO,SBAS,Anuvu,,,
N201LV,7S7,7S7,B737,737-700,137,2,2/15/2005,A196C8,,85497,121700,155000,154500,129200,,Boeing,12/31/2026 0:00,01/27/2005,,,0,2,0,HGS-4000,0,0,C+,NOT ETOPS,PERM,NO,SBAS,Anuvu,,,
N236WN,7S7,7S7,B737,737-700,137,2,4/21/2006,A220CB,,84946,121700,155000,154500,129200,,Boeing,6/30/2027,04/25/2006,,,0,2,0,HGS-4000,0,0,C+,NOT ETOPS,PERM,NO,SBAS,Anuvu,,,
N7856A,73W,73W,B737,737-700,143,1,12/17/2001,AAA644,,85638,121700,155000,154500,129200,DJ-CQ,Boeing,2001-12-17,05/04/2017,03/19/2025,,0,2,0,CAT I,0,0,C1,NOT ETOPS,PERM,NO,SBAS,Anuvu,MEX,,true
N8958Q,7U8,7M8,B38M,737 MAX 8,175,2,6/10/2025,AC5B66,,99096,145400,181700,181200,152800,AH-DE,Boeing,2025-06-10,06/16/2025,,,1,1,0,HGS-6000,1,0,C+,NOT ETOPS,PERM,YES,SBAS,ViaSat,MEX PLS,,
N234WN,7S7,7S7,B737,737-700,137,2,3/24/2006,A2195D,,85087,121700,155000,154500,129200,,Boeing,6/30/2027 0:00,03/10/2006,,,0,2,0,HGS-4000,0,0,C+,NOT ETOPS,PERM,NO,SBAS,Anuvu,,,
N922WN,7S7,7S7,B737,737-700,137,2,5/28/2008,ACC799,,85536,121700,155000,154500,129200,,Boeing,8/31/2027 0:00,06/02/2008,,,0,2,0,HGS-4000,0,0,C+,NOT ETOPS,PERM,NO,SBAS,Anuvu,,,
N8768Q,7V8,7M8,B38M,737 MAX 8,175,2,8/15/2022,AC101F,,99321,145400,181700,181200,152800,LM-CE,Boeing,2022-08-15,08/18/2022,,,1,1,2,HGS-6000,1,4,ET,ETOPS,PERM,NO,SBAS,Anuvu,,YES,
N475WN,7S7,7S7,B737,737-700,137,2,7/31/2004,A5D5AE,,85140,121700,155000,154500,129200,,Boeing,2/29/2028 0:00,07/22/2004,,,0,2,0,HGS-2350,0,0,C+,NOT ETOPS,PERM,NO,SBAS,Anuvu,,,
N8732S,7V8,7M8,B38M,737 MAX 8,175,2,12/27/2018,AC042A,,99263,145400,181700,181200,152800,PQ-AS,Boeing,2018-12-27,12/27/2018,,,1,1,2,HGS-6000,1,4,ET,ETOPS,PERM,NO,SBAS,Anuvu,,YES,
N7885A,7S7,7S7,B737,737-700,137,2,10/7/2002,AAB146,,86015,121700,155000,154500,129200,KP-CJ,Boeing,11/30/2027 0:00,02/13/2017,,,0,2,0,HGS-4000,0,0,C+,NOT ETOPS,PERM,NO,SBAS,Anuvu,,,
N7863A,73W,73W,B737,737-700,143,1,4/11/2002,AAA992,,86200,121700,155000,154500,129200,FS-AP,Boeing,6/30/2027,12/04/2017,11/07/2025,,0,2,0,HGS-4000,0,0,C1,NOT ETOPS,PERM,NO,SBAS,Anuvu,,,true
N8693A,7A8,73H,B738,737-800,175,2,7/28/2016,ABF308,,91572,138300,174700,174200,146300,AB-GP,Boeing,9/30/2026 0:00,07/28/2016,,,1,1,0,HGS-4000,0,0,C+,NOT ETOPS,PERM,NO,SBAS,Anuvu,,,
N8851Q,7U8,7M8,B38M,737 MAX 8,175,2,3/3/2023,AC32F2,,98796,145400,181700,181200,152800,MP-EH,Boeing,2023-03-03,03/07/2023,,,1,1,0,HGS-6000,1,0,C+,NOT ETOPS,PERM,YES,SBAS,ViaSat,,,
N7702A,7S7,7S7,B737,737-700,137,1,8/10/2004,AA6BA6,,85532,121700,155000,154500,129200,BM-GJ,Boeing,5/31/2028 0:00,05/24/2012,,,0,2,0,HGS-4000,0,0,C+,NOT ETOPS,PERM,NO,SBAS,Anuvu,,,
N8864H,7U8,7M8,B38M,737 MAX 8,175,2,5/3/2023,AC370B,,98820,145400,181700,181200,152800,CJ-GR,Boeing,2023-05-03,05/05/2023,,,1,1,0,HGS-6000,1,0,C+,NOT ETOPS,PERM,YES,SBAS,ViaSat,,,
N8504G,7A8,73H,B738,737-800,175,2,10/24/2016,ABAA43,,91930,138300,174700,174200,146300,BK-LR,Boeing,11/30/2026 0:00,10/27/2016,,,1,1,0,HGS-4000,0,0,C+,NOT ETOPS,PERM,NO,SBAS,Anuvu,,,
N486WN,7S7,7S7,B737,737-700,137,2,9/27/2004,A600E4,,85586,121700,155000,154500,129200,,Boeing,8/31/2028 0:00,09/23/2004,,,0,2,0,HGS-2350,0,0,C+,NOT ETOPS,PERM,NO,SBAS,Anuvu,,,
N208WN,7S7,7S7,B737,737-700,137,2,3/30/2005,A1B1BC,,85287,121700,155000,154500,129200,,Boeing,3/31/2027 0:00,03/13/2005,,,0,2,0,HGS-4000,0,0,C+,NOT ETOPS,PERM,NO,SBAS,Anuvu,,,
N8923Q,7U8,7M8,B38M,737 MAX 8,175,2,6/27/2024,AC4F92,,99021,145400,181700,181200,152800,CG-AM,Boeing,7/2/2025,07/03/2024,,,1,1,0,HGS-6000,1,0,C+,NOT ETOPS,PERM,YES,SBAS,ViaSat,PLS,,
N8577Z,7A8,73H,B738,737-800,175,2,6/20/2018,ABC4BE,,91783,138300,174700,174200,146300,LM-HK,Boeing,6/30/2027 0:00,06/15/2018,,,1,1,0,HGS-4000,0,0,C+,NOT ETOPS,PERM,NO,SBAS,Anuvu,,,
N8735L,7V8,7M8,B38M,737 MAX 8,175,2,2/28/2019,AC048D,,99009,145400,181700,181200,152800,GM-LS,Boeing,2019-02-28,02/28/2019,,,1,1,2,HGS-6000,1,4,C1,ETOPS,PERM,NO,SBAS,Anuvu,,YES,true
N555LV,7R7,7S7,B737,737-700,137,1,3/16/2011,A7130C,,86626,121700,155000,154500,129200,PR-EJ,Boeing,4/30/2027 0:00,06/01/2011,,,1,1,0,HGS-4000,1,3,OW,NOT ETOPS,PERM,NO,SBAS,Anuvu,,,
N8940Q,7U8,7M8,B38M,737 MAX 8,175,2,3/6/2025,AC5697,,99034,145400,181700,181200,152800,CL-DG,Boeing,2025-03-06,03/14/2025,,,1,1,0,HGS-6000,1,0,C+,NOT ETOPS,PERM,YES,SBAS,ViaSat,MEX PLS,,
N963WN,7S7,7S7,B737,737-700,137,2,7/29/2011,AD694C,,85954,121700,155000,154500,129200,,Boeing,8/31/2027,08/01/2011,,,0,1,0,HGS-4000,0,0,C1,NOT ETOPS,PERM,NO,SBAS,Anuvu,MEX,,
N7724A,7R7,7S7,B737,737-700,137,1,2/24/2009,AA735A,,85823,121700,155000,154500,129200,PR-FG,Boeing,11/30/2026,10/09/2013,,,1,1,0,HGS-4000,0,3,OW,NOT ETOPS,PERM,NO,SBAS,Anuvu,,,
N227WN,7S7,7S7,B737,737-700,137,2,12/9/2005,A1FD03,,85309,121700,155000,154500,129200,,Boeing,6/30/2026 0:00,10/27/2005,,,0,2,0,HGS-4000,0,0,C+,NOT ETOPS,PERM,NO,SBAS,Anuvu,,,
N8861Q,7U8,7M8,B38M,737 MAX 8,175,2,4/28/2023,AC36A9,,98751,145400,181700,181200,152800,BG-FS,Boeing,2023-04-28,05/02/2023,,,1,1,0,HGS-6000,1,0,C+,NOT ETOPS,PERM,YES,SBAS,ViaSat,,,
N465WN,7S7,7S7,B737,737-700,137,2,6/11/2004,A5AE2F,,85187,121700,155000,154500,129200,,Boeing,10/31/2027,06/06/2004,,,0,2,0,HGS-2350,0,0,C+,NOT ETOPS,PERM,NO,SBAS,Anuvu,,,
N453WN,7S7,7S7,B737,737-700,137,2,3/29/2004,A57F42,,85430,121700,155000,154500,129200,,Boeing,6/30/2027 0:00,03/28/2004,,,0,2,0,HGS-2350,0,0,C+,NOT ETOPS,PERM,NO,SBAS,Anuvu,,,
N264LV,7S7,7S7,B737,737-700,137,2,1/23/2007,A28EE7,,85517,121700,155000,154500,129200,,Boeing,9/30/2026 0:00,01/19/2007,,,0,2,0,HGS-4000,0,0,C+,NOT ETOPS,PERM,NO,SBAS,Anuvu,,,
N8749Q,7V8,7M8,B38M,737 MAX 8,175,2,1/22/2021,AC08D4,,99043,145400,181700,181200,152800,CQ-BK,Boeing,4/30/2028,01/28/2021,,,1,1,2,HGS-6000,1,4,ET,ETOPS,PERM,NO,SBAS,Anuvu,,,
N253WN,7S7,7S7,B737,737-700,137,2,9/2/2006,A264A4,,84764,121700,155000,154500,129200,,Boeing,5/31/2028 0:00,09/04/2006,,,0,2,0,HGS-4000,0,0,C+,NOT ETOPS,PERM,NO,SBAS,Anuvu,,,
N8528Q,7A8,73H,B738,737-800,175,2,3/30/2017,ABB245,,91465,138300,174700,174200,146300,GM-AK,Boeing,4/30/2027 0:00,03/31/2017,,,1,1,0,HGS-4000,0,0,C+,NOT ETOPS,PERM,NO,SBAS,Anuvu,,,
N1804U,7V8,7M8,B38M,737 MAX 8,175,2,12/13/2022,A143A3,,99419,145400,181700,181200,152800,BQ-JP,Boeing,2022-12-13,03/01/2023,,,1,1,2,HGS-6000,1,4,ET,ETOPS,PERM,NO,SBAS,Anuvu,,,
N217JC,7S7,7S7,B737,737-700,137,2,6/29/2005,A1D44E,,85017,121700,155000,154500,129200,,Boeing,10/31/2027 0:00,06/07/2005,,,0,2,0,HGS-4000,0,0,C+,NOT ETOPS,PERM,NO,SBAS,Anuvu,,,
N928WN,7S7,7S7,B737,737-700,137,2,7/30/2008,ACDDE3,,85449,121700,155000,154500,129200,,Boeing,2/29/2028,07/30/2008,,,0,1,0,HGS-4000,0,0,C1,NOT ETOPS,PERM,NO,SBAS,Anuvu,MEX,,
N949WN,7S7,7S7,B737,737-700,137,2,7/30/2010,AD3098,,85774,121700,155000,154500,129200,,Boeing,2/29/2028,07/27/2010,,,0,1,0,HGS-4000,0,0,C1,NOT ETOPS,PERM,NO,SBAS,Anuvu,MEX,,
N212WN,7S7,7S7,B737,737-700,137,2,5/12/2005,A1C2F1,,85240,121700,155000,154500,129200,,Boeing,6/30/2027 0:00,04/19/2005,,,0,2,0,HGS-4000,0,0,C+,NOT ETOPS,PERM,NO,SBAS,Anuvu,,,
N461WN,7S7,7S7,B737,737-700,137,2,5/24/2004,A59F53,,84894,121700,155000,154500,129200,,Boeing,8/31/2027 0:00,05/23/2004,,,0,2,0,HGS-2350,0,0,C+,NOT ETOPS,PERM,NO,SBAS,Anuvu,,,
N500WR,7P8,73H,B738,737-800,175,2,6/19/2014,A63BF4,Freedom One,94023,138300,174700,174200,146300,FJ-HR,Boeing,7/31/2027,06/23/2014,,,1,1,0,HGS-4000,0,0,C+,NOT ETOPS,PERM,NO,SBAS,Anuvu,,,false
N8536Z,7A8,73H,B738,737-800,175,2,6/14/2017,ABB5BF,,90905,138300,174700,174200,146300,CP-GJ,Boeing,7/31/2027 0:00,06/15/2017,,,1,1,0,HGS-4000,0,0,C+,NOT ETOPS,PERM,NO,SBAS,Anuvu,,,
N8892S,7U8,7M8,B38M,737 MAX 8,175,2,7/14/2023,AC41F3,,98856,145400,181700,181200,152800,HM-FS,Boeing,2023-07-14,07/20/2023,,,1,1,0,HGS-6000,1,0,C+,NOT ETOPS,PERM,YES,SBAS,ViaSat,,,
N8741L,7V8,7M8,B38M,737 MAX 8,175,2,2/4/2021,AC07B8,,98104,145400,181700,181200,152800,AE-GS,Boeing,2021-02-04,02/05/2021,,,1,1,2,HGS-6000,1,4,ET,ETOPS,PERM,YES,SBAS,Anuvu,,,
N8891Q,7U8,7M8,B38M,737 MAX 8,175,2,7/7/2023,AC41CE,,98889,145400,181700,181200,152800,HL-AK,Boeing,2023-07-07,07/12/2023,,,1,1,0,HGS-6000,1,0,C+,NOT ETOPS,PERM,YES,SBAS,ViaSat,,,
N235WN,73W,73W,B737,737-700,143,2,4/10/2006,A21D14,,85660,121700,155000,154500,129200,,Boeing,6/30/2027,04/11/2006,01/09/2026,,0,2,0,HGS-4000,0,0,C1,NOT ETOPS,PERM,NO,SBAS,Anuvu,,,true
N8877Q,7U8,7M8,B38M,737 MAX 8,175,2,6/8/2023,AC3B32,,98888,145400,181700,181200,152800,GQ-JS,Boeing,2023-06-08,06/13/2023,,,1,1,0,HGS-6000,1,0,C+,NOT ETOPS,PERM,YES,SBAS,ViaSat,,,
N8813Q,7U8,7M8,B38M,737 MAX 8,175,2,5/19/2021,AC245C,,98291,145400,181700,181200,152800,JS-DP,Boeing,2021-05-19,05/24/2021,,,1,1,0,HGS-6000,0,0,C+,NOT ETOPS,PERM,NO,SBAS,Anuvu,,,
N8605E,7P8,73H,B738,737-800,175,2,12/19/2012,ABD1E3,,93530,138300,174700,174200,146300,AB-FM,Boeing,1/31/2026 0:00,12/20/2012,,,1,1,0,HGS-4000,0,0,C+,NOT ETOPS,PERM,YES,SBAS,Anuvu,,,
N8929S,7U8,7M8,B38M,737 MAX 8,175,2,7/2/2024,AC5066,,99040,145400,181700,181200,152800,PQ-EH,Boeing,2024-07-02,07/09/2024,,,1,1,0,HGS-6000,1,0,C+,NOT ETOPS,PERM,YES,SBAS,ViaSat,PLS,,
N7882B,73W,73W,B737,737-700,143,2,1/23/2001,AAB0DE,,85990,121700,155000,154500,129200,MS-DJ,Boeing,2001-01-23,10/15/2016,12/08/2024,,0,2,0,CAT I,0,0,C1,NOT ETOPS,PERM,NO,SA-ON,Anuvu,MEX,,true
N480WN,7S7,7S7,B737,737-700,137,2,8/25/2004,A5EA9A,,85970,121700,155000,154500,129200,,Boeing,8/31/2028 0:00,08/17/2004,,,0,2,0,HGS-2350,0,0,C+,NOT ETOPS,PERM,NO,SBAS,Anuvu,,,
N7887A,7S7,7S7,B737,737-700,137,1,9/4/2007,AAB18C,,85136,121700,155000,154500,129200,LP-DK,Boeing,12/31/2026 0:00,01/30/2018,,,0,2,0,HGS-4000,0,0,C+,NOT ETOPS,PERM,NO,SBAS,Anuvu,,,
N494WN,7S7,7S7,B737,737-700,137,2,12/12/2004,A620F5,,85460,121700,155000,154500,129200,,Boeing,6/30/2026 0:00,11/14/2004,,,0,2,0,HGS-2350,0,0,C+,NOT ETOPS,PERM,NO,SBAS,Anuvu,,,
N8920Q,7U8,7M8,B38M,737 MAX 8,175,2,12/1/2023,AC4F29,,98946,145400,181700,181200,152800,AL-BD,Boeing,2023-12-01,12/08/2023,,,1,1,0,HGS-6000,1,0,C+,NOT ETOPS,PERM,YES,SBAS,ViaSat,,,
N8674B,7P8,73H,B738,737-800,175,2,11/25/2015,ABEBBE,,93251,138300,174700,174200,146300,MQ-CE,Boeing,12/31/2025 0:00,11/25/2015,,,1,1,0,HGS-4000,0,0,C+,NOT ETOPS,PERM,NO,SBAS,Anuvu,,,
N8766T,7V8,7M8,B38M,737 MAX 8,175,2,8/25/2022,AC0FDC,Rollin King,99337,145400,181700,181200,152800,MQ-DP,Boeing,2022-08-25,08/29/2022,,,1,1,2,HGS-6000,1,4,C2,ETOPS,PERM,NO,SBAS,Anuvu,,YES,
N1811U,7V8,7M8,B38M,737 MAX 8,175,2,10/17/2022,A146F1,,99474,145400,181700,181200,152800,HS-DP,Boeing,2022-10-17,01/12/2023,,,1,1,2,HGS-6000,1,4,ET,ETOPS,PERM,NO,SBAS,Anuvu,,,
N440LV,7S7,7S7,B737,737-700,137,2,8/5/2003,A54BAB,,85879,121700,155000,154500,129200,,Boeing,5/31/2028 0:00,07/31/2003,,,0,2,0,HGS-2350,0,0,C+,NOT ETOPS,PERM,NO,SBAS,Anuvu,,,
N551WN,73W,73W,B737,737-700,143,2,12/6/2001,A70523,,85557,121700,155000,154500,129200,,Boeing,2001-12-06,06/12/2007,02/13/2025,,0,2,0,CAT I,0,0,C1,NOT ETOPS,PERM,NO,SBAS,Anuvu,MEX,,true
N7888A,7S7,7S7,B737,737-700,137,1,12/2/2007,AAB1AF,,85801,121700,155000,154500,129200,PQ-KL,Boeing,12/31/2026 0:00,02/20/2018,,,0,2,0,HGS-4000,0,0,C+,NOT ETOPS,PERM,NO,SBAS,Anuvu,,,
N8647A,7A8,73H,B738,737-800,175,2,8/14/2014,ABE101,,92618,138300,174700,174200,146300,JQ-MS,Boeing,8/31/2027 0:00,08/15/2014,,,1,1,0,HGS-4000,0,0,C+,NOT ETOPS,PERM,NO,SBAS,Anuvu,,,
N7886A,7S7,7S7,B737,737-700,137,1,8/16/2007,AAB169,,85178,121700,155000,154500,129200,KP-MR,Boeing,12/31/2026 0:00,01/30/2018,,,0,2,0,HGS-4000,0,0,C+,NOT ETOPS,PERM,NO,SBAS,Anuvu,,,
N8559Q,7A8,73H,B738,737-800,175,2,1/10/2018,ABBD8D,,91160,138300,174700,174200,146300,EG-CH,Boeing,7/31/2027 0:00,01/12/2018,,,1,1,0,HGS-4000,0,0,C+,NOT ETOPS,PERM,NO,SBAS,Anuvu,,,
N8841L,7U8,7M8,B38M,737 MAX 8,175,2,1/31/2023,AC2F37,,98684,145400,181700,181200,152800,CK-BM,Boeing,5/8/2023,02/07/2023,,,1,1,0,HGS-6000,1,0,C+,NOT ETOPS,PERM,NO,SBAS,Anuvu,,,
N8675A,7P8,73H,B738,737-800,175,2,12/13/2015,ABEBE0,,93437,138300,174700,174200,146300,MQ-CS,Boeing,1/31/2029 0:00,11/02/2015,,,1,1,0,HGS-4000,0,0,C+,NOT ETOPS,PERM,YES,SBAS,Anuvu,,,
N8826Q,7U8,7M8,B38M,737 MAX 8,175,2,12/7/2022,AC287C,,98294,145400,181700,181200,152800,DL-AM,Boeing,12/31/2029 0:00,12/12/2022,,,1,1,0,HGS-6000,1,0,C+,NOT ETOPS,PERM,YES,SBAS,Anuvu,,,
N8753Q,7V8,7M8,B38M,737 MAX 8,175,2,4/11/2022,AC0BB9,,99290,145400,181700,181200,152800,EQ-CP,Boeing,2022-04-11,04/18/2022,,,1,1,2,HGS-6000,1,4,ET,ETOPS,PERM,NO,SBAS,Anuvu,,YES,
N8553W,7A8,73H,B738,737-800,175,2,12/3/2017,ABBCC1,,91705,138300,174700,174200,146300,JL-GK,Boeing,12/31/2027 0:00,12/03/2017,,,1,1,0,CAT I,0,0,C+,NOT ETOPS,PERM,NO,SBAS,Anuvu,,,
N8985Q,7X8,7M8,B38M,737 MAX 8,175,2,12/12/2025,AC6622,,99615,145400,181700,181200,152800,EQ-DG,Boeing,,12/15/2025,,,1,1,0,HGS,1,0,C+,NOT ETOPS,PERM,YES,SBAS,VIA,JAM MEX PLS,NO,
N8320J,7R8,73H,B738,737-800,175,2,8/28/2012,AB6229,,92595,138300,174700,174200,146300,DR-AQ,Boeing,2012-08-28,09/05/2012,,,1,1,2,HGS-4000,1,4,ET,ETOPS,PERM,NO,SBAS,Anuvu,,,
N8656B,7A8,73H,B738,737-800,175,2,12/23/2014,ABE496,,92752,138300,174700,174200,146300,BG-FP,Boeing,1/31/2028,12/29/2014,,,1,1,0,HGS-4000,0,0,C+,NOT ETOPS,PERM,NO,SBAS,Anuvu,,,
N8901Q,7U8,7M8,B38M,737 MAX 8,175,2,8/21/2023,AC47DE,,98758,145400,181700,181200,152800,JM-CR,Boeing,2023-08-21,08/28/2023,,,1,1,0,HGS-6000,1,0,C+,NOT ETOPS,PERM,YES,SBAS,ViaSat,,,
N8578Q,7A8,73H,B738,737-800,175,2,6/26/2018,ABC4D8,,91776,138300,174700,174200,146300,LQ-MR,Boeing,6/30/2027 0:00,03/06/2018,,,1,1,0,HGS-4000,0,0,C+,NOT ETOPS,PERM,NO,SBAS,Anuvu,,,
N910WN,7S7,7S7,B737,737-700,137,2,2/16/2008,AC98AC,,85675,121700,155000,154500,129200,,Boeing,10/31/2026 0:00,02/20/2008,,,0,2,0,CAT I,1,0,C+,NOT ETOPS,PERM,NO,SBAS,Anuvu,,,
N8794Q,7V8,7M8,B38M,737 MAX 8,175,2,12/14/2022,AC1AB8,,99561,145400,181700,181200,152800,EM-BK,Boeing,12/31/2029,12/22/2022,,,1,1,2,HGS-6000,1,4,C1,ETOPS,PERM,NO,SBAS,Anuvu,,,true
N470WN,7S7,7S7,B737,737-700,137,2,6/24/2004,A5C31B,,85805,121700,155000,154500,129200,,Boeing,2/29/2028 0:00,06/09/2004,,,0,2,0,HGS-2350,0,0,C+,NOT ETOPS,PERM,NO,SBAS,Anuvu,,,
N8718Q,7V8,7M8,B38M,737 MAX 8,175,2,4/29/2018,ABFD8C,,98866,145400,181700,181200,152800,AC-DR,Boeing,2018-04-29,04/30/2018,,,1,1,2,HGS-6000,1,4,ET,ETOPS,PERM,NO,SBAS,Anuvu,,,
N429WN,7S7,7S7,B737,737-700,137,2,12/16/2002,A51F0F,,85077,121700,155000,154500,129200,,Boeing,6/30/2026 0:00,12/11/2002,,,0,2,0,HGS-2350,0,0,C+,NOT ETOPS,PERM,NO,SBAS,Anuvu,,,
N8501V,7A8,73H,B738,737-800,175,2,9/27/2016,ABA9E7,,91452,138300,174700,174200,146300,BH-AF,Boeing,10/31/2026 0:00,09/29/2016,,,1,1,0,HGS-4000,0,0,C+,NOT ETOPS,PERM,NO,SBAS,Anuvu,,,
N8722L,7V8,7M8,B38M,737 MAX 8,175,2,9/30/2018,AC006D,,99381,145400,181700,181200,152800,BG-DF,Boeing,2018-09-30,09/28/2018,,,1,1,2,HGS-6000,1,4,ET,ETOPS,PERM,NO,SBAS,Anuvu,,,
N7736A,7R7,7S7,B737,737-700,137,1,12/6/2006,AA7757,,86111,121700,155000,154500,129200,CR-QS,Boeing,7/31/2027 0:00,06/28/2014,,,0,2,0,HGS-4000,0,3,OW,NOT ETOPS,PERM,NO,SBAS,Anuvu,,,
N8564Z,7A8,73H,B738,737-800,175,2,2/24/2018,ABC09E,,91605,138300,174700,174200,146300,BM-CD,Boeing,3/31/2028 0:00,02/26/2018,,,1,1,0,HGS-4000,0,0,C+,NOT ETOPS,PERM,NO,SBAS,Anuvu,,,
N8313F,7R8,73H,B738,737-800,175,2,6/28/2012,AB5ED8,,94273,138300,174700,174200,146300,BD-EQ,Boeing,7/31/2028 0:00,06/28/2012,,,1,1,2,HGS-4000,1,4,ET,ETOPS,PERM,NO,SBAS,Anuvu,,,
N8648A,7A8,73H,B738,737-800,175,2,9/5/2014,ABE124,,92166,138300,174700,174200,146300,KQ-GP,Boeing,9/30/2027 0:00,09/05/2014,,,1,1,0,HGS-4000,0,0,C+,NOT ETOPS,PERM,NO,SBAS,Anuvu,,,
N955WN,7S7,7S7,B737,737-700,137,2,3/28/2011,AD493B,Arizona One,85397,121700,155000,154500,129200,,Boeing,4/30/2027,03/31/2011,,,0,1,0,HGS-4000,0,0,C1,NOT ETOPS,PERM,NO,SBAS,Anuvu,MEX,,
N8637A,7P8,73H,B738,737-800,175,2,6/25/2014,ABDD4A,,92548,138300,174700,174200,146300,FM-LP,Boeing,7/31/2027 0:00,06/26/2014,,,1,1,0,HGS-4000,0,0,C+,NOT ETOPS,PERM,NO,SBAS,Anuvu,,,
N964WN,7S7,7S7,B737,737-700,137,2,8/26/2011,AD6D03,,85221,121700,155000,154500,129200,,Boeing,9/30/2027,08/29/2011,,,0,1,0,HGS-4000,0,0,C1,NOT ETOPS,PERM,NO,SBAS,Anuvu,MEX,,
N967WN,7S7,7S7,B737,737-700,137,2,10/1/2011,AD7828,,85079,121700,155000,154500,129200,,Boeing,10/31/2027,10/03/2011,,,0,1,0,HGS-4000,0,0,C1,NOT ETOPS,PERM,NO,SBAS,Anuvu,MEX,,
N8752Q,7V8,7M8,B38M,737 MAX 8,175,2,4/1/2022,AC0B96,,99401,145400,181700,181200,152800,EF-AP,Boeing,2022-04-01,04/06/2022,,,1,1,2,HGS-6000,1,4,ET,ETOPS,PERM,NO,SBAS,Anuvu,,YES,
N248WN,7S7,7S7,B737,737-700,137,2,7/25/2006,A24FB8,,85481,121700,155000,154500,129200,,Boeing,2/29/2028 0:00,07/20/2006,,,0,2,0,HGS-4000,0,0,C+,NOT ETOPS,PERM,NO,SBAS,Anuvu,,,
N8784Q,7V8,7M8,B38M,737 MAX 8,175,2,9/26/2022,AC1701,,99505,145400,181700,181200,152800,GL-BK,Boeing,2022-09-26,09/28/2022,,,1,1,2,HGS-6000,1,4,ET,ETOPS,PERM,NO,SBAS,Anuvu,,YES,
N7752B,7R7,7S7,B737,737-700,137,1,3/17/2008,AA7E3A,,86379,121700,155000,154500,129200,PS-JR,Boeing,8/31/2027 0:00,08/26/2014,,,0,2,0,HGS-4000,0,3,OW,NOT ETOPS,PERM,NO,SBAS,Anuvu,,,
N8683D,7P8,73H,B738,737-800,175,2,3/16/2016,ABEF54,,93606,138300,174700,174200,146300,BF-DR,Boeing,5/31/2026 0:00,03/21/2016,,,1,1,0,HGS-4000,0,0,C+,NOT ETOPS,PERM,YES,SBAS,Anuvu,,,
N8584Z,7A8,73H,B738,737-800,175,2,8/25/2018,ABC80C,,91776,138300,174700,174200,146300,QS-DE,Boeing,6/30/2027 0:00,08/30/2018,,,1,1,0,HGS-4000,0,0,C+,NOT ETOPS,PERM,NO,SBAS,Anuvu,,,
N8844Q,7U8,7M8,B38M,737 MAX 8,175,2,2/16/2023,AC2FA4,Spirit of Hope,98673,145400,181700,181200,152800,CH-GJ,Boeing,2023-02-16,02/22/2023,,,1,1,0,HGS-6000,1,0,C+,NOT ETOPS,PERM,NO,SBAS,Anuvu,,,
N8627B,73H,73H,B738,737-800,175,2,3/26/2014,ABD994,,92523,138300,174700,174200,146300,cgbr,Boeing,5/31/2027,04/23/2014,02/01/2026,,1,1,0,HGS-4000,0,0,C1,NOT ETOPS,PERM,NO,SBAS,Anuvu,,,true
N8890Q,7U8,7M8,B38M,737 MAX 8,175,2,8/15/2023,AC41AB,,98807,145400,181700,181200,152800,HK-FS,Boeing,8/16/2024,08/17/2023,,,1,1,0,HGS-6000,1,0,C+,NOT ETOPS,Flywire,YES,SBAS,ViaSat,,,
N8652B,7P8,73H,B738,737-800,175,2,11/9/2014,ABE40A,,92911,138300,174700,174200,146300,LR-EP,Boeing,11/30/2027,11/12/2014,,,1,1,0,HGS-4000,0,0,C+,NOT ETOPS,PERM,NO,SBAS,Anuvu,,,
N276WN,7S7,7S7,B737,737-700,137,2,5/9/2007,A2BEC7,,84062,121700,155000,154500,129200,,Boeing,8/31/2027 0:00,05/14/2007,,,0,2,0,HGS-4000,0,0,C+,NOT ETOPS,PERM,NO,SBAS,Anuvu,,,
N272WN,7S7,7S7,B737,737-700,137,2,3/29/2007,A2AFEB,,84654,121700,155000,154500,129200,,Boeing,3/31/2027 0:00,03/29/2007,,,0,2,0,HGS-4000,0,0,C+,NOT ETOPS,PERM,NO,SBAS,Anuvu,,,
N8972S,7X8,7M8,B38M,737 MAX 8,175,2,9/29/2025,AC6204,,99481,145400,181700,181200,152800,DP-GK,Boeing,,10/02/2025,,,1,1,0,HGS-6000,1,0,C+,NOT ETOPS,Flywire,YES,SBAS,VIA,JAM MEX PLS,,
N900WN,7S7,7S7,B737,737-700,137,2,12/9/2007,AC712D,,85704,121700,155000,154500,129200,,Boeing,3/31/2026,12/09/2007,,,0,2,0,HGS-4000,1,0,C+,NOT ETOPS,PERM,NO,SBAS,Anuvu,,,
N426WN,7S7,7S7,B737,737-700,137,2,4/15/2002,A513EA,,85826,121700,155000,154500,129200,,Boeing,8/31/2028 0:00,04/29/2002,,,0,2,0,HGS-2350,0,0,C+,NOT ETOPS,PERM,NO,SBAS,Anuvu,,,
N8756S,7V8,7M8,B38M,737 MAX 8,175,2,5/17/2022,AC0C24,,99253,145400,181700,181200,152800,HL-GP,Boeing,2022-05-17,05/23/2022,,,1,1,2,HGS-6000,1,4,ET,ETOPS,PERM,NO,SBAS,Anuvu,,YES,
N558WN,73R,73W,B737,737-700,143,1,4/24/2002,A71F24,,85812,121700,155000,154500,129200,AH-GP,Boeing,5/31/2027,03/02/2015,12/29/2024,,0,2,0,CAT I,0,3,C1,NOT ETOPS,PERM,NO,SA-ON,Anuvu,MEX,,true
N7725A,73R,73W,B737,737-700,143,2,4/17/2006,AA737D,,86718,121700,155000,154500,129200,CJ-HM,Boeing,11/13/2025,01/28/2015,11/18/2025,,0,2,0,HGS-4000,1,3,C1,NOT ETOPS,PERM,NO,SBAS,Anuvu,,,true
N8520Q,7A8,73H,B738,737-800,175,2,1/27/2017,ABB12D,,91173,138300,174700,174200,146300,HJ-ES,Boeing,2/28/2027 0:00,01/27/2017,,,1,1,0,HGS-4000,0,0,C+,NOT ETOPS,PERM,NO,SBAS,Anuvu,,,
N8665D,7P8,73H,B738,737-800,175,2,4/17/2015,ABE82C,,92831,138300,174700,174200,146300,JP-DE,Boeing,5/31/2028,04/22/2015,,,1,1,0,HGS-4000,0,0,C+,NOT ETOPS,PERM,NO,SBAS,Anuvu,,,
N7743B,7R7,7S7,B737,737-700,137,1,3/31/2008,AA7AA6,,86188,121700,155000,154500,129200,PS-BG,Boeing,7/31/2027,07/03/2014,,,0,2,0,HGS-4000,0,3,OW,NOT ETOPS,PERM,NO,SBAS,Anuvu,,,
N8609A,7A8,73H,B738,737-800,175,2,2/13/2013,ABD26B,,91969,138300,174700,174200,146300,KM-HJ,Boeing,2/28/2026 0:00,02/14/2013,,,1,1,0,HGS-4000,0,0,C+,NOT ETOPS,PERM,NO,SBAS,Anuvu,,,
N273WN,7S7,7S7,B737,737-700,137,2,4/12/2007,A2B3A2,,84971,121700,155000,154500,129200,,Boeing,6/30/2027 0:00,04/16/2007,,,0,2,0,HGS-4000,0,0,C+,NOT ETOPS,PERM,NO,SBAS,Anuvu,,,
N7742B,7S7,7S7,B737,737-700,137,1,2/19/2007,AA7A83,,85386,121700,155000,154500,129200,DF-BC,Boeing,2/28/2027,01/04/2014,,,0,2,0,HGS-4000,0,0,C+,NOT ETOPS,PERM,NO,SBAS,Anuvu,,,
N241WN,7S7,7S7,B737,737-700,137,2,6/20/2006,A235B7,,85680,121700,155000,154500,129200,,Boeing,10/31/2027 0:00,06/12/2006,,,0,2,0,HGS-4000,0,0,C+,NOT ETOPS,PERM,NO,SBAS,Anuvu,,,
N7874B,7S7,7S7,B737,737-700,137,1,4/28/2004,AAAD6D,,85860,121700,155000,154500,129200,AK-PR,Boeing,12/31/2025 0:00,06/29/2016,,,0,2,0,HGS-4000,0,0,C+,NOT ETOPS,PERM,NO,SBAS,Anuvu,,,
N8995Q,7M8,7M8,B38M,737 MAX 8,175,2,3/25/2025,,,90000,145000,174700,174200,151500,,Boeing,,,,,,,,,,,C1,NOT ETOPS,PERM,,,,,,
N953WN,7S7,7S7,B737,737-700,137,2,12/21/2010,AD41CD,Silver One,85605,121700,155000,154500,129200,,Boeing,1/31/2027,12/23/2010,,,0,1,0,HGS-4000,0,0,C1,NOT ETOPS,PERM,NO,SBAS,Anuvu,MEX,,
N8856S,7U8,7M8,B38M,737 MAX 8,175,2,5/15/2023,AC33A3,,98896,145400,181700,181200,152800,DQ-EP,Boeing,2023-05-15,05/17/2023,,,1,1,0,HGS-6000,1,0,C+,NOT ETOPS,PERM,YES,SBAS,ViaSat,,,
N215WN,7S7,7S7,B737,737-700,137,2,6/2/2005,A1CE16,,85599,121700,155000,154500,129200,,Boeing,8/31/2027 0:00,05/17/2005,,,0,2,0,HGS-4000,0,0,C+,NOT ETOPS,PERM,NO,SBAS,Anuvu,,,
N8730Q,7V8,7M8,B38M,737 MAX 8,175,2,12/20/2018,AC03E2,,99388,145400,181700,181200,152800,LS-DQ,Boeing,2018-12-20,12/21/2018,,,1,1,2,HGS-6000,1,4,ET,ETOPS,PERM,NO,SBAS,Anuvu,,,
N8531Q,7A8,73H,B738,737-800,175,2,5/24/2017,ABB507,,91753,138300,174700,174200,146300,DM-FL,Boeing,6/30/2027 0:00,05/25/2017,,,1,1,0,HGS-4000,0,0,C+,NOT ETOPS,PERM,NO,SBAS,Anuvu,,,
N8819L,7U8,7M8,B38M,737 MAX 8,175,2,11/23/2022,AC252A,,98966,145400,181700,181200,152800,EH-AD,Boeing,2022-11-23,12/05/2022,,,1,1,0,HGS-6000,1,0,C+,NOT ETOPS,PERM,NO,SBAS,Anuvu,,,
N8802Q,7U8,7M8,B38M,737 MAX 8,175,2,3/2/2021,AC2082,,98587,145400,181700,181200,152800,AG-FM,Boeing,2021-03-02,03/03/2021,,,1,1,0,HGS-6000,0,0,C+,NOT ETOPS,PERM,NO,SBAS,Anuvu,,,
N8833L,7U8,7M8,B38M,737 MAX 8,175,2,12/21/2022,AC2BC6,,98301,145400,181700,181200,152800,DG-FH,Boeing,12/31/2029,12/29/2022,,,1,1,0,HGS-6000,1,0,C+,NOT ETOPS,PERM,NO,SBAS,Anuvu,,,
N298WN,7S7,7S7,B737,737-700,137,2,11/28/2007,A31533,,85294,121700,155000,154500,129200,,Boeing,3/31/2029 0:00,11/29/2007,,,0,2,0,HGS-4000,1,0,C+,NOT ETOPS,PERM,NO,SBAS,Anuvu,,,
N8818Q,7U8,7M8,B38M,737 MAX 8,175,2,2/5/2021,AC250B,,98703,145400,181700,181200,152800,BH-KS,Boeing,4/30/2028 0:00,02/06/2021,,,1,1,0,HGS-6000,0,0,C+,NOT ETOPS,PERM,NO,SBAS,Anuvu,,,
N477WN,7S7,7S7,B737,737-700,137,2,8/10/2004,A5DD1C,,85307,121700,155000,154500,129200,,Boeing,5/31/2028 0:00,08/05/2004,,,0,2,0,HGS-2350,0,0,C+,NOT ETOPS,PERM,NO,SBAS,Anuvu,,,
N8725L,7V8,7M8,B38M,737 MAX 8,175,2,10/29/2018,AC00D6,,99371,145400,181700,181200,152800,BH-CK,Boeing,2018-10-29,05/20/2021,,,1,1,2,HGS-6000,1,4,ET,ETOPS,PERM,NO,SBAS,Anuvu,,,
N8602F,7A8,73H,B738,737-800,175,2,5/30/2012,ABD17B,,91549,138300,174700,174200,146300,DS-FJ,Boeing,1/31/2027,06/05/2012,,,1,1,0,HGS-4000,0,0,C+,NOT ETOPS,PERM,NO,SBAS,Anuvu,,,
N8750Q,7V8,7M8,B38M,737 MAX 8,175,2,3/1/2021,AC0B50,,99122,145400,181700,181200,152800,DF-CH,Boeing,2021-03-01,03/02/2021,,,1,1,2,HGS-6000,1,4,ET,ETOPS,PERM,NO,SBAS,Anuvu,,,
N281WN,7S7,7S7,B737,737-700,137,2,6/28/2007,A2D3B3,,85571,121700,155000,154500,129200,,Boeing,10/31/2027 0:00,06/27/2007,,,0,2,0,HGS-4000,0,0,C+,NOT ETOPS,PERM,NO,SBAS,Anuvu,,,
N8949Q,7U8,7M8,B38M,737 MAX 8,175,2,4/16/2025,AC57D2,,99029,145400,181700,181200,152800,CR-GK,Boeing,2025-04-16,04/23/2025,,,1,1,0,HGS-6000,1,0,C+,NOT ETOPS,PERM,YES,SBAS,ViaSat,PLS,,
N8872Q,7U8,7M8,B38M,737 MAX 8,175,2,7/17/2023,AC3A83,,98850,145400,181700,181200,152800,GM-JK,Boeing,10/17/2023 0:00,07/19/2023,,,1,1,0,HGS-6000,1,0,C+,NOT ETOPS,PERM,YES,SBAS,ViaSat,,,
N8886C,7U8,7M8,B38M,737 MAX 8,175,2,8/10/2023,AC3EBA,,98796,145400,181700,181200,152800,GS-HM,Boeing,2023-08-10,08/16/2023,,,1,1,0,HGS-6000,1,0,C+,NOT ETOPS,PERM,YES,SBAS,ViaSat,,,
N8898L,7U8,7M8,B38M,737 MAX 8,175,2,8/7/2023,AC42BF,,98826,145400,181700,181200,152800,JL-AQ,Boeing,8/10/2024 0:00,08/11/2023,,,1,1,0,HGS-6000,1,0,C+,NOT ETOPS,PERM,YES,SBAS,ViaSat,,,
N7723E,7R7,7S7,B737,737-700,137,2,3/17/2006,AA733B,,86368,121700,155000,154500,129200,CJ-EK,Boeing,9/30/2028 0:00,01/02/2015,,,0,2,0,HGS,0,3,OW,NOT ETOPS,PERM,NO,SBAS,Anuvu,,,
N451WN,7S7,7S7,B737,737-700,137,2,2/25/2004,A577D4,,85387,121700,155000,154500,129200,,Boeing,1/31/2027 0:00,12/14/2003,,,0,2,0,HGS-2350,0,0,C+,NOT ETOPS,PERM,NO,SBAS,Anuvu,,,
N7739A,7S7,7S7,B737,737-700,137,1,12/21/2006,AA77C0,,85984,121700,155000,154500,129200,DE-BG,Boeing,10/31/2028 0:00,10/19/2012,,,0,2,0,HGS-4000,0,0,C+,NOT ETOPS,PERM,NO,SBAS,Anuvu,,,
N961WN,7S7,7S7,B737,737-700,137,2,7/26/2011,AD61DE,,85609,121700,155000,154500,129200,,Boeing,8/31/2027,07/27/2011,,,0,1,0,HGS-4000,0,0,C1,NOT ETOPS,PERM,NO,SBAS,Anuvu,MEX,,
N8685B,7P8,73H,B738,737-800,175,2,5/2/2016,ABEF98,,93606,138300,174700,174200,146300,BQ-GM,Boeing,6/30/2026 0:00,05/05/2016,,,1,1,0,HGS-4000,0,0,C+,NOT ETOPS,PERM,YES,SBAS,Anuvu,,,
N7726A,7S7,7S7,B737,737-700,137,1,5/4/2006,AA73A0,,85760,121700,155000,154500,129200,CK-BG,Boeing,6/30/2028,04/15/2012,02/05/2026,,0,2,0,HGS-4000,0,0,C1,NOT ETOPS,PERM,NO,SBAS,Anuvu,,,true
N8774Q,7V8,7M8,B38M,737 MAX 8,175,2,1/26/2023,AC134A,,99423,145400,181700,181200,152800,JM-CH,Boeing,1/31/2030,01/31/2023,,,1,1,2,HGS-6000,1,4,ET,ETOPS,PERM,YES,SBAS,Anuvu,,,
N940WN,7S7,7S7,B737,737-700,137,2,6/23/2009,AD0F29,,85304,121700,155000,154500,129200,,Boeing,10/31/2027,06/24/2009,,,0,1,0,HGS-4000,0,0,C1,NOT ETOPS,PERM,NO,SBAS,Anuvu,MEX,,
N8897K,7U8,7M8,B38M,737 MAX 8,175,2,11/29/2023,AC429B,,98771,145400,181700,181200,152800,HS-AG,Boeing,2023-11-29,12/05/2023,,,1,1,0,HGS-6000,1,0,C+,NOT ETOPS,PERM,YES,SBAS,ViaSat,,,
N274WN,7S7,7S7,B737,737-700,137,2,4/20/2007,A2B759,,84829,121700,155000,154500,129200,,Boeing,6/30/2027,04/23/2007,,,0,2,0,HGS-4000,0,0,C+,NOT ETOPS,PERM,NO,SBAS,Anuvu,,,
N8831L,7U8,7M8,B38M,737 MAX 8,175,2,1/3/2023,AC2B80,,98830,145400,181700,181200,152800,DH-KL,Boeing,1/31/2034,01/12/2023,,,1,1,0,HGS-6000,1,0,C+,NOT ETOPS,PERM,NO,SBAS,Anuvu,,,
N403WN,73W,73W,B737,737-700,143,2,2/5/2001,A4B9C7,,86723,121700,155000,154500,129200,,Boeing,6/30/2027,02/05/2001,01/01/2025,,1,2,0,YES,0,0,C1,NOT ETOPS,PERM,NO,SA-ON,Anuvu,MEX,,true
N427WN,7S7,7S7,B737,737-700,137,2,4/24/2002,A517A1,,85521,121700,155000,154500,129200,,Boeing,11/30/2025 0:00,04/29/2002,,,0,2,0,HGS-2350,0,0,C+,NOT ETOPS,PERM,NO,SBAS,Anuvu,,,
N7884G,73W,73W,B737,737-700,0,1,6/28/2001,,,85816,121700,155000,154500,129200,FJ-BS,Boeing,,07/01/2001,08/08/2024,08/16/2024,0,0,0,CAT I,,,C1,NOT ETOPS,PERM,NO,,,,,
N8884Q,7U8,7M8,B38M,737 MAX 8,175,2,7/7/2023,AC3E80,,98806,145400,181700,181200,152800,GS-BP,Boeing,10/9/2023 0:00,07/11/2023,,,1,1,0,HGS-6000,1,0,C+,NOT ETOPS,PERM,YES,SBAS,ViaSat,,,
N418WN,73W,73W,B737,737-700,143,2,11/12/2001,,,85504,121700,155000,154500,129200,,Boeing,2001-11-12,01/29/2002,06/05/2025,,0,2,0,HGS-2350,0,0,C1,NOT ETOPS,PERM,NO,SBAS,Anuvu,,,true
N224WN,7S7,7S7,B737,737-700,137,2,10/28/2005,A1F1DE,,85327,121700,155000,154500,129200,,Boeing,10/19/2028 0:00,08/09/2005,,,0,2,0,HGS-4000,0,0,C+,NOT ETOPS,PERM,NO,SBAS,Anuvu,,,
N941WN,7S7,7S7,B737,737-700,137,2,7/8/2009,AD12E0,,85357,121700,155000,154500,129200,,Boeing,10/31/2027,07/13/2009,,,0,1,0,HGS-4000,0,0,C1,NOT ETOPS,PERM,NO,SBAS,Anuvu,MEX,,
N939WN,7S7,7S7,B737,737-700,137,2,6/10/2009,AD0919,,84920,121700,155000,154500,129200,,Boeing,8/31/2027,06/15/2009,,,0,1,0,HGS-4000,0,0,C1,NOT ETOPS,PERM,NO,SBAS,Anuvu,MEX,,
N8810L,7U8,7M8,B38M,737 MAX 8,175,2,3/31/2021,AC23EF,,98630,145400,181700,181200,152800,LR-AC,Boeing,6/30/2028,04/01/2021,,,1,1,0,HGS-6000,0,0,C+,NOT ETOPS,PERM,NO,SBAS,Anuvu,,,
N409WN,73W,73W,B737,737-700,143,2,12/19/2001,A4D011,,85264,121700,155000,154500,129200,,Boeing,6/30/2026,12/24/2001,09/15/2025,,1,1,0,HGS-2350,0,0,C1,NOT ETOPS,PERM,NO,SBAS,Anuvu,,,true
N8622A,73H,73H,B738,737-800,175,2,12/14/2013,ABD8E4,,92051,138300,174700,174200,146300,HQ-DL,Boeing,1/31/2027,12/16/2013,11/08/2024,,1,1,0,CAT I,0,0,C1,NOT ETOPS,PERM,NO,SBAS,Anuvu,MEX,,true
N913WN,7S7,7S7,B737,737-700,137,2,3/2/2008,ACA3D1,,85111,121700,155000,154500,129200,,Boeing,3/31/2027 0:00,03/06/2008,,,0,2,0,HGS-4000,0,0,C+,NOT ETOPS,PERM,NO,SBAS,Anuvu,,,
N8909L,7U8,7M8,B38M,737 MAX 8,175,2,12/18/2023,AC48F2,,98940,145400,181700,181200,152800,JR-AE,Boeing,2023-12-18,12/20/2023,,,1,1,0,HGS-6000,1,0,C+,NOT ETOPS,PERM,YES,SBAS,ViaSat,,,
N7851A,73W,73W,B737,737-700,143,1,6/6/2016,AAA595,,85681,121700,155000,154500,129200,CSMP,Boeing,6/30/2026,12/15/2016,01/01/2025,,1,2,0,YES,0,0,C1,NOT ETOPS,PERM,NO,SA-ON,Anuvu,MEX,,true
N7857B,7S7,7S7,B737,737-700,137,2,2/23/2005,AAA668,,85782,121700,155000,154500,129200,MR-JP,Boeing,2/28/2027 0:00,03/08/2017,,,0,2,0,HGS-4000,0,0,C+,NOT ETOPS,PERM,NO,SBAS,Anuvu,,,
N8534Z,7A8,73H,B738,737-800,175,2,6/1/2017,ABB579,,91283,138300,174700,174200,146300,DH-KM,Boeing,6/30/2027 0:00,05/31/2017,,,1,1,0,HGS-4000,0,0,C+,NOT ETOPS,PERM,NO,SBAS,Anuvu,,,
N923WN,7S7,7S7,B737,737-700,137,2,6/7/2008,ACCB50,,84886,121700,155000,154500,129200,,Boeing,9/30/2027 0:00,06/09/2008,,,0,2,0,HGS-4000,0,0,C+,NOT ETOPS,PERM,NO,SBAS,Anuvu,,,
N561WN,7S7,7S7,B737,737-700,137,1,2/24/2003,A72CA2,,86024,121700,155000,154500,129200,MQ-DL,Boeing,2/29/2028 0:00,07/31/2015,,,0,2,0,HGS-4000,0,0,C+,NOT ETOPS,PERM,NO,SBAS,Anuvu,,,
N909WN,7S7,7S7,B737,737-700,137,2,2/18/2008,AC929C,,84919,121700,155000,154500,129200,,Boeing,9/30/2026 0:00,02/20/2008,,,0,2,0,HGS-4000,1,0,C+,NOT ETOPS,PERM,NO,SBAS,Anuvu,,,
N8942L,7U8,7M8,B38M,737 MAX 8,175,2,3/11/2025,AC56D9,,98957,145400,181700,181200,152800,CM-EH,Boeing,2025-03-11,03/17/2025,,,1,1,0,HGS-6000,1,0,C+,NOT ETOPS,PERM,YES,SBAS,ViaSat,PLS,,
N414WN,73W,73W,B737,737-700,143,2,10/4/2001,A4E4FD,,85707,121700,155000,154500,129200,,Boeing,12/31/2026,08/02/2001,07/18/2025,,0,2,0,HGS-2350,0,0,C1,NOT ETOPS,PERM,NO,SBAS,Anuvu,,,true
N8311Q,7R8,73H,B738,737-800,175,2,6/12/2012,AB5E9B,,91814,138300,174700,174200,146300,GP-DR,Boeing,6/30/2028 0:00,06/14/2012,,,1,1,2,HGS-4000,1,4,ET,ETOPS,PERM,NO,SBAS,Anuvu,,,
N931WN,7S7,7S7,B737,737-700,137,2,2/5/2009,ACEB61,,85488,121700,155000,154500,129200,,Boeing,3/31/2027,02/04/2009,,,0,1,0,HGS-4000,0,0,C1,NOT ETOPS,PERM,NO,SBAS,Anuvu,MEX,,
N8918Q,7U8,7M8,B38M,737 MAX 8,175,2,1/25/2024,AC4C8A,,98988,145400,181700,181200,152800,CG-FM,Boeing,,01/29/2024,,,1,1,0,HGS-6000,1,0,C+,NOT ETOPS,PERM,YES,SBAS,ViaSat,PLS,,
N938WN,7S7,7S7,B737,737-700,137,2,6/7/2009,AD0562,Heros of the Heart,85231,121700,155000,154500,129200,,Boeing,8/31/2027,06/10/2009,,,0,1,0,HGS-4000,0,0,C1,NOT ETOPS,PERM,NO,SBAS,Anuvu,MEX,,
N7811F,73R,73W,B737,737-700,143,2,10/31/2001,,,86797,121700,155000,154500,129200,JP-HK,Boeing,2001-10-31,08/07/2013,06/12/2025,,1,1,2,HGS-4000,2,3,C1,NOT ETOPS,PERM,NO,SBAS,Anuvu,,,true
N8754S,7V8,7M8,B38M,737 MAX 8,175,2,4/14/2022,AC0BDE,,99334,145400,181700,181200,152800,FL-CS,Boeing,2022-04-14,04/20/2022,,,1,1,2,HGS-6000,1,4,ET,ETOPS,PERM,NO,SBAS,Anuvu,,YES,
N454WN,7S7,7S7,B737,737-700,137,2,3/26/2004,A582F9,,85484,121700,155000,154500,129200,,Boeing,6/30/2027 0:00,03/25/2004,,,0,2,0,HGS-2350,0,0,C+,NOT ETOPS,PERM,NO,SBAS,Anuvu,,,
N481WN,7S7,7S7,B737,737-700,137,2,9/1/2004,A5EE51,,85884,121700,155000,154500,129200,,Boeing,5/31/2028 0:00,08/25/2004,,,0,2,0,HGS-2350,0,0,C+,NOT ETOPS,PERM,NO,SBAS,Anuvu,,,
N8847Q,7U8,7M8,B38M,737 MAX 8,175,2,3/21/2023,AC300D,,98632,145400,181700,181200,152800,CF-EH,Boeing,2023-03-21,03/23/2023,,,1,1,0,HGS-6000,1,0,C+,NOT ETOPS,PERM,YES,SBAS,Anuvu,,,
N7730A,73W,73W,B737,737-700,143,1,7/20/2006,AA7685,,85748,121700,155000,154500,129200,CL-DF,Boeing,6/30/2028,06/23/2012,12/17/2025,,0,2,0,HGS-4000,0,0,C1,NOT ETOPS,PERM,NO,SBAS,Anuvu,,,true
N8975K,7X8,7M8,B38M,737 MAX 8,175,2,10/5/2025,AC6266,,99529,145400,181700,181200,152800,GL-JK,Boeing,,10/10/2025,,,1,1,0,HGS,1,0,C+,NOT ETOPS,PERM,YES,SBAS,VIA,JAM MEX PLS,,
N8982S,7X8,7M8,B38M,737 MAX 8,175,2,11/17/2025,AC65BB,,99470,145400,181700,181200,152800,EP-AB,Boeing,,11/19/2025,,,1,1,0,HGS-6000,,0,C+,NOT ETOPS,PERM,YES,SBAS,VIA,JAM MEX PLS,NO,
N8801Q,7U8,7M8,B38M,737 MAX 8,175,2,2/22/2021,AC205F,,97613,145400,181700,181200,152800,EK-JP,Boeing,2021-02-22,02/23/2021,,,1,1,0,HGS-6000,0,0,C+,NOT ETOPS,PERM,NO,SBAS,Anuvu,,,
N441WN,7S7,7S7,B737,737-700,137,2,8/9/2003,A55055,,85232,121700,155000,154500,129200,,Boeing,5/31/2028 0:00,07/31/2003,,,0,2,0,HGS-2350,0,0,C+,NOT ETOPS,PERM,NO,SBAS,Anuvu,,,
N8556Z,7A8,73H,B738,737-800,175,2,12/11/2017,ABBD2D,,90345,138300,174700,174200,146300,HL-EM,Boeing,2017-12-11,12/12/2017,,,1,1,0,HGS-4000,0,0,C+,NOT ETOPS,PERM,NO,SBAS,Anuvu,,,
N226WN,7S7,7S7,B737,737-700,137,2,11/30/2005,A1F94C,,85190,121700,155000,154500,129200,,Boeing,3/31/2026 0:00,09/14/2005,,,0,2,0,HGS-4000,0,0,C+,NOT ETOPS,PERM,NO,SBAS,Anuvu,,,
N8797Q,7V8,7M8,B38M,737 MAX 8,175,2,4/10/2023,AC1B21,,99367,145400,181700,181200,152800,EL-AD,Boeing,2023-04-10,04/13/2023,,,1,1,2,HGS-6000,1,4,C2,ETOPS,PERM,YES,SBAS,Anuvu,,,
N8976K,7X8,7M8,B38M,737 MAX 8,175,2,10/10/2025,AC6289,,99458,145400,181700,181200,152800,JK-BQ,Boeing,,10/17/2025,,,1,1,0,HGS-6000,1,0,C+,NOT ETOPS,PERM,YES,SBAS,VIA,JAM MEX PLS,NO,
N8325D,7R8,73H,B738,737-800,175,2,11/13/2012,AB62D3,,92300,138300,174700,174200,146300,EP-DS,Boeing,2012-11-13,11/16/2012,,,1,1,2,HGS-4000,1,4,ET,ETOPS,PERM,NO,SBAS,Anuvu,,,
N8933Q,7U8,7M8,B38M,737 MAX 8,175,2,9/20/2024,AC5349,,99028,145400,181700,181200,152800,FM-CE,Boeing,9/27/2025,09/30/2024,,,1,1,0,HGS-6000,1,0,C+,NOT ETOPS,PERM,YES,SBAS,ViaSat,PLS,,
N8880G,7U8,7M8,B38M,737 MAX 8,175,2,6/9/2023,AC3DEC,,98852,145400,181700,181200,152800,GR-AH,Boeing,2023-06-09,06/14/2023,,,1,1,0,HGS-6000,1,0,C+,NOT ETOPS,PERM,YES,SBAS,ViaSat,,,
N8956Q,7U8,7M8,B38M,737 MAX 8,175,2,6/5/2025,AC5B20,,99000,145400,181700,181200,152800,LM-JQ,Boeing,2025-06-05,06/09/2025,,,1,1,0,HGS-6000,1,0,C+,NOT ETOPS,PERM,YES,SBAS,ViaSat,MEX PLS,,
N8822Q,7U8,7M8,B38M,737 MAX 8,175,2,12/5/2022,AC27F0,,98632,145400,181700,181200,152800,DL-HK,Boeing,2022-12-05,12/07/2022,,,1,1,0,HGS-6000,1,0,C1,NOT ETOPS,PERM,YES,SBAS,Anuvu,,,true
N8301J,7R8,73H,B738,737-800,175,2,3/7/2012,AB5ADE,Warrior One,92699,138300,174700,174200,146300,GP-DM,Boeing,2012-03-07,03/07/2012,,,1,1,2,HGS-4000,1,4,ET,ETOPS,PERM,NO,SBAS,Anuvu,,,
N952WN,7S7,7S7,B737,737-700,137,2,11/23/2010,AD3E16,,85470,121700,155000,154500,129200,,Boeing,12/31/2026,11/30/2010,,,0,1,0,HGS-4000,0,0,C1,NOT ETOPS,PERM,NO,SBAS,Anuvu,MEX,,
N8959Q,7U8,7M8,B38M,737 MAX 8,175,2,6/11/2025,AC5B89,,98927,145400,181700,181200,152800,AJ-GH,Boeing,2025-06-11,06/23/2025,,,1,1,0,HGS-6000,1,0,C+,NOT ETOPS,PERM,YES,SBAS,ViaSat,MEX PLS,,
N8728Q,7V8,7M8,B38M,737 MAX 8,175,2,12/27/2018,AC0143,,100377,145400,181700,181200,152800,KR-JM,Boeing,2018-12-27,12/27/2018,,,1,1,2,HGS-6000,1,4,ET,ETOPS,PERM,NO,SBAS,Anuvu,,YES,
N8896L,7U8,7M8,B38M,737 MAX 8,175,2,11/9/2023,AC4279,,98747,145400,181700,181200,152800,HQ-BS,Boeing,2023-11-09,11/15/2023,,,1,1,0,HGS-6000,1,0,C+,NOT ETOPS,PERM,YES,SBAS,ViaSat,,,
N8695D,7A8,73H,B738,737-800,175,2,8/16/2016,ABF351,,92235,138300,174700,174200,146300,AE-KR,Boeing,9/30/2026 0:00,08/16/2016,,,1,1,0,HGS-4000,0,0,C+,NOT ETOPS,PERM,NO,SBAS,Anuvu,,,
N8738K,7V8,7M8,B38M,737 MAX 8,175,2,12/14/2020,AC04F5,,98063,145400,181700,181200,152800,LQ-AG,Boeing,2020-12-14,12/17/2020,,,1,1,2,HGS-6000,1,4,ET,ETOPS,PERM,NO,SBAS,Anuvu,,,
N8731J,7V8,7M8,B38M,737 MAX 8,175,2,12/19/2018,AC03FF,,99308,145400,181700,181200,152800,MQ-FP,Boeing,2018-12-19,12/20/2018,,,1,1,2,HGS-6000,1,4,ET,ETOPS,PERM,NO,SBAS,Anuvu,,YES,
N7748A,7R7,7S7,B737,737-700,137,1,7/2/2007,AA7B54,,85778,121700,155000,154500,129200,QR-FS,Boeing,8/31/2027 0:00,09/09/2014,,,0,2,0,HGS-4000,0,3,OW,NOT ETOPS,PERM,NO,SBAS,Anuvu,,,
N8743K,7V8,7M8,B38M,737 MAX 8,175,2,1/15/2021,AC07FD,,97878,145400,181700,181200,152800,AK-DH,Boeing,2021-01-15,01/18/2021,,,1,1,2,HGS-6000,1,4,ET,ETOPS,PERM,NO,SBAS,Anuvu,,,
N8885Q,7U8,7M8,B38M,737 MAX 8,175,2,8/9/2023,AC3EA3,,98851,145400,181700,181200,152800,GS-HK,Boeing,2023-08-09,09/29/2023,,,1,1,0,HGS-6000,1,0,C+,NOT ETOPS,PERM,YES,SBAS,ViaSat,,,
N469WN,7S7,7S7,B737,737-700,137,2,6/22/2004,A5BD0B,,85507,121700,155000,154500,129200,,Boeing,10/31/2027 0:00,06/09/2004,,,0,2,0,HGS-2350,0,0,C+,NOT ETOPS,PERM,NO,SBAS,Anuvu,,,
N8798Q,7V8,7M8,B38M,737 MAX 8,175,2,3/8/2023,AC1B44,,99385,145400,181700,181200,152800,EH-AK,Boeing,6/13/2023 0:00,03/14/2023,,,1,1,2,HGS-6000,1,4,ET,ETOPS,PERM,YES,SBAS,Anuvu,,,
N945WN,7S7,7S7,B737,737-700,137,2,3/31/2010,AD21BC,Florida One,85608,121700,155000,154500,129200,,Boeing,3/31/2027,04/01/2010,,,0,1,0,HGS-4000,0,0,C1,NOT ETOPS,PERM,NO,SBAS,Anuvu,MEX,,
N479WN,7S7,7S7,B737,737-700,137,2,8/21/2004,A5E48A,,85444,121700,155000,154500,129200,,Boeing,5/31/2028 0:00,08/17/2004,,,0,2,0,HGS-2350,0,0,C+,NOT ETOPS,PERM,NO,SBAS,Anuvu,,,
N8776L,7V8,7M8,B38M,737 MAX 8,175,2,9/15/2022,AC138C,,99495,145400,181700,181200,152800,HK-DL,Boeing,9/30/2029,09/20/2022,,,1,1,2,HGS-6000,1,4,ET,ETOPS,PERM,NO,SBAS,Anuvu,,YES,
N7877H,7S7,7S7,B737,737-700,137,1,3/2/2005,AAADDC,,86053,121700,155000,154500,129200,FR-MP,Boeing,11/30/2025 0:00,06/08/2016,,,0,2,0,HGS-4000,0,0,C+,NOT ETOPS,PERM,NO,SBAS,Anuvu,,,
N452WN,7S7,7S7,B737,737-700,137,2,3/3/2004,A57B8B,,85608,121700,155000,154500,129200,,Boeing,3/31/2027 0:00,02/29/2004,,,0,2,0,HGS-2350,0,0,C+,NOT ETOPS,PERM,NO,SBAS,Anuvu,,,
N7868K,7S7,7S7,B737,737-700,137,2,12/15/2005,AAAA4A,,86011,121700,155000,154500,129200,LM-EK,Boeing,12/31/2027 0:00,06/05/2018,,,0,2,0,HGS-4000,0,0,C+,NOT ETOPS,PERM,NO,SBAS,Anuvu,,,
N907WN,7R7,7S7,B737,737-700,137,2,1/31/2008,AC8B2E,,85024,121700,155000,154500,129200,,Boeing,9/30/2026,02/04/2008,,,0,2,0,HGS-4000,0,3,OW,NOT ETOPS,PERM,NO,SBAS,Anuvu,,,
N204WN,7S7,7S7,B737,737-700,137,2,3/9/2005,A1A2E0,,85527,121700,155000,154500,129200,,Boeing,12/31/2026 0:00,02/14/2005,,,0,2,0,HGS-4000,0,0,C+,NOT ETOPS,PERM,NO,SBAS,Anuvu,,,
N8541W,7A8,73H,B738,737-800,175,2,6/28/2017,ABB8C4,,91969,138300,174700,174200,146300,ES-AJ,Boeing,7/31/2027 0:00,06/30/2017,,,1,1,0,HGS-4000,0,0,C+,NOT ETOPS,PERM,NO,SBAS,Anuvu,,,
N8502Z,7A8,73H,B738,737-800,175,2,9/29/2016,ABAA0E,,92012,138300,174700,174200,146300,BH-FS,Boeing,10/31/2026 0:00,09/30/2016,,,1,1,0,HGS-4000,0,0,C+,NOT ETOPS,PERM,NO,SBAS,Anuvu,,,
N8955Q,7U8,7M8,B38M,737 MAX 8,175,2,6/10/2025,AC5AFD,,98924,145400,181700,181200,152800,LM-DQ,Boeing,2025-06-10,06/13/2025,,,1,1,0,HGS-6000,1,0,C+,NOT ETOPS,PERM,YES,SBAS,ViaSat,MEX PLS,,
N422WN,73W,73W,B737,737-700,143,2,3/21/2002,A5050E,,85579,121700,155000,154500,129200,,Boeing,8/31/2027,04/29/2002,11/07/2025,,0,2,0,HGS-2350,0,0,C1,NOT ETOPS,PERM,NO,SBAS,Anuvu,,,true
N8655D,7A8,73H,B738,737-800,175,2,12/11/2014,ABE475,New Mexico One,92822,138300,174700,174200,146300,BF-DS,Boeing,1/31/2028 0:00,12/12/2014,,,1,1,0,HGS-4000,0,0,C+,NOT ETOPS,PERM,YES,SBAS,Anuvu,,,
N8950L,7U8,7M8,B38M,737 MAX 8,175,2,4/29/2025,AC5A4A,,99026,145400,181700,181200,152800,CF-HM,Boeing,2025-04-29,05/02/2025,,,1,1,0,HGS-6000,1,0,C+,NOT ETOPS,PERM,YES,SBAS,ViaSat,PLS,,
N8734Q,7V8,7M8,B38M,737 MAX 8,175,2,2/20/2019,AC046E,,99178,145400,181700,181200,152800,FR-EQ,Boeing,2019-02-20,02/20/2019,,,1,1,2,HGS-6000,1,4,ET,ETOPS,PERM,NO,SBAS,Anuvu,,YES,
N8951S,7U8,7M8,B38M,737 MAX 8,175,2,4/25/2025,AC5A73,,99006,145400,181700,181200,152800,FK-DP,Boeing,2025-04-25,04/29/2025,,,1,1,0,HGS-6000,1,0,C+,NOT ETOPS,PERM,YES,SBAS,ViaSat,PLS,,
N293WN,7S7,7S7,B737,737-700,137,2,9/18/2007,A302A0,,85729,121700,155000,154500,129200,,Boeing,8/31/2025 0:00,09/24/2007,,,0,2,0,HGS-4000,1,0,C+,NOT ETOPS,PERM,NO,SBAS,Anuvu,,,
N8608N,7A8,73H,B738,737-800,175,2,1/24/2013,ABD254,,92252,138300,174700,174200,146300,CG-KL,Boeing,2/28/2026 0:00,01/25/2013,,,1,1,0,HGS-4000,0,0,C+,NOT ETOPS,PERM,NO,SBAS,Anuvu,,,
N8990Q,7X8,7M8,B38M,737 MAX 8,175,2,1/31/2026,AC692A,,99478,145400,181700,181200,152800,ES-DR,Boeing,,02/04/2026,,,1,1,0,HGS-6000,1,0,C+,NOT ETOPS,PERM,YES,SBAS,ViaSat,JAM MEX PLS,,
N214WN,7S7,7S7,B737,737-700,137,2,6/6/2005,A1CA5F,Maryland One,85947,121700,155000,154500,129200,,Boeing,8/31/2027 0:00,05/17/2005,,,0,2,0,HGS-4000,0,0,C+,NOT ETOPS,PERM,NO,SBAS,Anuvu,,,
N240WN,7S7,7S7,B737,737-700,137,2,6/2/2006,A23200,,85444,121700,155000,154500,129200,,Boeing,10/31/2027 0:00,06/05/2006,,,0,2,0,HGS-4000,0,0,C+,NOT ETOPS,PERM,NO,SBAS,Anuvu,,,
N7713A,7S7,7S7,B737,737-700,137,1,6/15/2005,AA6F80,,85754,121700,155000,154500,129200,CG-AE,Boeing,12/31/2026 0:00,12/10/2013,,,0,2,0,HGS-4000,0,0,C+,NOT ETOPS,PERM,NO,SBAS,Anuvu,,,
N448WN,7S7,7S7,B737,737-700,137,2,12/1/2003,A56A56,,85700,121700,155000,154500,129200,,Boeing,9/30/2026 0:00,12/14/2003,,,0,2,0,HGS-2350,0,0,C+,NOT ETOPS,PERM,NO,SBAS,Anuvu,,,
N8837Q,7U8,7M8,B38M,737 MAX 8,175,2,1/9/2023,AC2C56,,98763,145400,181700,181200,152800,CM-FK,Boeing,1/31/2034,01/16/2023,,,1,1,0,HGS-6000,1,0,C+,NOT ETOPS,PERM,NO,SBAS,Anuvu,,,
N8963Q,7U8,7M8,B38M,737 MAX 8,175,2,6/27/2025,AC5E6E,,98993,145400,181700,181200,152800,BF-CQ,Boeing,,07/01/2025,,,1,1,0,HGS,1,0,C+,NOT ETOPS,PERM,YES,SBAS,VIA,JAM MEX PLS,,
N476WN,7S7,7S7,B737,737-700,137,2,8/5/2004,A5D965,,85514,121700,155000,154500,129200,,Boeing,5/31/2028 0:00,08/02/2004,,,0,2,0,HGS-2350,0,0,C+,NOT ETOPS,PERM,NO,SBAS,Anuvu,,,
N8792Q,7V8,7M8,B38M,737 MAX 8,175,2,11/17/2022,AC1A72,,99569,145400,181700,181200,152800,FJ-CE,Boeing,11/30/2029 0:00,11/21/2022,,,1,1,2,HGS-6000,1,4,ET,ETOPS,PERM,YES,SBAS,Anuvu,,,
N8724J,7V8,7M8,B38M,737 MAX 8,175,2,10/22/2018,AC00B1,,99321,145400,181700,181200,152800,BG-HM,Boeing,2018-10-22,05/20/2021,,,1,1,2,HGS-6000,1,4,ET,ETOPS,PERM,NO,SBAS,Anuvu,,,
N8690A,7A8,73H,B738,737-800,175,2,6/17/2016,ABF29F,Colorado One,91512,138300,174700,174200,146300,EK-DQ,Boeing,8/31/2026 0:00,06/20/2016,,,1,1,0,HGS-4000,0,0,C+,NOT ETOPS,PERM,NO,SBAS,Anuvu,,,
N8854Q,7U8,7M8,B38M,737 MAX 8,175,2,3/29/2023,AC335B,,98845,145400,181700,181200,152800,KQ-CS,Boeing,2023-03-29,03/31/2023,,,1,1,0,HGS-6000,1,0,C+,NOT ETOPS,PERM,YES,SBAS,ViaSat,,,
N219WN,7S7,7S7,B737,737-700,137,2,7/8/2005,A1DCF2,,84675,121700,155000,154500,129200,,Boeing,10/31/2027 0:00,05/17/2005,,,0,2,0,HGS-4000,0,0,C+,NOT ETOPS,PERM,NO,SBAS,Anuvu,,,
N8542Z,7A8,73H,B738,737-800,175,2,7/18/2017,ABB8EA,,91662,138300,174700,174200,146300,HM-GS,Boeing,8/31/2027 0:00,07/18/2017,,,1,1,0,HGS-4000,0,0,C+,NOT ETOPS,PERM,NO,SBAS,Anuvu,,,
N8740A,7V8,7M8,B38M,737 MAX 8,175,2,1/4/2021,AC078B,,99141,145400,181700,181200,152800,AC-LR,Boeing,2021-01-04,01/11/2021,,,1,1,2,HGS-6000,1,4,ET,ETOPS,PERM,YES,SBAS,Anuvu,,,
N8922Q,7U8,7M8,B38M,737 MAX 8,175,2,8/14/2024,AC4F6F,,98872,145400,181700,181200,152800,BJ-AQ,Boeing,,08/19/2024,,,1,1,0,HGS-6000,1,0,C+,NOT ETOPS,PERM,YES,SBAS,ViaSat,PLS,,
N251WN,7S7,7S7,B737,737-700,137,2,8/17/2006,A25D36,,85549,121700,155000,154500,129200,,Boeing,5/31/2028 0:00,08/16/2006,,,0,2,0,HGS-4000,0,0,C+,NOT ETOPS,PERM,NO,SBAS,Anuvu,,,
N8305E,7R8,73H,B738,737-800,175,2,4/20/2012,AB5B66,,91814,138300,174700,174200,146300,HS-BJ,Boeing,5/31/2028 0:00,04/23/2012,,,1,1,2,HGS-4000,1,4,ET,ETOPS,PERM,NO,SBAS,Anuvu,,,
N7722B,73R,73W,B737,737-700,143,2,2/20/2006,AA7315,,86405,121700,155000,154500,129200,CH-EL,Boeing,11/30/2026,11/27/2014,12/05/2025,,0,2,0,HGS-4000,0,3,C1,NOT ETOPS,PERM,NO,SBAS,Anuvu,,,true
N8879Q,7U8,7M8,B38M,737 MAX 8,175,2,6/13/2023,AC3B78,,98859,145400,181700,181200,152800,GQ-PS,Boeing,2023-06-13,06/14/2023,,,1,1,0,HGS-6000,1,0,C+,NOT ETOPS,PERM,YES,SBAS,ViaSat,,,
N8618N,73H,73H,B738,737-800,175,2,11/1/2013,ABD60B,,92097,138300,174700,174200,146300,BQ-KM,Boeing,12/31/2026,11/04/2013,12/26/2025,,1,1,0,HGS,0,0,C1,NOT ETOPS,PERM,NO,SBAS,Anuvu,,,true
N944WN,7S7,7S7,B737,737-700,137,2,3/22/2010,AD1E05,,86121,121700,155000,154500,129200,,Boeing,3/31/2027,03/25/2010,,,0,1,0,HGS-4000,0,0,C1,NOT ETOPS,PERM,NO,SBAS,Anuvu,MEX,,
N7731A,7R7,7S7,B737,737-700,137,2,7/23/2006,AA76A8,,86241,121700,155000,154500,129200,CM-FJ,Boeing,2/29/2028 0:00,01/25/2015,,,0,2,0,HGS-4000,1,3,OW,NOT ETOPS,PERM,NO,SBAS,Anuvu,,,
N423WN,73W,73W,B737,737-700,143,2,3/28/2002,A508C5,,85374,121700,155000,154500,129200,,Boeing,2/28/2025,04/29/2002,01/20/2026,,0,2,0,HGS-2350,0,0,C1,NOT ETOPS,PERM,NO,SBAS,Anuvu,,,true
N260WN,7S7,7S7,B737,737-700,137,2,11/19/2006,A280FE,,85709,121700,155000,154500,129200,,Boeing,6/30/2026 0:00,11/22/2006,,,0,2,0,HGS-4000,0,0,C+,NOT ETOPS,PERM,NO,SBAS,Anuvu,,,
N966WN,7S7,7S7,B737,737-700,137,2,9/22/2011,AD7471,,85274,121700,155000,154500,129200,,Boeing,10/31/2027,09/27/2011,,,0,1,0,HGS-4000,0,0,C1,NOT ETOPS,PERM,NO,SBAS,Anuvu,MEX,,
N8624J,73H,73H,B738,737-800,175,2,3/25/2014,ABD932,,92218,138300,174700,174200,146300,AH-RS,Boeing,4/30/2027,03/26/2014,01/07/2026,,1,1,0,HGS-4000,0,0,C1,NOT ETOPS,PERM,NO,SBAS,Anuvu,,,true
N8328A,7R8,73H,B738,737-800,175,2,12/13/2012,AB6339,,92521,138300,174700,174200,146300,GQ-AE,Boeing,1/31/2026,12/14/2012,,,1,1,2,HGS-4000,1,4,ET,ETOPS,PERM,NO,SBAS,Anuvu,,,
N8619F,7A8,73H,B738,737-800,175,2,11/5/2013,ABD627,Illinois One,92028,138300,174700,174200,146300,CL-KR,Boeing,12/31/2026 0:00,11/08/2013,,,1,1,0,HGS-4000,0,0,C+,NOT ETOPS,PERM,NO,SBAS,Anuvu,,,
N207WN,7S7,7S7,B737,737-700,137,2,3/24/2005,A1AE05,,85254,121700,155000,154500,129200,,Boeing,3/31/2027 0:00,02/14/2005,,,0,2,0,CAT I,0,0,C+,NOT ETOPS,PERM,NO,SBAS,Anuvu,,,
N8620H,73H,73H,B738,737-800,175,2,11/3/2013,ABD8A5,Tennessee One,91517,138300,174700,174200,146300,DS-CL,Boeing,12/31/2026,11/05/2013,12/29/2025,,1,1,0,HGS-4000,0,0,C1,NOT ETOPS,PERM,NO,SBAS,Anuvu,,,true
N8689C,7A8,73H,B738,737-800,175,2,5/22/2016,ABF025,,92295,138300,174700,174200,146300,DS-EJ,Boeing,7/31/2026 0:00,05/23/2016,,,1,1,0,HGS-4000,0,0,C+,NOT ETOPS,PERM,NO,SBAS,Anuvu,,,
N8308K,7R8,73H,B738,737-800,175,2,5/14/2012,AB5BD4,,92862,138300,174700,174200,146300,GM-QS,Boeing,2012-05-14,05/15/2012,,,1,1,2,HGS-4000,1,4,ET,ETOPS,PERM,NO,SBAS,Anuvu,,,
N282WN,7S7,7S7,B737,737-700,137,2,7/14/2007,A2D76A,,86054,121700,155000,154500,129200,,Boeing,2/29/2028 0:00,07/10/2007,,,0,2,0,HGS-4000,0,0,C+,NOT ETOPS,PERM,NO,SBAS,Anuvu,,,
N872CB,7V8,7M8,B38M,737 MAX 8,175,2,11/17/2022,ABFDF8,Heroine of the Heart,99311,145400,181700,181200,152800,FM-CL,Boeing,2022-11-17,11/22/2022,,,1,1,2,HGS-6000,1,4,ET,ETOPS,PERM,YES,SBAS,Anuvu,,,
N487WN,7S7,7S7,B737,737-700,137,2,10/5/2004,A6049B,,85757,121700,155000,154500,129200,,Boeing,10/26/2028 0:00,09/30/2004,,,0,2,0,HGS-2350,0,0,C+,NOT ETOPS,PERM,NO,SBAS,Anuvu,,,
N238WN,7S7,7S7,B737,737-700,137,2,5/21/2006,A22839,,85236,121700,155000,154500,129200,,Boeing,8/31/2027,05/22/2006,02/20/2026,,0,2,0,CAT I,0,0,C1,NOT ETOPS,PERM,NO,SBAS,Anuvu,,,true
N8755L,7V8,7M8,B38M,737 MAX 8,175,2,4/27/2022,AC0BFB,,99327,145400,181700,181200,152800,FR-CL,Boeing,2022-04-27,05/04/2022,,,1,1,2,HGS-6000,1,4,ET,ETOPS,PERM,NO,SBAS,Anuvu,,YES,
N220WN,7S7,7S7,B737,737-700,137,2,7/29/2005,A1E302,,84702,121700,155000,154500,129200,,Boeing,2/29/2028 0:00,07/11/2005,,,0,2,0,HGS-4000,0,0,C+,NOT ETOPS,PERM,NO,SBAS,Anuvu,,,
N8509U,7A8,73H,B738,737-800,175,2,11/8/2016,ABAAFE,,91790,138300,174700,174200,146300,CS-EP,Boeing,12/31/2026 0:00,11/14/2016,,,1,1,0,HGS-4000,0,0,C+,NOT ETOPS,PERM,NO,SBAS,Anuvu,,,
N8527Q,7A8,73H,B738,737-800,175,2,3/23/2017,ABB222,,91588,138300,174700,174200,146300,GM-AL,Boeing,4/30/2027 0:00,03/23/2017,,,1,1,0,HGS-4000,0,0,C+,NOT ETOPS,PERM,NO,SBAS,Anuvu,,,
N8751R,7V8,7M8,B38M,737 MAX 8,175,2,9/21/2021,AC0B74,,99121,145400,181700,181200,152800,DH-ES,Boeing,10/31/2028,09/21/2021,,,1,1,2,HGS-6000,1,4,ET,ETOPS,PERM,NO,SBAS,Anuvu,,,
N8916Q,7U8,7M8,B38M,737 MAX 8,175,2,6/6/2024,AC4C44,,98883,145400,181700,181200,152800,AJ-PS,Boeing,2024-06-06,06/10/2024,,,1,1,0,HGS-6000,1,0,C1,NOT ETOPS,PERM,YES,SBAS,ViaSat,PLS,,true
N437WN,7S7,7S7,B737,737-700,137,2,7/9/2003,A53F20,,85333,121700,155000,154500,129200,,Boeing,2/29/2028 0:00,07/13/2003,,,0,2,0,HGS-2350,0,0,C+,NOT ETOPS,PERM,NO,SBAS,Anuvu,,,
N8662F,7P8,73H,B738,737-800,175,2,3/7/2015,ABE7C5,,93061,138300,174700,174200,146300,FS-AJ,Boeing,3/31/2028 0:00,03/11/2015,,,1,1,0,HGS-4000,0,0,C+,NOT ETOPS,PERM,YES,SBAS,Anuvu,,,
N8576Z,7A8,73H,B738,737-800,175,2,6/25/2018,ABC49B,,91852,138300,174700,174200,146300,LP-AJ,Boeing,6/30/2027,06/01/2018,,,1,1,0,HGS-4000,0,0,C+,NOT ETOPS,PERM,NO,SBAS,Anuvu,,,
N211WN,7S7,7S7,B737,737-700,137,2,4/29/2005,A1BF3A,,84669,121700,155000,154500,129200,,Boeing,6/30/2027 0:00,03/13/2005,,,0,2,0,HGS-4000,0,0,C+,NOT ETOPS,PERM,NO,SBAS,Anuvu,,,
N8626B,7P8,73H,B738,737-800,175,2,4/2/2014,ABD971,,92406,138300,174700,174200,146300,BP-CQ,Boeing,5/31/2027 0:00,04/08/2014,,,1,1,0,HGS-4000,0,0,C+,NOT ETOPS,PERM,NO,SBAS,Anuvu,,,
N957WN,7S7,7S7,B737,737-700,137,2,5/20/2011,AD50A9,,84789,121700,155000,154500,129200,,Boeing,6/30/2027,05/24/2011,,,0,1,0,HGS-4000,0,0,C1,NOT ETOPS,PERM,NO,SBAS,Anuvu,MEX,,
N929WN,7S7,7S7,B737,737-700,137,2,8/1/2008,ACE19A,,84733,121700,155000,154500,129200,,Boeing,2/29/2028,08/04/2008,,,0,1,0,HGS-4000,0,0,C1,NOT ETOPS,PERM,NO,SBAS,Anuvu,MEX,,
N958WN,7S7,7S7,B737,737-700,137,2,5/25/2011,AD5460,,84806,121700,155000,154500,129200,,Boeing,6/30/2027,05/26/2011,,,0,1,0,HGS-4000,0,0,C1,NOT ETOPS,PERM,NO,SBAS,Anuvu,MEX,,
N485WN,7S7,7S7,B737,737-700,137,2,9/21/2004,A5FD2D,,85464,121700,155000,154500,129200,,Boeing,8/31/2028 0:00,09/21/2004,,,0,2,0,HGS-2350,0,0,C+,NOT ETOPS,PERM,NO,SBAS,Anuvu,,,
N8938Q,7U8,7M8,B38M,737 MAX 8,175,2,1/30/2025,AC53F8,,98932,145400,181700,181200,152800,CJ-HP,Boeing,2025-01-30,01/31/2025,,,1,1,0,HGS-6000,1,0,C+,NOT ETOPS,PERM,YES,SBAS,ViaSat,PLS,,
N8883Q,7U8,7M8,B38M,737 MAX 8,175,2,6/30/2023,AC3E5D,,98785,145400,181700,181200,152800,GS-AC,Boeing,10/3/2023 0:00,07/06/2023,,,1,1,0,HGS-6000,1,0,C+,NOT ETOPS,PERM,YES,SBAS,ViaSat,,,
N484WN,73W,73W,B737,737-700,0,1,9/22/2004,,,86008,121700,155000,154500,129200,,Boeing,,09/23/2004,08/27/2024,08/29/2024,0,0,0,CAT I,,,C1,NOT ETOPS,PERM,NO,,,,,
N8322X,7R8,73H,B738,737-800,175,2,9/27/2012,AB627C,,92631,138300,174700,174200,146300,DJ-AQ,Boeing,10/31/2028,10/02/2012,,,1,1,2,HGS-4000,1,4,ET,ETOPS,PERM,NO,SBAS,Anuvu,,,
N8319F,7R8,73H,B738,737-800,175,2,8/27/2012,AB5FAA,,92375,138300,174700,174200,146300,DJ-GP,Boeing,2012-08-27,09/04/2012,,,1,1,2,HGS-4000,1,4,ET,ETOPS,PERM,NO,SBAS,Anuvu,,,
N8303R,7R8,73H,B738,737-800,175,2,4/14/2012,AB5B2B,,92444,138300,174700,174200,146300,GS-AJ,Boeing,2012-04-14,04/16/2012,,,1,1,2,HGS-4000,0,4,ET,ETOPS,PERM,NO,SBAS,Anuvu,,,
N8548P,7A8,73H,B738,737-800,175,2,10/7/2017,ABB9B2,,91440,138300,174700,174200,146300,LS-AM,Boeing,11/30/2027 0:00,10/11/2017,,,1,1,0,HGS-4000,0,0,C+,NOT ETOPS,PERM,NO,SBAS,Anuvu,,,
N8894Q,7U8,7M8,B38M,737 MAX 8,175,2,12/8/2023,AC4237,,98788,145400,181700,181200,152800,HP-ES,Boeing,2023-12-08,12/14/2023,,,1,1,0,HGS-6000,1,0,C+,NOT ETOPS,PERM,YES,SBAS,ViaSat,,,
N8538V,7A8,73H,B738,737-800,175,2,6/21/2017,ABB601,,90915,138300,174700,174200,146300,CJ-EP,Boeing,7/31/2027 0:00,06/21/2017,,,1,1,0,HGS-4000,0,0,C+,NOT ETOPS,PERM,NO,SBAS,Anuvu,,,
N8684F,7A8,73H,B738,737-800,175,2,4/24/2016,ABEF79,,92192,138300,174700,174200,146300,BM-CQ,Boeing,6/30/2026 0:00,04/28/2016,,,1,1,0,HGS-4000,0,0,C+,NOT ETOPS,PERM,NO,SBAS,Anuvu,,,
N8924Q,7U8,7M8,B38M,737 MAX 8,175,2,6/21/2024,AC4FB5,,98942,145400,181700,181200,152800,CH-BL,Boeing,6/25/2025,06/25/2024,,,1,1,0,HGS-6000,1,0,C+,NOT ETOPS,PERM,YES,SBAS,ViaSat,PLS,,
N8654B,7A8,73H,B738,737-800,175,2,12/5/2014,ABE450,,92764,138300,174700,174200,146300,AP-BG,Boeing,1/31/2028 0:00,12/09/2014,,,1,1,0,HGS-4000,0,0,C+,NOT ETOPS,PERM,NO,SBAS,Anuvu,,,
N8881L,7U8,7M8,B38M,737 MAX 8,175,2,7/3/2023,AC3E13,,98848,145400,181700,181200,152800,GR-HL,Boeing,2023-07-03,07/10/2023,,,1,1,0,HGS-6000,1,0,C+,NOT ETOPS,PERM,YES,SBAS,ViaSat,,,
N8876Q,7U8,7M8,B38M,737 MAX 8,175,2,7/28/2023,AC3B0F,,98781,145400,181700,181200,152800,GQ-DH,Boeing,7/31/2024 0:00,07/31/2023,,,1,1,0,HGS-6000,1,0,C+,NOT ETOPS,PERM,YES,SBAS,ViaSat,,,
N8782Q,7V8,7M8,B38M,737 MAX 8,175,2,10/3/2022,AC16BB,,99402,145400,181700,181200,152800,GL-EJ,Boeing,10/31/2029 0:00,10/06/2022,,,1,1,2,HGS-6000,1,4,ET,ETOPS,PERM,NO,SBAS,Anuvu,,,
N232WN,7S7,7S7,B737,737-700,137,2,3/2/2006,A211EF,,85624,121700,155000,154500,129200,,Boeing,3/31/2027 0:00,03/07/2006,,,0,2,0,HGS-4000,0,0,C+,NOT ETOPS,PERM,NO,SBAS,Anuvu,,,
N8699A,7A8,73H,B738,737-800,175,2,9/1/2016,ABF3DA,,91231,138300,174700,174200,146300,BF-GM,Boeing,10/31/2026 0:00,08/31/2016,,,1,1,0,HGS-4000,0,0,C+,NOT ETOPS,PERM,NO,SBAS,Anuvu,,,
N283WN,7S7,7S7,B737,737-700,137,2,7/16/2007,A2DB21,,85414,121700,155000,154500,129200,,Boeing,2/29/2028 0:00,07/19/2007,,,0,2,0,HGS-4000,0,0,C+,NOT ETOPS,PERM,NO,SBAS,Anuvu,,,
N8523W,7A8,73H,B738,737-800,175,2,2/9/2017,ABB19C,,91767,138300,174700,174200,146300,JM-HR,Boeing,2017-02-09,02/10/2017,,,1,1,0,HGS-4000,0,0,C+,NOT ETOPS,PERM,NO,SBAS,Anuvu,,,
N965WN,7S7,7S7,B737,737-700,137,2,9/13/2011,AD70BA,,84889,121700,155000,154500,129200,,Boeing,10/31/2027,09/14/2011,,,0,1,0,HGS-4000,0,0,C1,NOT ETOPS,PERM,NO,SBAS,Anuvu,MEX,,
N472WN,7S7,7S7,B737,737-700,137,2,7/14/2004,A5CA89,,85291,121700,155000,154500,129200,,Boeing,2/29/2028 0:00,07/12/2004,,,0,2,0,HGS-2350,0,0,C+,NOT ETOPS,PERM,NO,SBAS,Anuvu,,,
N8549Z,7A8,73H,B738,737-800,175,2,10/15/2017,ABB9DF,,91465,138300,174700,174200,146300,AQ-MR,Boeing,2017-10-15,10/17/2017,,,1,1,0,HGS-4000,0,0,C+,NOT ETOPS,PERM,NO,SBAS,Anuvu,,,
N8729H,7V8,7M8,B38M,737 MAX 8,175,2,12/30/2018,AC015F,,99491,145400,181700,181200,152800,KS-BL,Boeing,8/31/2027,12/30/2018,,,1,1,2,HGS-6000,1,4,ET,ETOPS,PERM,YES,SBAS,Anuvu,,YES,
N8900L,7U8,7M8,B38M,737 MAX 8,175,2,10/18/2023,AC47B7,,98836,145400,181700,181200,152800,JM-BQ,Boeing,2023-10-18,10/23/2023,,,1,1,0,HGS-6000,1,0,C+,NOT ETOPS,PERM,YES,SBAS,ViaSat,,,
N249WN,7S7,7S7,B737,737-700,137,2,7/28/2006,A2536F,,85287,121700,155000,154500,129200,,Boeing,2/28/2025 0:00,07/30/2006,,,0,2,0,HGS-4000,0,0,C+,NOT ETOPS,PERM,NO,SBAS,Anuvu,,,
N8838Q,7U8,7M8,B38M,737 MAX 8,175,2,1/17/2023,AC2C79,,98673,145400,181700,181200,152800,CM-EL,Boeing,2023-01-17,01/20/2023,,,1,1,0,HGS-6000,1,0,C+,NOT ETOPS,PERM,YES,SBAS,Anuvu,,,
N8805L,7U8,7M8,B38M,737 MAX 8,175,2,3/8/2021,AC20E7,,98417,145400,181700,181200,152800,AH-FM,Boeing,2021-03-08,03/10/2021,,,1,1,0,HGS-6000,0,0,C+,NOT ETOPS,PERM,NO,SBAS,Anuvu,,,
N8793Q,7V8,7M8,B38M,737 MAX 8,175,2,11/25/2022,AC1A95,,99340,145400,181700,181200,152800,FG-DE,Boeing,2022-11-25,12/02/2022,,,1,1,2,HGS-6000,1,4,ET,ETOPS,PERM,NO,SBAS,Anuvu,,YES,
N277WN,7S7,7S7,B737,737-700,137,2,5/21/2007,A2C27E,,85089,121700,155000,154500,129200,,Boeing,8/31/2027 0:00,05/24/2007,,,0,2,0,HGS-4000,0,0,C+,NOT ETOPS,PERM,NO,SBAS,Anuvu,,,
N902WN,7R7,7S7,B737,737-700,137,2,12/15/2007,AC789B,,86215,121700,155000,154500,129200,,Boeing,6/30/2026,12/17/2007,,,0,2,0,HGS-4000,1,3,OW,NOT ETOPS,PERM,NO,SBAS,Anuvu,,,
N8678E,7A8,73H,B738,737-800,175,2,1/28/2016,ABEC4D,,92172,138300,174700,174200,146300,AG-LP,Boeing,3/31/2029 0:00,01/28/2016,,,1,1,0,HGS-4000,0,0,C+,NOT ETOPS,PERM,NO,SBAS,Anuvu,,,
N446WN,7S7,7S7,B737,737-700,137,2,10/28/2003,A562E8,,85779,121700,155000,154500,129200,,Boeing,3/31/2026 0:00,11/02/2003,,,0,2,0,HGS-2350,0,0,C+,NOT ETOPS,PERM,NO,SBAS,Anuvu,,,
N942WN,7S7,7S7,B737,737-700,137,2,8/2/2009,AD1697,,85739,121700,155000,154500,129200,,Boeing,2/29/2028,07/31/2009,,,0,1,0,HGS-4000,0,0,C1,NOT ETOPS,PERM,NO,SBAS,Anuvu,MEX,,
N1808U,7V8,7M8,B38M,737 MAX 8,175,2,9/13/2022,A1442F,,99411,145400,181700,181200,152800,CG-EH,Boeing,2022-09-13,12/15/2022,,,1,1,2,HGS-6000,1,4,C1,ETOPS,PERM,NO,SBAS,Anuvu,,,true
N275WN,7S7,7S7,B737,737-700,137,2,5/2/2007,A2BB10,,84798,121700,155000,154500,129200,,Boeing,6/30/2027,05/03/2007,,,0,2,0,HGS-4000,0,0,C+,NOT ETOPS,PERM,NO,SBAS,Anuvu,,,
N8910Q,7U8,7M8,B38M,737 MAX 8,175,2,5/2/2024,AC4B72,,98974,145400,181700,181200,152800,JR-CK,Boeing,5/6/2025,05/06/2024,,,1,1,0,HGS-6000,1,0,C+,NOT ETOPS,PERM,YES,SBAS,ViaSat,PLS,,
N8640D,7A8,73H,B738,737-800,175,2,7/15/2014,ABE00F,,92454,138300,174700,174200,146300,JP-GH,Boeing,7/31/2027 0:00,07/15/2014,,,1,1,0,HGS-4000,0,0,C+,NOT ETOPS,PERM,NO,SBAS,Anuvu,,,
N8612K,7A8,73H,B738,737-800,175,2,3/26/2013,ABD536,,92485,138300,174700,174200,146300,HL-AB,Boeing,4/30/2029,03/20/2013,,,1,1,0,HGS-4000,0,0,C+,NOT ETOPS,PERM,NO,SBAS,Anuvu,,,
N405WN,73W,73W,B737,737-700,143,2,6/24/2001,A4C135,,85450,121700,155000,154500,129200,,Boeing,10/31/2027,02/05/2001,01/23/2025,,0,2,0,CAT I,0,0,C1,NOT ETOPS,PERM,NO,SBAS,Anuvu,MEX,,true
N8765Q,7V8,7M8,B38M,737 MAX 8,175,2,8/2/2022,AC0FB6,,99378,145400,181700,181200,152800,KL-AD,Boeing,2022-08-02,08/09/2022,,,1,1,2,HGS-6000,1,4,ET,ETOPS,PERM,NO,SBAS,Anuvu,,YES,
N222WN,7S7,7S7,B737,737-700,137,2,8/26/2005,A1EA70,,85203,121700,155000,154500,129200,,Boeing,5/31/2028 0:00,08/09/2005,,,0,2,0,HGS-4000,0,0,C+,NOT ETOPS,PERM,NO,SBAS,Anuvu,,,
N7889A,7S7,7S7,B737,737-700,137,2,10/24/2005,AAB1D2,,86235,121700,155000,154500,129200,MR-GH,Boeing,12/31/2027 0:00,02/20/2018,,,0,2,0,HGS-4000,0,0,C+,NOT ETOPS,PERM,NO,SBAS,Anuvu,,,
N8677A,7A8,73H,B738,737-800,175,2,1/19/2016,ABEC26,,92072,138300,174700,174200,146300,AF-LQ,Boeing,2/28/2026 0:00,01/20/2016,,,1,1,0,HGS-4000,0,0,C+,NOT ETOPS,PERM,NO,SBAS,Anuvu,,,
N956WN,7S7,7S7,B737,737-700,137,2,4/27/2011,AD4CF2,Jack Vidal,85238,121700,155000,154500,129200,,Boeing,5/31/2027,04/28/2011,,,0,1,0,HGS-4000,0,0,C1,NOT ETOPS,PERM,NO,SBAS,Anuvu,MEX,,
N8758L,7V8,7M8,B38M,737 MAX 8,175,2,5/26/2022,AC0C64,,99358,145400,181700,181200,152800,AK-LS,Boeing,2022-05-26,06/01/2022,,,1,1,2,HGS-6000,1,4,C1,ETOPS,PERM,NO,SBAS,Anuvu,,YES,true
N8644C,7P8,73H,B738,737-800,175,2,12/5/2014,ABE09A,,93691,138300,174700,174200,146300,HQ-FP,Boeing,12/31/2027 0:00,12/04/2014,,,1,1,0,HGS-4000,0,0,C+,NOT ETOPS,PERM,NO,SBAS,Anuvu,,,
N467WN,7S7,7S7,B737,737-700,137,2,6/14/2004,A5B59D,,85384,121700,155000,154500,129200,,Boeing,10/31/2027,06/06/2004,,,0,2,0,HGS-2350,0,0,C+,NOT ETOPS,PERM,NO,SBAS,Anuvu,,,
N462WN,7S7,7S7,B737,737-700,137,2,6/1/2004,A5A30A,,85880,121700,155000,154500,129200,,Boeing,10/31/2027 0:00,05/26/2004,,,0,2,0,HGS-2350,0,0,C+,NOT ETOPS,PERM,NO,SBAS,Anuvu,,,
N8513F,7A8,73H,B738,737-800,175,2,12/11/2016,ABADD6,,90797,138300,174700,174200,146300,EQ-KP,Boeing,1/31/2027 0:00,12/13/2016,,,1,1,0,HGS-4000,0,0,C+,NOT ETOPS,PERM,NO,SBAS,Anuvu,,,
N8944Q,7U8,7M8,B38M,737 MAX 8,175,2,3/24/2025,AC5723,,99010,145400,181700,181200,152800,CP-JK,Boeing,2025-03-24,03/26/2025,,,1,1,0,HGS-6000,1,0,C+,NOT ETOPS,PERM,YES,SBAS,ViaSat,PLS,,
N7848A,7S7,7S7,B737,737-700,137,1,11/23/2005,AAA2D3,,85975,121700,155000,154500,129200,PQ-BF,Boeing,9/30/2027 0:00,08/30/2016,,,0,2,0,HGS-4000,0,0,C+,NOT ETOPS,PERM,NO,SBAS,Anuvu,,,
N8572X,7A8,73H,B738,737-800,175,2,5/20/2018,ABC40D,,92131,138300,174700,174200,146300,LS-BJ,Boeing,6/30/2028 0:00,05/21/2018,,,1,1,0,CAT I,0,0,C+,NOT ETOPS,PERM,NO,SBAS,Anuvu,,,
N7828A,7S7,7S7,B737,737-700,137,2,4/11/2003,AA9B65,,86075,121700,155000,154500,129200,MP-AH,Boeing,3/31/2028 0:00,08/20/2015,,,0,2,0,HGS-4000,0,0,C+,NOT ETOPS,PERM,NO,SBAS,Anuvu,,,
N8921Q,7U8,7M8,B38M,737 MAX 8,175,2,3/20/2024,AC4F4C,,98925,145400,181700,181200,152800,CM-BD,Boeing,,03/22/2024,,,1,1,0,HGS-6000,1,0,C+,NOT ETOPS,PERM,YES,SBAS,ViaSat,PLS,,
N8962L,7U8,7M8,B38M,737 MAX 8,175,2,6/20/2025,AC5E47,,99058,145400,181700,181200,152800,BE-JS,Boeing,2025-06-20,06/24/2025,,,1,1,0,HGS-6000,1,0,C+,NOT ETOPS,PERM,YES,SBAS,ViaSat,MEX PLS,,
N7747C,7R7,7S7,B737,737-700,137,1,6/22/2007,AA7B33,,86018,121700,155000,154500,129200,DJ-AB,Boeing,7/31/2027 0:00,07/22/2014,,,0,2,0,HGS-4000,0,3,OW,NOT ETOPS,PERM,NO,SBAS,Anuvu,,,
N8671D,7P8,73H,B738,737-800,175,2,11/5/2015,ABEB57,,93166,138300,174700,174200,146300,MP-FS,Boeing,12/31/2025 0:00,11/05/2015,,,1,1,0,HGS-4000,0,0,C+,NOT ETOPS,PERM,NO,SBAS,Anuvu,,,
N1810U,7V8,7M8,B38M,737 MAX 8,175,2,9/26/2022,A146CE,,99410,145400,181700,181200,152800,HM-FK,Boeing,2022-09-26,11/30/2022,,,1,1,2,HGS-6000,1,4,ET,ETOPS,PERM,NO,SBAS,Anuvu,,YES,
N912WN,7S7,7S7,B737,737-700,137,2,3/1/2008,ACA01A,,85789,121700,155000,154500,129200,,Boeing,3/31/2027 0:00,03/02/2008,,,0,2,0,HGS-4000,1,0,C+,NOT ETOPS,PERM,NO,SBAS,Anuvu,,,
N915WN,7S7,7S7,B737,737-700,137,2,3/13/2008,ACAB3F,,85572,121700,155000,154500,129200,,Boeing,3/31/2027 0:00,03/17/2008,,,0,2,0,HGS-4000,1,0,C+,NOT ETOPS,PERM,NO,SBAS,Anuvu,,,
N231WN,7S7,7S7,B737,737-700,137,2,2/26/2006,A20E38,,85390,121700,155000,154500,129200,,Boeing,12/31/2026 0:00,02/26/2006,,,0,2,0,HGS-4000,0,0,C+,NOT ETOPS,PERM,NO,SBAS,Anuvu,,,
N8866H,7U8,7M8,B38M,737 MAX 8,175,2,5/22/2023,AC3751,,98859,145400,181700,181200,152800,DG-JR,Boeing,2023-05-22,05/24/2023,,,1,1,0,HGS-6000,1,0,C+,NOT ETOPS,PERM,YES,SBAS,ViaSat,,,
N8865L,7U8,7M8,B38M,737 MAX 8,175,2,5/2/2023,AC3731,,98718,145400,181700,181200,152800,DF-ER,Boeing,2023-05-02,05/04/2023,,,1,1,0,HGS-6000,1,0,C+,NOT ETOPS,PERM,YES,SBAS,ViaSat,,,
N8733M,7V8,7M8,B38M,737 MAX 8,175,2,2/12/2019,AC0448,,98932,145400,181700,181200,152800,CL-HS,Boeing,2019-02-12,02/12/2019,,,1,1,2,HGS-6000,1,4,ET,ETOPS,PERM,NO,SBAS,Anuvu,,YES,
N8610A,7A8,73H,B738,737-800,175,2,2/22/2013,ABD4E7,,92584,138300,174700,174200,146300,KM-AC,Boeing,3/31/2026 0:00,02/27/2013,,,1,1,0,HGS-4000,0,0,C+,NOT ETOPS,PERM,NO,SBAS,Anuvu,,,
N8316H,7R8,73H,B738,737-800,175,2,7/23/2012,AB5F43,,94642,138300,174700,174200,146300,BE-KQ,Boeing,8/31/2028,07/25/2012,,,1,1,2,HGS-4000,1,4,ET,ETOPS,PERM,NO,SBAS,Anuvu,,,
N7833A,7R7,7S7,B737,737-700,137,2,6/15/2003,AA9E6D,,86553,121700,155000,154500,129200,MR-FK,Boeing,8/31/2028 0:00,12/22/2015,,,0,2,0,HGS-4000,0,3,OW,NOT ETOPS,PERM,NO,SBAS,Anuvu,,,
N8986Q,7X8,7M8,B38M,737 MAX 8,175,2,12/21/2025,AC6645,,99552,145400,181700,181200,152800,CP-KM,Boeing,,12/22/2025,,,1,1,0,HGS-6000,1,0,C+,NOT ETOPS,Flywire,YES,SBAS,VIA,JAM MEX PLS,,
N421LV,73W,73W,B737,737-700,143,2,1/9/2002,A50064,,85525,121700,155000,154500,129200,,Boeing,2/29/2028,01/29/2002,10/10/2025,,0,2,0,HGS-2350,0,0,C1,NOT ETOPS,PERM,NO,SBAS,Anuvu,,,true
N8503A,7A8,73H,B738,737-800,175,2,10/6/2016,ABAA1A,,90827,138300,174700,174200,146300,BJ-HS,Boeing,11/30/2026 0:00,10/07/2016,,,1,1,0,HGS-4000,0,0,C+,NOT ETOPS,PERM,NO,SBAS,Anuvu,,,
N7844A,7S7,7S7,B737,737-700,137,1,1/10/2007,AAA247,,85715,121700,155000,154500,129200,MR-DG,Boeing,4/30/2028 0:00,10/12/2015,,,0,2,0,HGS-4000,0,0,C+,NOT ETOPS,PERM,NO,SBAS,Anuvu,,,
N491WN,7S7,7S7,B737,737-700,137,2,11/2/2004,A615D0,,85294,121700,155000,154500,129200,,Boeing,11/30/2025,02/17/2025,,,0,2,0,HGS-2350,0,0,C+,NOT ETOPS,PERM,NO,SBAS,Anuvu,MEX,,
N8558Z,7A8,73H,B738,737-800,175,2,12/17/2017,ABBD73,,91930,138300,174700,174200,146300,EH-AG,Boeing,1/31/2028 0:00,12/18/2017,,,1,1,0,HGS-4000,0,0,C+,NOT ETOPS,PERM,NO,SBAS,Anuvu,,,
N8936Q,7U8,7M8,B38M,737 MAX 8,175,2,1/21/2025,AC53B2,,98947,145400,181700,181200,152800,JS-EQ,Boeing,2025-01-21,01/23/2025,,,1,1,0,HGS-6000,1,0,C+,NOT ETOPS,PERM,YES,SBAS,ViaSat,PLS,,
N8736J,7V8,7M8,B38M,737 MAX 8,175,2,12/9/2020,AC04AE,,98243,145400,181700,181200,152800,EQ-MR,Boeing,2020-12-09,12/19/2020,,,1,1,2,HGS-6000,1,4,ET,ETOPS,PERM,NO,SBAS,Anuvu,,,
N262WN,7S7,7S7,B737,737-700,137,2,12/20/2006,A2886C,,85176,121700,155000,154500,129200,,Boeing,6/30/2026 0:00,12/21/2006,,,0,2,0,HGS-4000,0,0,C+,NOT ETOPS,PERM,NO,SBAS,Anuvu,,,
N7855A,7S7,7S7,B737,737-700,137,2,1/12/2005,AAA621,,85410,121700,155000,154500,129200,MR-QS,Boeing,1/31/2027 0:00,05/04/2017,,,0,2,0,HGS-4000,0,0,C+,NOT ETOPS,PERM,NO,SBAS,Anuvu,,,
N8680C,7A8,73H,B738,737-800,175,2,2/10/2016,ABEEEA,,92402,138300,174700,174200,146300,AP-GJ,Boeing,3/31/2026 0:00,02/15/2016,,,1,1,0,HGS-4000,0,0,C+,NOT ETOPS,PERM,NO,SBAS,Anuvu,,,
N8927Q,7U8,7M8,B38M,737 MAX 8,175,2,7/31/2024,AC501E,,98939,145400,181700,181200,152800,CM-BH,Boeing,2024-07-31,08/06/2024,,,1,1,0,HGS-6000,1,0,C+,NOT ETOPS,PERM,YES,SBAS,ViaSat,PLS,,
N8807L,7U8,7M8,B38M,737 MAX 8,175,2,3/31/2021,AC212D,,98357,145400,181700,181200,152800,BR-CK,Boeing,2021-03-31,03/31/2021,,,1,1,0,HGS-6000,0,0,C1,NOT ETOPS,PERM,NO,SBAS,Anuvu,,,true
N8532S,7A8,73H,B738,737-800,175,2,6/1/2017,ABB52C,,91313,138300,174700,174200,146300,DK-BF,Boeing,6/30/2027 0:00,06/06/2017,,,1,1,0,HGS-4000,0,0,C+,NOT ETOPS,PERM,NO,SBAS,Anuvu,,,
N8917Q,7U8,7M8,B38M,737 MAX 8,175,2,11/14/2023,AC4C67,,98986,145400,181700,181200,152800,JM-GL,Boeing,2023-11-14,11/16/2023,,,1,1,0,HGS-6000,1,0,C+,NOT ETOPS,PERM,YES,SBAS,ViaSat,,,
N268WN,7S7,7S7,B737,737-700,137,2,3/5/2007,A29EB6,,85891,121700,155000,154500,129200,,Boeing,3/31/2027 0:00,03/05/2007,,,0,2,0,HGS-4000,0,0,C+,NOT ETOPS,PERM,NO,SBAS,Anuvu,,,
N8606C,7P8,73H,B738,737-800,175,2,1/15/2013,ABD204,,93298,138300,174700,174200,146300,AG-CH,Boeing,1/31/2026,01/18/2013,,,1,1,0,HGS-4000,0,0,C+,NOT ETOPS,PERM,NO,SBAS,Anuvu,,,
N8306H,7R8,73H,B738,737-800,175,2,4/26/2012,AB5B8C,,92176,138300,174700,174200,146300,HS-EP,Boeing,5/31/2028,04/30/2012,,,1,1,2,HGS-4000,1,4,ET,ETOPS,PERM,NO,SBAS,Anuvu,,,
N411WN,73W,73W,B737,737-700,143,2,9/15/2001,A4D9D8,,85680,121700,155000,154500,129200,,Boeing,9/30/2026,08/02/2001,08/01/2025,,0,2,0,HGS-2350,0,0,C1,NOT ETOPS,PERM,NO,SBAS,Anuvu,,,true
N7839A,73W,73W,B737,737-700,143,1,8/10/2001,AA9F3F,,86208,121700,155000,154500,129200,CQ-AG,Boeing,12/31/2025,03/19/2016,08/08/2025,,0,2,0,HGS-4000,0,0,C1,NOT ETOPS,PERM,NO,SBAS,Anuvu,,,true
N8946L,7U8,7M8,B38M,737 MAX 8,175,2,3/25/2025,AC5765,,98993,145400,181700,181200,152800,CR-DE,Boeing,2025-03-25,03/28/2025,,,1,1,0,HGS-6000,1,0,C+,NOT ETOPS,PERM,YES,SBAS,ViaSat,PLS,,
N8846Q,7U8,7M8,B38M,737 MAX 8,175,2,2/21/2023,AC2FEA,,98747,145400,181700,181200,152800,CF-JM,Boeing,2023-02-21,02/24/2023,,,1,1,0,HGS-6000,1,0,C+,NOT ETOPS,PERM,YES,SBAS,Anuvu,,,
N8529Z,7A8,73H,B738,737-800,175,2,4/15/2017,ABB271,,92365,138300,174700,174200,146300,GJ-EM,Boeing,5/31/2027 0:00,04/17/2017,,,1,1,0,HGS-4000,0,0,C+,NOT ETOPS,PERM,NO,SBAS,Anuvu,,,
N447WN,7S7,7S7,B737,737-700,137,2,11/11/2003,A5669F,,85474,121700,155000,154500,129200,,Boeing,6/30/2026 0:00,11/17/2003,,,0,2,0,HGS-2350,0,0,C+,NOT ETOPS,PERM,NO,SBAS,Anuvu,,,
N8688J,7A8,73H,B738,737-800,175,2,5/17/2016,ABF008,,90637,138300,174700,174200,146300,DF-CP,Boeing,7/31/2026 0:00,05/18/2016,,,1,1,0,HGS-4000,0,0,C+,NOT ETOPS,PERM,NO,SBAS,Anuvu,,,
N431WN,7S7,7S7,B737,737-700,137,2,12/19/2002,A528D6,,85562,121700,155000,154500,129200,,Boeing,12/31/2026 0:00,12/16/2002,,,0,2,0,HGS-2350,0,0,C+,NOT ETOPS,PERM,NO,SBAS,Anuvu,,,
N8524Z,7A8,73H,B738,737-800,175,2,2/22/2017,ABB1C2,,92154,138300,174700,174200,146300,ES-CL,Boeing,3/31/2027 0:00,02/23/2017,,,1,1,0,HGS-4000,0,0,C+,NOT ETOPS,PERM,YES,SBAS,Anuvu,,,
N299WN,7S7,7S7,B737,737-700,137,2,11/19/2007,A318EA,,84961,121700,155000,154500,129200,,Boeing,3/31/2026 0:00,11/20/2007,,,0,2,0,HGS-4000,1,0,C+,NOT ETOPS,PERM,NO,SBAS,Anuvu,,,
N7831B,7S7,7S7,B737,737-700,137,2,6/20/2003,AA9E28,,85862,121700,155000,154500,129200,DS-BM,Boeing,5/31/2028 0:00,10/02/2015,,,0,2,0,HGS-4000,0,0,C+,NOT ETOPS,PERM,NO,SBAS,Anuvu,,,
N287WN,7S7,7S7,B737,737-700,137,2,8/8/2007,A2E9FD,,85661,121700,155000,154500,129200,,Boeing,2/29/2028 0:00,08/09/2007,,,0,2,0,HGS-4000,1,0,C+,NOT ETOPS,PERM,NO,SBAS,Anuvu,,,
N8707P,7V8,7M8,B38M,737 MAX 8,175,2,9/16/2017,ABF9B1,,99211,145400,181700,181200,152800,CE-BQ,Boeing,2017-09-16,09/25/2017,,,1,1,2,HGS-6000,1,4,ET,ETOPS,PERM,NO,SBAS,Anuvu,,,
N8566Z,7A8,73H,B738,737-800,175,2,3/8/2018,ABC0E4,,91681,138300,174700,174200,146300,QS-EF,Boeing,4/30/2028 0:00,03/06/2018,,,1,1,0,HGS-4000,0,0,C+,NOT ETOPS,PERM,NO,SBAS,Anuvu,,,
N266WN,7S7,7S7,B737,737-700,137,2,2/9/2007,A29748,,85580,121700,155000,154500,129200,,Boeing,12/31/2026 0:00,02/14/2007,,,0,2,0,HGS-4000,0,0,C+,NOT ETOPS,PERM,NO,SBAS,Anuvu,,,
N8574Z,7A8,73H,B738,737-800,175,2,5/31/2018,ABC455,,90910,138300,174700,174200,146300,LQ-FR,Boeing,6/30/2027 0:00,05/24/2018,,,1,1,0,HGS-4000,0,0,C+,NOT ETOPS,PERM,NO,SBAS,Anuvu,,,
N7862A,7S7,7S7,B737,737-700,137,2,6/17/2005,AAA96F,,85858,121700,155000,154500,129200,MQ-LS,Boeing,6/30/2027 0:00,11/11/2017,,,0,2,0,HGS-4000,0,0,C+,NOT ETOPS,PERM,NO,SBAS,Anuvu,,,
N8830Q,7U8,7M8,B38M,737 MAX 8,175,2,12/27/2022,AC2B61,,98771,145400,181700,181200,152800,DJ-AK,Boeing,1/30/2034 0:00,01/05/2023,,,1,1,0,HGS-6000,1,0,C+,NOT ETOPS,PERM,YES,SBAS,Anuvu,,,
N8726H,7V8,7M8,B38M,737 MAX 8,175,2,9/24/2018,AC00F6,,99094,145400,181700,181200,152800,BH-JR,Boeing,2018-09-24,09/24/2018,,,1,1,2,HGS-6000,1,4,ET,ETOPS,PERM,NO,SBAS,Anuvu,,,
N256WN,7S7,7S7,B737,737-700,137,2,9/27/2006,A26FC9,,85589,121700,155000,154500,129200,,Boeing,8/31/2028 0:00,09/27/2006,,,0,2,0,HGS,1,0,C+,NOT ETOPS,PERM,NO,SBAS,Anuvu,,,
N7876A,7S7,7S7,B737,737-700,137,1,11/20/2004,AAADB2,,85898,121700,155000,154500,129200,EP-MQ,Boeing,12/31/2025 0:00,08/01/2016,,,0,2,0,HGS-4000,0,0,C+,NOT ETOPS,PERM,NO,SBAS,Anuvu,,,
N7859B,73W,73W,B737,737-700,143,1,3/1/2002,AAA6AE,,86322,121700,155000,154500,129200,DS-CP,Boeing,5/31/2027,03/04/2002,09/10/2025,,0,2,0,HGS-4000,0,0,C1,NOT ETOPS,PERM,NO,SBAS,Anuvu,,,true
N8323C,7R8,73H,B738,737-800,175,2,10/31/2012,AB628C,,92270,138300,174700,174200,146300,DP-CS,Boeing,2012-10-31,11/01/2012,,,1,1,2,HGS-4000,1,4,ET,ETOPS,PERM,NO,SBAS,Anuvu,,,
N8744B,7V8,7M8,B38M,737 MAX 8,175,2,1/5/2021,AC0818,,98649,145400,181700,181200,152800,AK-FR,Boeing,1/31/2028 0:00,01/09/2021,,,1,1,2,HGS-6000,1,4,ET,ETOPS,PERM,YES,SBAS,Anuvu,,,
N565WN,73R,73W,B737,737-700,143,2,6/6/2002,A73B7E,,86424,121700,155000,154500,129200,EJ-LR,Boeing,6/1/2026,03/03/2015,02/09/2026,,0,2,0,HGS-4000,0,3,C1,NOT ETOPS,PERM,NO,SBAS,Anuvu,,,true
N8660A,7P8,73H,B738,737-800,175,2,2/9/2015,ABE77A,Lone Star One,93779,138300,174700,174200,146300,DH-KS,Boeing,3/31/2028 0:00,02/11/2015,,,1,1,0,HGS-4000,0,0,C+,NOT ETOPS,PERM,YES,SBAS,Anuvu,,,
N284WN,7S7,7S7,B737,737-700,137,2,7/23/2007,A2DED8,,84911,121700,155000,154500,129200,,Boeing,2/29/2028 0:00,07/25/2007,,,0,2,0,HGS-4000,1,0,C+,NOT ETOPS,PERM,NO,SBAS,Anuvu,,,
N8815L,7U8,7M8,B38M,737 MAX 8,175,2,4/5/2021,AC249E,,98432,145400,181700,181200,152800,LR-CM,Boeing,2021-04-05,04/06/2021,,,1,1,0,HGS,0,0,C+,NOT ETOPS,PERM,NO,SBAS,Anuvu,,,
N8840Q,7U8,7M8,B38M,737 MAX 8,175,2,1/25/2023,AC2F18,,98784,145400,181700,181200,152800,CM-BL,Boeing,2023-01-25,01/29/2023,,,1,1,0,HGS-6000,1,0,C+,NOT ETOPS,PERM,NO,SBAS,Anuvu,,,
N8965Q,7U8,7M8,B38M,737 MAX 8,175,2,8/26/2025,AC5EB4,,99120,145400,181700,181200,152800,JR-LQ,Boeing,,08/28/2025,,,2,1,0,HGS-6000,1,0,C+,NOT ETOPS,PERM,YES,SBAS,VIA,JAM MEX PLS,NO,
N225WN,7S7,7S7,B737,737-700,137,2,12/7/2005,A1F595,,85147,121700,155000,154500,129200,,Boeing,6/30/2026 0:00,09/14/2005,,,0,2,0,HGS-4000,0,0,C+,NOT ETOPS,PERM,NO,SBAS,Anuvu,,,
N8691A,7A8,73H,B738,737-800,175,2,7/5/2016,ABF2C2,,91267,138300,174700,174200,146300,EP-AG,Boeing,8/31/2026 0:00,07/06/2016,,,1,1,0,HGS-4000,0,0,C+,NOT ETOPS,PERM,NO,SBAS,Anuvu,,,
N8931L,7U8,7M8,B38M,737 MAX 8,175,2,9/9/2024,AC52FF,,98977,145400,181700,181200,152800,MQ-HK,Boeing,9/11/2025,09/11/2024,,,1,1,0,HGS-6000,1,0,C+,NOT ETOPS,PERM,YES,SBAS,ViaSat,PLS,,
N8842L,7U8,7M8,B38M,737 MAX 8,175,2,1/25/2023,AC2F5A,,98831,145400,181700,181200,152800,CJ-LM,Boeing,2023-01-25,01/27/2023,,,1,1,0,HGS-6000,1,0,C+,NOT ETOPS,PERM,NO,SBAS,Anuvu,,,
N245WN,7S7,7S7,B737,737-700,137,2,6/29/2006,A24493,,85330,121700,155000,154500,129200,,Boeing,2/29/2028 0:00,06/29/2006,,,0,2,0,HGS-4000,0,0,C+,NOT ETOPS,PERM,NO,SBAS,Anuvu,,,
N8571Z,7A8,73H,B738,737-800,175,2,5/15/2018,ABC3EC,,91580,138300,174700,174200,146300,LS-GR,Boeing,6/30/2028 0:00,05/15/2018,,,1,1,0,HGS-4000,0,0,C+,NOT ETOPS,PERM,NO,SBAS,Anuvu,,,
N8546V,7A8,73H,B738,737-800,175,2,8/30/2017,ABB972,,91265,138300,174700,174200,146300,QR-CH,Boeing,9/30/2027 0:00,08/30/2017,,,1,1,0,HGS-4000,0,0,C+,NOT ETOPS,PERM,NO,SBAS,Anuvu,,,
N401WN,73W,73W,B737,737-700,143,2,3/26/2001,A4B259,,85737,121700,155000,154500,129200,,Boeing,6/30/2027,02/05/2001,01/01/2025,,0,2,0,CAT I,0,0,C1,NOT ETOPS,PERM,NO,SA-ON,Anuvu,MEX,,true
N8540V,7A8,73H,B738,737-800,175,2,6/26/2017,ABB8A0,,91070,138300,174700,174200,146300,EP-QS,Boeing,2017-06-26,06/29/2017,,,1,1,0,HGS-4000,0,0,C+,NOT ETOPS,PERM,NO,SBAS,Anuvu,,,
N7740A,7S7,7S7,B737,737-700,137,1,1/31/2007,AA7A3C,,85998,121700,155000,154500,129200,DE-BJ,Boeing,10/13/2028 0:00,11/20/2012,,,0,2,0,HGS-4000,0,0,C+,NOT ETOPS,PERM,NO,SBAS,Anuvu,,,
N8307K,7R8,73H,B738,737-800,175,2,5/4/2012,AB5BB1,,92375,138300,174700,174200,146300,GM-PR,Boeing,2012-05-04,05/07/2012,,,1,1,2,HGS-4000,1,4,ET,ETOPS,PERM,NO,SBAS,Anuvu,,,
N8953Q,7U8,7M8,B38M,737 MAX 8,175,2,6/23/2025,AC5AB7,,99061,145400,181700,181200,152800,GR-EK,Boeing,2025-06-23,06/24/2025,,,1,1,0,HGS-6000,1,0,C+,NOT ETOPS,PERM,YES,SBAS,ViaSat,MEX PLS,,
N8767M,7V8,7M8,B38M,737 MAX 8,175,2,8/11/2022,AC0FF9,,99325,145400,181700,181200,152800,MQ-HR,Boeing,2022-08-11,08/16/2022,,,1,1,2,HGS-6000,1,4,ET,ETOPS,PERM,NO,SBAS,Anuvu,,YES,
N935WN,73W,73W,B737,737-700,143,2,5/3/2009,ACFA3D,,84877,121700,155000,154500,129200,,Boeing,8/31/2027,05/07/2009,05/14/2025,,0,1,0,HGS-4000,0,0,C1,NOT ETOPS,PERM,NO,SBAS,Anuvu,MEX,,
N425LV,7S7,7S7,B737,737-700,137,2,4/5/2002,A50F40,,85388,121700,155000,154500,129200,,Boeing,5/31/2028,04/29/2002,02/08/2026,,0,2,0,HGS-2350,0,0,C1,NOT ETOPS,PERM,NO,SBAS,Anuvu,,,true
N413WN,73W,73W,B737,737-700,143,2,10/3/2001,A4E146,,85574,121700,155000,154500,129200,,Boeing,12/31/2026,08/02/2001,08/15/2025,,0,2,0,HGS-2350,0,0,C1,NOT ETOPS,PERM,NO,SBAS,Anuvu,,,true
N8913S,7U8,7M8,B38M,737 MAX 8,175,2,10/23/2023,AC4BDD,,98957,145400,181700,181200,152800,KS-AF,Boeing,2023-10-23,10/25/2023,,,1,1,0,HGS-6000,1,0,C+,NOT ETOPS,PERM,YES,SBAS,ViaSat,,,
N8799Q,7M8,7M8,B38M,737 MAX 8,175,2,2/11/2025,,,90000,145000,174700,174200,151500,,Boeing,,,,,,,,,,,C1,NOT ETOPS,PERM,,,,MEX,,
N8919K,7U8,7M8,B38M,737 MAX 8,175,2,2/6/2024,AC4CA8,,98933,145400,181700,181200,152800,JM-KQ,Boeing,,02/09/2024,,,1,1,0,HGS-6000,1,0,C+,NOT ETOPS,PERM,YES,SBAS,ViaSat,PLS,,
N567WN,7S7,7S7,B737,737-700,137,2,11/4/2002,A742EC,,85908,121700,155000,154500,129200,FJ-AR,Boeing,10/31/2027 0:00,03/20/2015,,,0,2,0,HGS-4000,0,0,C+,NOT ETOPS,PERM,NO,SBAS,Anuvu,,,
N247WN,7S7,7S7,B737,737-700,137,2,7/9/2006,A24C01,,85033,121700,155000,154500,129200,,Boeing,2/28/2025 0:00,07/12/2006,,,0,2,0,HGS-4000,0,0,C+,NOT ETOPS,PERM,NO,SBAS,Anuvu,,,
N8845L,7U8,7M8,B38M,737 MAX 8,175,2,3/1/2023,AC2FC3,,98684,145400,181700,181200,152800,CH-FM,Boeing,2023-03-01,03/03/2023,,,1,1,0,HGS-6000,1,0,C+,NOT ETOPS,PERM,NO,SBAS,Anuvu,,,
N424WN,7S7,7S7,B737,737-700,137,2,4/4/2002,A50C7C,,85248,121700,155000,154500,129200,,Boeing,5/31/2028,04/29/2002,02/23/2026,,0,2,0,HGS-2350,0,0,C1,NOT ETOPS,PERM,NO,SBAS,Anuvu,,,true
N8869L,7U8,7M8,B38M,737 MAX 8,175,2,6/20/2023,AC37BD,,98828,145400,181700,181200,152800,GH-CJ,Boeing,2023-06-20,06/22/2023,,,1,1,0,HGS-6000,1,0,C+,NOT ETOPS,PERM,YES,SBAS,ViaSat,,,
N7858A,7S7,7S7,B737,737-700,137,2,4/20/2005,AAA68A,,85801,121700,155000,154500,129200,MR-HP,Boeing,4/30/2027,06/22/2017,,,0,2,0,HGS-4000,0,0,C+,NOT ETOPS,PERM,NO,SBAS,Anuvu,,,
N7721E,7S7,7S7,B737,737-700,137,1,2/13/2006,AA72F5,,85179,121700,155000,154500,129200,CH-DF,Boeing,2/28/2027 0:00,02/19/2014,,,0,2,0,HGS-4000,0,0,C+,NOT ETOPS,PERM,NO,SBAS,Anuvu,,,
N267WN,7S7,7S7,B737,737-700,137,2,2/25/2007,A29AFF,,85099,121700,155000,154500,129200,,Boeing,12/31/2026 0:00,02/26/2007,,,0,2,0,HGS-4000,0,0,C+,NOT ETOPS,PERM,NO,SBAS,Anuvu,,,
N8507C,7A8,73H,B738,737-800,175,2,10/27/2016,ABAAA8,,91861,138300,174700,174200,146300,CJ-ES,Boeing,11/30/2026 0:00,11/01/2016,,,1,1,0,HGS-4000,0,0,C+,NOT ETOPS,PERM,NO,SBAS,Anuvu,,,
N8914Q,7U8,7M8,B38M,737 MAX 8,175,2,12/19/2023,AC4BFE,,99008,145400,181700,181200,152800,LP-AD,Boeing,2023-12-19,12/21/2023,,,1,1,0,HGS-6000,1,0,C+,NOT ETOPS,PERM,YES,SBAS,ViaSat,,,
N8764Q,7V8,7M8,B38M,737 MAX 8,175,2,7/18/2022,AC0F93,,99225,145400,181700,181200,152800,JS-FP,Boeing,2022-07-18,07/22/2022,,,1,1,2,HGS-6000,1,4,ET,ETOPS,PERM,NO,SBAS,Anuvu,,YES,
N8580Z,7A8,73H,B738,737-800,175,2,7/25/2018,ABC780,,91325,138300,174700,174200,146300,PQ-RS,Boeing,6/30/2027 0:00,06/12/2018,,,1,1,0,HGS,0,0,C+,NOT ETOPS,PERM,NO,SBAS,Anuvu,,,
N7734H,7S7,7S7,B737,737-700,137,1,10/18/2006,AA7718,,85988,121700,155000,154500,129200,CR-DJ,Boeing,8/31/2028 0:00,08/23/2012,,,0,2,0,HGS-4000,0,0,C+,NOT ETOPS,PERM,NO,SBAS,Anuvu,,,
N8817L,7U8,7M8,B38M,737 MAX 8,175,2,2/12/2021,AC24E4,,98472,145400,181700,181200,152800,BF-AQ,Boeing,2021-02-12,02/22/2021,,,1,1,0,HGS-6000,0,0,C+,NOT ETOPS,PERM,NO,SBAS,Anuvu,,,
N261WN,7S7,7S7,B737,737-700,137,2,12/13/2006,A284B5,,85434,121700,155000,154500,129200,,Boeing,6/30/2026 0:00,12/14/2006,,,0,2,0,HGS-4000,0,0,C+,NOT ETOPS,PERM,NO,SBAS,Anuvu,,,
N8582Z,7A8,73H,B738,737-800,175,2,9/25/2018,ABC7C6,,91360,138300,174700,174200,146300,PR-FQ,Boeing,6/30/2027 0:00,09/24/2018,,,1,1,0,HGS-4000,0,0,C+,NOT ETOPS,PERM,NO,SBAS,Anuvu,,,
N933WN,73W,73W,B737,737-700,143,2,4/7/2009,,,85312,121700,155000,154500,129200,,Boeing,6/30/2028,04/10/2009,01/01/2025,,0,1,0,HGS-4000,0,0,C1,NOT ETOPS,PERM,NO,SBAS,Anuvu,MEX,,
N8705Q,7V8,7M8,B38M,737 MAX 8,175,2,8/27/2017,ABF96C,,99123,145400,181700,181200,152800,AS-DH,Boeing,9/30/2027,08/28/2017,,,1,1,2,HGS-6000,1,4,ET,ETOPS,PERM,NO,SBAS,Anuvu,,,
N455WN,7S7,7S7,B737,737-700,137,2,3/31/2004,A586B0,,85250,121700,155000,154500,129200,,Boeing,6/30/2027 0:00,03/28/2004,,,0,2,0,HGS-2350,0,0,C+,NOT ETOPS,PERM,NO,SBAS,Anuvu,,,
N8643A,7A8,73H,B738,737-800,175,2,12/4/2014,ABE075,,91614,138300,174700,174200,146300,HL-PS,Boeing,12/31/2027 0:00,12/04/2014,,,1,1,0,HGS-4000,0,0,C+,NOT ETOPS,PERM,NO,SBAS,Anuvu,,,
N8525S,7A8,73H,B738,737-800,175,2,2/28/2017,ABB1DE,,91897,138300,174700,174200,146300,JK-GH,Boeing,3/31/2027 0:00,03/01/2017,,,1,1,0,HGS-4000,0,0,C+,NOT ETOPS,PERM,NO,SBAS,Anuvu,,,
N8727M,7V8,7M8,B38M,737 MAX 8,175,2,9/28/2018,AC011D,,99096,145400,181700,181200,152800,BK-HR,Boeing,2018-09-28,09/26/2018,,,1,1,2,HGS-6000,1,4,ET,ETOPS,PERM,NO,SBAS,Anuvu,,,
N8977G,7X8,7M8,B38M,737 MAX 8,175,2,10/21/2025,AC62A9,,99563,145400,181700,181200,152800,EF-LS,Boeing,,10/24/2025,,,1,1,0,HGS-6000,1,0,C+,NOT ETOPS,PERM,YES,SBAS,VIA,JAM MEX PLS,,
N297WN,7S7,7S7,B737,737-700,137,2,10/26/2007,A3117C,,85254,121700,155000,154500,129200,,Boeing,11/30/2025 0:00,10/25/2007,,,0,2,0,HGS-4000,1,0,C+,NOT ETOPS,PERM,NO,SBAS,Anuvu,,,
N8808Q,7U8,7M8,B38M,737 MAX 8,175,2,3/18/2021,AC2154,,98476,145400,181700,181200,152800,MQ-EG,Boeing,5/31/2028 0:00,03/22/2021,,,1,1,0,HGS-6000,0,0,C+,NOT ETOPS,PERM,NO,SBAS,Anuvu,,,
N497WN,7S7,7S7,B737,737-700,137,2,1/4/2005,A62C1A,,85770,121700,155000,154500,129200,,Boeing,9/30/2026 0:00,12/14/2004,,,0,2,0,HGS-2350,0,0,C+,NOT ETOPS,PERM,NO,SBAS,Anuvu,,,
N206WN,7S7,7S7,B737,737-700,137,2,3/23/2005,A1AA4E,,85364,121700,155000,154500,129200,,Boeing,3/31/2027 0:00,02/14/2005,,,0,2,0,HGS-4000,0,0,C+,NOT ETOPS,PERM,NO,SBAS,Anuvu,,,
N8902Q,7U8,7M8,B38M,737 MAX 8,175,2,8/29/2023,AC4801,,98866,145400,181700,181200,152800,JM-EF,Boeing,2023-08-29,08/31/2023,,,1,1,0,HGS-6000,1,0,C+,NOT ETOPS,PERM,YES,SBAS,ViaSat,,,
N8653A,7P8,73H,B738,737-800,175,2,12/13/2014,ABE42C,California One,92503,138300,174700,174200,146300,AD-EP,Boeing,1/31/2028 0:00,12/17/2014,,,1,1,0,HGS-4000,0,0,C+,NOT ETOPS,PERM,NO,SBAS,Anuvu,,,
N8746Q,7V8,7M8,B38M,737 MAX 8,175,2,12/30/2020,AC086B,,98873,145400,181700,181200,152800,BE-CQ,Boeing,2020-12-30,01/08/2021,,,1,1,2,HGS-6000,1,4,ET,ETOPS,PERM,NO,SBAS,Anuvu,,,
N8676A,7A8,73H,B738,737-800,175,2,12/14/2015,ABEC03,,92030,138300,174700,174200,146300,MQ-DK,Boeing,1/31/2029,11/02/2015,,,1,1,0,HGS-4000,0,0,C+,NOT ETOPS,PERM,NO,SBAS,Anuvu,,,
N8646B,7A8,73H,B738,737-800,175,2,8/15/2014,ABE0DF,Nevada One,92471,138300,174700,174200,146300,HR-QS,Boeing,9/30/2027 0:00,08/20/2014,,,1,1,0,HGS-4000,0,0,C+,NOT ETOPS,PERM,YES,SBAS,Anuvu,,,
N8708Q,7V8,7M8,B38M,737 MAX 8,175,2,9/8/2017,ABF9D5,,99571,145400,181700,181200,152800,CG-JP,Boeing,2017-09-08,08/28/2017,,,1,1,2,HGS-6000,1,4,ET,ETOPS,PERM,YES,SBAS,Anuvu,,,
N428WN,7S7,7S7,B737,737-700,137,2,11/13/2002,A51B58,,85624,121700,155000,154500,129200,,Boeing,3/31/2026 0:00,11/12/2002,,,0,2,0,HGS-2350,0,0,C+,NOT ETOPS,PERM,NO,SBAS,Anuvu,,,
N8903H,7U8,7M8,B38M,737 MAX 8,175,2,11/1/2023,AC481D,,98815,145400,181700,181200,152800,JM-GP,Boeing,2023-11-01,11/07/2023,,,1,1,0,HGS-6000,1,0,C+,NOT ETOPS,PERM,YES,SBAS,ViaSat,,,
N7744A,7R7,7S7,B737,737-700,137,1,3/16/2007,AA7AC8,,86686,121700,155000,154500,129200,DF-CE,Boeing,9/30/2026 0:00,08/22/2013,,,0,2,0,HGS-4000,0,3,OW,NOT ETOPS,PERM,NO,SBAS,Anuvu,,,
N1807U,7V8,7M8,B38M,737 MAX 8,175,2,8/31/2022,A1440C,,99440,145400,181700,181200,152800,BM-FJ,Boeing,2022-08-31,11/21/2022,,,1,1,2,HGS-6000,1,4,ET,ETOPS,PERM,NO,SBAS,Anuvu,,YES,
N793SA,73W,73W,B737,737-700,143,2,1/10/2001,AAC4BB,,85352,121700,155000,154500,129200,,Boeing,6/30/2026,01/03/2001,01/01/2025,,0,2,0,CAT I,0,0,C1,NOT ETOPS,PERM,NO,SA-ON,Anuvu,MEX,,true
N926WN,7S7,7S7,B737,737-700,137,2,7/10/2008,ACD675,,85048,121700,155000,154500,129200,,Boeing,8/31/2027,07/14/2008,,,0,1,0,HGS-4000,0,0,C1,NOT ETOPS,PERM,NO,SBAS,Anuvu,MEX,,
N8887Q,7U8,7M8,B38M,737 MAX 8,175,2,8/7/2023,AC3EE9,,98713,145400,181700,181200,152800,HK-BP,Boeing,2023-08-07,08/10/2023,,,1,1,0,HGS-6000,1,0,C+,NOT ETOPS,PERM,YES,SBAS,ViaSat,,,
N8514F,7A8,73H,B738,737-800,175,2,12/14/2016,ABADF9,,92092,138300,174700,174200,146300,ER-MS,Boeing,1/31/2027 0:00,12/14/2016,,,1,1,0,HGS-4000,0,0,C+,NOT ETOPS,PERM,NO,SBAS,Anuvu,,,
N8661A,7P8,73H,B738,737-800,175,2,2/10/2015,ABE79D,,93391,138300,174700,174200,146300,FQ-PR,Boeing,3/31/2028,02/17/2015,,,1,1,0,HGS-4000,0,0,C+,NOT ETOPS,PERM,NO,SBAS,Anuvu,,,
N8835Q,7U8,7M8,B38M,737 MAX 8,175,2,12/22/2022,AC2C10,,98776,145400,181700,181200,152800,DF-BJ,Boeing,1/31/2034 0:00,01/03/2023,,,1,1,0,HGS-6000,1,0,C+,NOT ETOPS,PERM,NO,SBAS,Anuvu,,,
N8795L,7V8,7M8,B38M,737 MAX 8,175,2,12/19/2022,AC1AD7,,99488,145400,181700,181200,152800,EL-HM,Boeing,2022-12-19,12/26/2022,,,1,1,2,HGS-6000,1,4,ET,ETOPS,PERM,NO,SBAS,Anuvu,,YES,
N8650F,7P8,73H,B738,737-800,175,2,9/27/2014,ABE3C8,,93521,138300,174700,174200,146300,LP-BE,Boeing,10/31/2027 0:00,09/29/2014,,,1,1,0,HGS-4000,0,0,C+,NOT ETOPS,PERM,YES,SBAS,Anuvu,,,
N8547V,7A8,73H,B738,737-800,175,2,9/8/2017,ABB995,,91225,138300,174700,174200,146300,QR-MS,Boeing,9/30/2027 0:00,09/08/2017,,,1,1,0,HGS-4000,0,0,C+,NOT ETOPS,PERM,NO,SBAS,Anuvu,,,
N285WN,7S7,7S7,B737,737-700,137,2,8/3/2007,A2E28F,,85181,121700,155000,154500,129200,,Boeing,2/29/2028 0:00,08/08/2007,,,0,2,0,HGS-4000,1,0,C+,NOT ETOPS,PERM,NO,SBAS,Anuvu,,,
N8834L,7U8,7M8,B38M,737 MAX 8,175,2,12/28/2022,AC2BE9,,98761,145400,181700,181200,152800,DF-HM,Boeing,1/31/2034 0:00,01/04/2023,,,1,1,0,HGS-6000,1,0,C+,NOT ETOPS,PERM,YES,SBAS,Anuvu,,,
N8321D,7R8,73H,B738,737-800,175,2,9/25/2012,AB6247,,92300,138300,174700,174200,146300,CH-GQ,Boeing,2012-09-25,09/27/2012,,,1,1,2,HGS-4000,1,4,ET,ETOPS,PERM,NO,SBAS,Anuvu,,,
N960WN,7S7,7S7,B737,737-700,137,2,7/22/2011,AD5E27,,85451,121700,155000,154500,129200,,Boeing,8/31/2027,07/25/2011,,,0,1,0,HGS-4000,0,0,C1,NOT ETOPS,PERM,NO,SBAS,Anuvu,MEX,,
N7879A,7S7,7S7,B737,737-700,137,2,10/28/2005,AAAE1B,,86508,121700,155000,154500,129200,MS-HQ,Boeing,12/31/2026 0:00,06/19/2016,,,0,2,0,HGS-4000,0,0,C+,NOT ETOPS,PERM,NO,SBAS,Anuvu,,,
N7854B,7S7,7S7,B737,737-700,137,2,12/10/2006,AAA5FF,,85692,121700,155000,154500,129200,MS-AD,Boeing,12/31/2026 0:00,03/02/2017,,,0,2,0,HGS-4000,0,0,C+,NOT ETOPS,PERM,NO,SBAS,Anuvu,,,
N8934Q,7U8,7M8,B38M,737 MAX 8,175,2,12/2/2024,AC536C,,98818,145400,181700,181200,152800,GK-CH,Boeing,2024-12-02,12/05/2024,,,1,1,0,HGS-6000,1,0,C+,NOT ETOPS,PERM,YES,SBAS,ViaSat,PLS,,
N1809U,7V8,7M8,B38M,737 MAX 8,175,2,5/13/2022,A14452,,99403,145400,181700,181200,152800,CG-HK,Boeing,2022-05-13,07/31/2022,,,1,1,2,HGS-6000,1,4,ET,ETOPS,PERM,NO,SBAS,Anuvu,,YES,
N8823Q,7U8,7M8,B38M,737 MAX 8,175,2,12/1/2022,AC2813,,98911,145400,181700,181200,152800,DL-FK,Boeing,2022-12-01,12/05/2022,,,1,1,0,HGS-6000,1,0,C+,NOT ETOPS,PERM,YES,SBAS,Anuvu,,,
N8827Q,7U8,7M8,B38M,737 MAX 8,175,2,12/5/2022,AC289F,,98812,145400,181700,181200,152800,DK-CF,Boeing,3/8/2027,12/08/2022,,,1,1,0,HGS-6000,1,0,C+,NOT ETOPS,PERM,NO,SBAS,Anuvu,,,
N8991S,7X8,7M8,B38M,737 MAX 8,175,2,1/21/2026,AC694F,,99505,145400,181700,181200,152800,ER-LQ,Boeing,,01/22/2026,,,1,1,0,HGS-6000,1,0,C+,NOT ETOPS,PERM,YES,SBAS,ViaSat,JAM MEX PLS,,
N7813P,73R,73W,B737,737-700,143,2,8/6/2001,,,86071,121700,155000,154500,129200,CS-AK,Boeing,,08/08/2001,10/09/2024,10/11/2024,0,0,0,CAT I,,3,C1,NOT ETOPS,PERM,NO,SA-ON,,,,
N8820L,7U8,7M8,B38M,737 MAX 8,175,2,11/17/2022,AC27A6,,98729,145400,181700,181200,152800,DM-BE,Boeing,2022-11-17,11/23/2022,,,1,1,0,HGS-6000,1,0,C+,NOT ETOPS,PERM,NO,SBAS,Anuvu,,,
N205WN,7S7,7S7,B737,737-700,137,2,3/14/2005,A1A697,,85394,121700,155000,154500,129200,,Boeing,12/31/2026,02/14/2005,,,0,2,0,HGS-4000,0,0,C+,NOT ETOPS,PERM,NO,SA-ON,Anuvu,MEX,,
N210WN,7S7,7S7,B737,737-700,137,2,4/13/2005,A1BB83,,85414,121700,155000,154500,129200,,Boeing,3/31/2027 0:00,03/13/2005,,,0,2,0,HGS-4000,0,0,C+,NOT ETOPS,PERM,NO,SBAS,Anuvu,,,
N948WN,7S7,7S7,B737,737-700,137,2,6/4/2010,AD2CE1,,85668,121700,155000,154500,129200,,Boeing,8/31/2027,06/07/2010,,,0,1,0,HGS-4000,0,0,C1,NOT ETOPS,PERM,NO,SBAS,Anuvu,MEX,,
N8639B,7P8,73H,B738,737-800,175,2,7/28/2014,ABDD91,,92438,138300,174700,174200,146300,GS-EJ,Boeing,8/31/2027 0:00,07/23/2014,,,1,1,0,HGS-4000,0,0,C+,NOT ETOPS,PERM,NO,SBAS,Anuvu,,,
N415WN,73W,73W,B737,737-700,143,2,10/19/2001,A4E8B4,,85723,121700,155000,154500,129200,,Boeing,3/31/2027,08/02/2001,08/02/2025,,0,2,0,HGS-2350,0,0,C1,NOT ETOPS,PERM,NO,SBAS,Anuvu,,,true
N8895Q,7U8,7M8,B38M,737 MAX 8,175,2,6/17/2024,AC425A,,98800,145400,181700,181200,152800,HQ-BL,Boeing,2024-06-17,06/20/2024,,,1,1,0,HGS-6000,1,0,C+,NOT ETOPS,PERM,YES,SBAS,ViaSat,PLS,,
N8633A,7A8,73H,B738,737-800,175,2,6/2/2014,ABDCBE,,92554,138300,174700,174200,146300,EQ-KS,Boeing,6/30/2027 0:00,06/06/2014,,,1,1,0,HGS-4000,0,0,C+,NOT ETOPS,PERM,NO,SBAS,Anuvu,,,
N8679A,7P8,73H,B738,737-800,175,2,2/10/2016,ABEC6C,,93138,138300,174700,174200,146300,AJ-GS,Boeing,3/31/2026 0:00,02/12/2016,,,1,1,0,HGS-4000,0,0,C+,NOT ETOPS,PERM,YES,SBAS,Anuvu,,,
N8843S,7U8,7M8,B38M,737 MAX 8,175,2,2/21/2023,AC2F83,,98891,145400,181700,181200,152800,CJ-AH,Boeing,2023-02-21,02/23/2023,,,1,1,0,HGS-6000,1,0,C+,NOT ETOPS,PERM,YES,SBAS,Anuvu,,,
N8984L,7X8,7M8,B38M,737 MAX 8,175,2,11/24/2025,AC65FB,,99548,145400,181700,181200,152800,EP-GJ,Boeing,,11/25/2025,,,1,1,0,HGS-6000,1,0,C+,NOT ETOPS,PERM,YES,SBAS,VIA,JAM MEX PLS,,
N8848Q,7U8,7M8,B38M,737 MAX 8,175,2,3/17/2023,AC3030,,98824,145400,181700,181200,152800,CE-HM,Boeing,2023-03-17,03/22/2023,,,1,1,0,HGS-6000,1,0,C+,NOT ETOPS,PERM,YES,SBAS,Anuvu,,,
N259WN,7S7,7S7,B737,737-700,137,2,10/30/2006,A27AEE,,85689,121700,155000,154500,129200,,Boeing,3/31/2026 0:00,11/01/2006,,,0,2,0,HGS-4000,0,0,C+,NOT ETOPS,PERM,NO,SBAS,Anuvu,,,
N499WN,7S7,7S7,B737,737-700,137,2,1/23/2005,A63388,,85382,121700,155000,154500,129200,,Boeing,9/30/2026 0:00,12/14/2004,,,0,2,0,HGS-2350,0,0,C+,NOT ETOPS,PERM,NO,SBAS,Anuvu,,,
N8952Q,7U8,7M8,B38M,737 MAX 8,175,2,6/23/2025,AC5A94,,98996,145400,181700,181200,152800,GH-KP,Boeing,2025-06-23,06/26/2025,,,1,1,0,HGS-6000,1,0,C+,NOT ETOPS,PERM,YES,SBAS,ViaSat,MEX PLS,,
N8800L,7U8,7M8,B38M,737 MAX 8,175,2,2/8/2021,AC2038,,98472,145400,181700,181200,152800,DQ-GL,Boeing,2021-02-08,02/16/2021,,,1,1,0,HGS-6000,0,0,C+,NOT ETOPS,PERM,NO,SBAS,Anuvu,,,
N8658A,7A8,73H,B738,737-800,175,2,1/8/2015,ABE4DB,,92509,138300,174700,174200,146300,CP-ER,Boeing,2/29/2028 0:00,01/15/2015,,,1,1,0,HGS-4000,0,0,C+,NOT ETOPS,PERM,NO,SBAS,Anuvu,,,
N8557Q,7A8,73H,B738,737-800,175,2,12/15/2017,ABBD47,,91425,138300,174700,174200,146300,EH-JM,Boeing,1/31/2028 0:00,12/15/2017,,,1,1,0,HGS-4000,0,0,C+,NOT ETOPS,PERM,NO,SBAS,Anuvu,,,
N8517F,7A8,73H,B738,737-800,175,2,12/18/2016,ABAE62,,92290,138300,174700,174200,146300,FL-KR,Boeing,1/31/2027 0:00,12/19/2016,,,1,1,0,HGS-4000,0,0,C+,NOT ETOPS,PERM,NO,SBAS,Anuvu,,,
N7815L,7R7,7S7,B737,737-700,137,2,5/15/2003,AA974F,,86788,121700,155000,154500,129200,PQ-DR,Boeing,2/28/2029 0:00,08/07/2014,,,0,2,0,HGS-4000,0,3,OW,NOT ETOPS,PERM,NO,SBAS,Anuvu,,,
N8873S,7U8,7M8,B38M,737 MAX 8,175,2,5/22/2023,AC3AA8,,98775,145400,181700,181200,152800,GQ-BE,Boeing,2023-05-22,05/25/2023,,,1,1,0,HGS-6000,1,0,C+,NOT ETOPS,PERM,YES,SBAS,ViaSat,,,
N8836Q,7U8,7M8,B38M,737 MAX 8,175,2,1/17/2023,AC2C33,,98863,145400,181700,181200,152800,DE-BM,Boeing,2023-01-17,01/19/2023,,,1,1,0,HGS-6000,1,0,C+,NOT ETOPS,PERM,YES,SBAS,Anuvu,,,
N8939Q,7U8,7M8,B38M,737 MAX 8,175,2,1/27/2025,AC541B,,99096,145400,181700,181200,152800,CK-FS,Boeing,2025-01-27,01/29/2025,,,1,1,0,HGS-6000,1,0,C+,NOT ETOPS,PERM,YES,SBAS,ViaSat,PLS,,
N8778Q,7V8,7M8,B38M,737 MAX 8,175,2,8/26/2022,AC13D6,,99363,145400,181700,181200,152800,HJ-CE,Boeing,2022-08-26,08/30/2022,,,1,1,2,HGS-6000,1,4,ET,ETOPS,PERM,NO,SBAS,Anuvu,,YES,
N8967Q,7U8,7M8,B38M,737 MAX 8,175,2,9/2/2025,AC5EFA,,99098,145400,181700,181200,152800,DR-FS,Boeing,,09/05/2025,,,1,1,0,HGS-6000,1,0,C+,NOT ETOPS,PERM,YES,SBAS,VIA,JAM MEX PLS,,
N8663A,7P8,73H,B738,737-800,175,2,3/22/2015,ABE7E3,,93361,138300,174700,174200,146300,GP-FS,Boeing,4/30/2028,03/25/2015,,,1,1,0,HGS-4000,0,0,C+,NOT ETOPS,PERM,NO,SBAS,Anuvu,,,
N7866A,73W,73W,B737,737-700,143,1,7/11/2002,AAA9FB,,86116,121700,155000,154500,129200,JP-MQ,Boeing,9/30/2027,01/17/2018,01/05/2026,,0,2,0,HGS-4000,0,0,C1,NOT ETOPS,PERM,NO,SBAS,Anuvu,,,true
N8762Q,7V8,7M8,B38M,737 MAX 8,175,2,6/10/2022,AC0F4D,,99370,145400,181700,181200,152800,CH-BP,Boeing,2022-06-10,06/16/2022,,,1,1,2,HGS-6000,1,4,ET,ETOPS,PERM,NO,SBAS,Anuvu,,YES,
N8855Q,7U8,7M8,B38M,737 MAX 8,175,2,3/23/2023,AC337E,,98831,145400,181700,181200,152800,MR-DJ,Boeing,6/25/2023 0:00,03/27/2023,,,1,1,0,HGS-6000,1,0,C+,NOT ETOPS,PERM,YES,SBAS,ViaSat,,,
N8530W,7A8,73H,B738,737-800,175,2,4/29/2017,ABB4EA,,91788,138300,174700,174200,146300,FM-BE,Boeing,5/31/2027 0:00,05/01/2017,,,1,1,0,HGS-4000,0,0,C+,NOT ETOPS,PERM,NO,SBAS,Anuvu,,,
N8773Q,7V8,7M8,B38M,737 MAX 8,175,2,8/29/2022,AC1327,,99404,145400,181700,181200,152800,JM-GK,Boeing,2022-08-29,08/31/2022,,,1,1,2,HGS-6000,1,4,ET,ETOPS,PERM,NO,SBAS,Anuvu,,YES,
N445WN,7S7,7S7,B737,737-700,137,2,12/3/2003,A55F31,,85687,121700,155000,154500,129200,,Boeing,6/30/2026,10/19/2003,,,0,2,0,HGS-2350,0,0,C+,NOT ETOPS,PERM,NO,SBAS,Anuvu,,,
N7861J,7S7,7S7,B737,737-700,137,2,6/2/2005,AAA954,,85058,121700,155000,154500,129200,DQ-BR,Boeing,6/30/2027 0:00,08/01/2017,,,0,2,0,HGS-4000,0,0,C+,NOT ETOPS,PERM,NO,SBAS,Anuvu,,,
N8318F,7R8,73H,B738,737-800,175,2,8/17/2012,AB5F87,,93454,138300,174700,174200,146300,CS-ER,Boeing,8/31/2028,08/17/2012,,,1,1,2,HGS-4000,1,4,ET,ETOPS,PERM,NO,SBAS,Anuvu,,,
N871HK,7V8,7M8,B38M,737 MAX 8,175,2,11/3/2022,ABFAC6,The Herbert D. Kelleher,98971,145400,181700,181200,152800,HK-DM,Boeing,2022-11-03,11/15/2022,,,1,1,2,HGS-6000,1,4,ET,ETOPS,PERM,NO,SBAS,Anuvu,,,
N8570W,7A8,73H,B738,737-800,175,2,5/10/2018,ABC3C6,,92285,138300,174700,174200,146300,LS-HJ,Boeing,6/30/2028 0:00,05/08/2018,,,1,1,0,HGS-4000,0,0,C+,NOT ETOPS,PERM,NO,SBAS,Anuvu,,,
N8631A,7P8,73H,B738,737-800,175,2,5/21/2014,ABDC78,,92778,138300,174700,174200,146300,DR-MP,Boeing,6/30/2027 0:00,05/27/2014,,,1,1,0,HGS-4000,0,0,C+,NOT ETOPS,PERM,NO,SBAS,Anuvu,,,
N947WN,7S7,7S7,B737,737-700,137,2,5/29/2010,AD292A,,85241,121700,155000,154500,129200,,Boeing,8/31/2027,06/01/2010,,,0,1,0,HGS-4000,0,0,C1,NOT ETOPS,PERM,NO,SBAS,Anuvu,MEX,,
N8954Q,7U8,7M8,B38M,737 MAX 8,175,2,5/29/2025,AC5ADA,,99066,145400,181700,181200,152800,GS-DQ,Boeing,2025-05-29,05/30/2025,,,1,1,0,HGS-6000,1,0,C+,NOT ETOPS,Flywire,YES,SBAS,ViaSat,MEX PLS,,
N7881A,7S7,7S7,B737,737-700,137,2,4/3/2008,AAB0BA,,86148,121700,155000,154500,129200,PQ-BR,Boeing,4/30/2029 0:00,08/30/2016,,,0,2,0,HGS-4000,0,0,C+,NOT ETOPS,PERM,NO,SBAS,Anuvu,,,
N8575Z,7A8,73H,B738,737-800,175,2,5/30/2018,ABC478,,91265,138300,174700,174200,146300,LP-DF,Boeing,7/31/2028 0:00,05/24/2018,,,1,1,0,HGS-4000,0,0,C+,NOT ETOPS,PERM,NO,SBAS,Anuvu,,,
N8579Z,7A8,73H,B738,737-800,175,2,6/29/2018,ABC504,,91847,138300,174700,174200,146300,KQ-BS,Boeing,6/30/2027 0:00,03/06/2018,,,1,1,0,HGS-4000,0,0,C+,NOT ETOPS,PERM,NO,SBAS,Anuvu,,,
N8809L,7U8,7M8,B38M,737 MAX 8,175,2,3/19/2021,AC2173,,98639,145400,181700,181200,152800,KR-EQ,Boeing,2021-03-19,03/23/2021,,,1,1,0,HGS-6000,0,0,C1,NOT ETOPS,PERM,NO,SBAS,Anuvu,,,true
N8696E,7A8,73H,B738,737-800,175,2,8/18/2016,ABF375,,91435,138300,174700,174200,146300,AH-FR,Boeing,9/30/2026 0:00,08/19/2016,,,1,1,0,HGS-4000,0,0,C+,NOT ETOPS,PERM,NO,SBAS,Anuvu,,,
N8632A,7P8,73H,B738,737-800,175,2,6/1/2014,ABDC9B,,93538,138300,174700,174200,146300,EG-HQ,Boeing,6/30/2027 0:00,06/05/2014,,,1,1,0,HGS-4000,0,0,C+,NOT ETOPS,PERM,NO,SBAS,Anuvu,,,
N8739L,7V8,7M8,B38M,737 MAX 8,175,2,12/21/2020,AC0519,,98029,145400,181700,181200,152800,AB-EQ,Boeing,2/29/2028,12/22/2020,,,1,1,2,HGS-6000,1,4,ET,ETOPS,PERM,NO,SBAS,Anuvu,,,
N7750A,7R7,7S7,B737,737-700,137,1,2/4/2008,AA7DF3,,86141,121700,155000,154500,129200,QR-CF,Boeing,9/30/2027,09/05/2014,,,0,2,0,HGS-4000,0,3,OW,NOT ETOPS,PERM,NO,SBAS,Anuvu,,,
N8327A,7R8,73H,B738,737-800,175,2,12/10/2012,AB6316,,94540,138300,174700,174200,146300,ES-CP,Boeing,2012-12-10,12/12/2012,,,1,1,2,HGS-4000,1,4,ET,ETOPS,PERM,NO,SBAS,Anuvu,,,
N8616C,73H,73H,B738,737-800,175,2,9/24/2013,ABD5BB,,92057,138300,174700,174200,146300,AF-ES,Boeing,11/30/2026,09/20/2013,09/29/2025,,1,1,0,HGS,0,0,C1,NOT ETOPS,PERM,NO,SBAS,Anuvu,,,true
N229WN,7S7,7S7,B737,737-700,137,2,1/28/2006,A20471,,85380,121700,155000,154500,129200,,Boeing,9/30/2026 0:00,10/27/2005,,,0,2,0,HGS-4000,0,0,C+,NOT ETOPS,PERM,NO,SBAS,Anuvu,,,
N7835A,7S7,7S7,B737,737-700,137,1,8/5/2005,AA9EB3,,85936,121700,155000,154500,129200,BH-GP,Boeing,10/20/2028 0:00,01/10/2016,,,0,2,0,HGS-4000,0,0,C+,NOT ETOPS,PERM,NO,SBAS,Anuvu,,,
N8839Q,7U8,7M8,B38M,737 MAX 8,175,2,1/23/2023,AC2C9C,,98735,145400,181700,181200,152800,CM-DH,Boeing,2023-01-23,01/27/2023,,,1,1,0,HGS,1,0,C+,NOT ETOPS,PERM,NO,SBAS,Anuvu,,,
N904WN,7S7,7S7,B737,737-700,137,2,1/11/2008,AC8009,,84934,121700,155000,154500,129200,,Boeing,10/31/2027,01/13/2008,,,0,2,0,HGS-4000,0,0,C+,NOT ETOPS,PERM,NO,SBAS,Anuvu,,,
N8628A,7A8,73H,B738,737-800,175,2,4/24/2014,ABD9B6,,92453,138300,174700,174200,146300,CH-KQ,Boeing,5/31/2027 0:00,04/28/2014,,,1,1,0,HGS-4000,0,0,C+,NOT ETOPS,PERM,NO,SBAS,Anuvu,,,
N8672F,7P8,73H,B738,737-800,175,2,11/13/2015,ABEB7C,,93220,138300,174700,174200,146300,MP-KS,Boeing,12/31/2025,11/13/2015,,,1,1,0,HGS-4000,0,0,C+,NOT ETOPS,PERM,NO,SBAS,Anuvu,,,
N8781Q,7V8,7M8,B38M,737 MAX 8,175,2,9/19/2022,AC1698,,99453,145400,181700,181200,152800,GL-FK,Boeing,2022-09-19,09/22/2022,,,1,1,2,HGS-6000,1,4,ET,ETOPS,PERM,YES,SBAS,Anuvu,,,
N7827A,7R7,7S7,B737,737-700,137,2,2/24/2003,AA9B42,,86241,121700,155000,154500,129200,MR-AC,Boeing,3/31/2028,08/24/2015,,,0,2,0,HGS-4000,0,3,OW,NOT ETOPS,PERM,NO,SBAS,Anuvu,,,
N8925Q,7U8,7M8,B38M,737 MAX 8,175,2,12/12/2024,AC4FD8,,98870,145400,181700,181200,152800,CL-EJ,Boeing,2024-12-12,12/18/2024,,,1,1,0,HGS-6000,1,0,C+,NOT ETOPS,PERM,YES,SBAS,ViaSat,PLS,,
N482WN,7S7,7S7,B737,737-700,137,2,9/8/2004,A5F208,,85795,121700,155000,154500,129200,,Boeing,8/31/2028 0:00,08/25/2004,,,0,2,0,HGS-2350,0,0,C+,NOT ETOPS,PERM,NO,SBAS,Anuvu,,,
N8526W,7A8,73H,B738,737-800,175,2,3/21/2017,ABB205,,91428,138300,174700,174200,146300,HK-DF,Boeing,4/30/2027,03/22/2017,,,1,1,0,HGS-4000,0,0,C+,NOT ETOPS,PERM,NO,SBAS,Anuvu,,,
N8780Q,7V8,7M8,B38M,737 MAX 8,175,2,12/1/2022,AC1675,,99425,145400,181700,181200,152800,GM-DJ,Boeing,2022-12-01,12/05/2022,,,1,1,2,HGS-6000,1,4,ET,ETOPS,PERM,YES,SBAS,Anuvu,,,
N7847A,7S7,7S7,B737,737-700,137,1,11/15/2005,AAA2B0,,86219,121700,155000,154500,129200,PQ-HR,Boeing,4/30/2027,09/07/2016,,,0,2,0,HGS-4000,0,0,C+,NOT ETOPS,Flywire,NO,SBAS,Anuvu,,,
N223WN,73W,73W,B737,737-700,143,2,10/23/2005,,,85700,121700,155000,154500,129200,,Boeing,2005-10-23,08/09/2005,06/12/2025,,0,2,0,HGS-4000,0,0,C1,NOT ETOPS,PERM,NO,SBAS,Anuvu,,,true
N493WN,73W,73W,B737,737-700,0,1,12/1/2004,,,85702,121700,155000,154500,129200,,Boeing,,12/02/2004,09/04/2024,09/06/2024,0,0,0,CAT I,,,C1,NOT ETOPS,PERM,NO,,,,,
N7875A,7S7,7S7,B737,737-700,137,1,9/28/2004,AAAD8F,,85815,121700,155000,154500,129200,EJ-FR,Boeing,12/31/2025 0:00,06/19/2016,,,0,2,0,HGS-4000,0,0,C+,NOT ETOPS,PERM,NO,SBAS,Anuvu,,,
N8994Q,7X8,7M8,B38M,737 MAX 8,175,2,2/12/2026,AC69B6,,99530,145400,181700,181200,152800,ER-AK,Boeing,,02/18/2026,,,1,1,0,HGS-6000,1,0,C+,NOT ETOPS,Flywire,YES,SBAS,ViaSat,JAM MEX PLS,,
N8769Q,7V8,7M8,B38M,737 MAX 8,175,2,8/31/2022,AC1042,,99423,145400,181700,181200,152800,LM-AE,Boeing,9/30/2029,09/07/2022,,,1,1,2,HGS-6000,1,4,ET,ETOPS,PERM,NO,SBAS,Anuvu,,YES,
N8533S,7A8,73H,B738,737-800,175,2,6/1/2017,ABB54F,,93343,138300,174700,174200,146300,DJ-BG,Boeing,6/30/2027 0:00,06/01/2017,,,1,1,0,HGS-4000,0,0,C+,NOT ETOPS,PERM,NO,SBAS,Anuvu,,,
N8312C,7R8,73H,B738,737-800,175,2,6/22/2012,AB5EB2,,92459,138300,174700,174200,146300,BD-AR,Boeing,7/31/2028,06/25/2012,,,1,1,2,HGS-4000,1,4,ET,ETOPS,PERM,NO,SBAS,Anuvu,,,
N8309C,7R8,73H,B738,737-800,175,2,5/15/2012,AB5BF0,,93125,138300,174700,174200,146300,GP-CR,Boeing,2012-05-15,05/18/2012,,,1,1,2,HGS-4000,1,4,ET,ETOPS,PERM,NO,SBAS,Anuvu,,,
N456WN,7S7,7S7,B737,737-700,137,2,4/10/2004,A58A67,,85808,121700,155000,154500,129200,,Boeing,6/30/2027 0:00,04/08/2004,,,0,2,0,HGS-2350,0,0,C+,NOT ETOPS,PERM,NO,SBAS,Anuvu,,,
N8806Q,7U8,7M8,B38M,737 MAX 8,175,2,3/8/2021,AC210E,,98358,145400,181700,181200,152800,AQ-HM,Boeing,2021-03-08,03/11/2021,,,1,1,0,HGS-6000,0,0,C1,NOT ETOPS,PERM,NO,SBAS,Anuvu,,,true
N7812G,73R,73W,B737,737-700,143,2,11/30/2001,AA96E2,,86231,121700,155000,154500,129200,JP-HR,Boeing,4/30/2029,08/06/2013,12/29/2024,,1,1,0,CAT I,1,3,C1,NOT ETOPS,PERM,NO,SA-ON,Anuvu,MEX,,true
N8993Q,7X8,7M8,B38M,737 MAX 8,175,2,2/7/2026,AC6993,,99543,145400,181700,181200,152800,EQ-RS,Boeing,,02/12/2026,,,1,1,0,HGS-6000,1,0,C+,NOT ETOPS,Flywire,YES,SBAS,ViaSat,JAM MEX PLS,,
N8875B,7U8,7M8,B38M,737 MAX 8,175,2,6/2/2023,AC3ADF,,98752,145400,181700,181200,152800,GQ-CJ,Boeing,2023-06-02,06/30/2023,,,1,1,0,HGS-6000,1,0,C+,NOT ETOPS,PERM,YES,SBAS,ViaSat,,,
N8926Q,7U8,7M8,B38M,737 MAX 8,175,2,6/14/2024,AC4FFB,,98920,145400,181700,181200,152800,CL-ES,Boeing,2024-06-14,06/18/2024,,,1,1,0,HGS-6000,1,0,C+,NOT ETOPS,PERM,YES,SBAS,ViaSat,PLS,,
N8710M,7V8,7M8,B38M,737 MAX 8,175,2,8/25/2017,ABFC71,Imua One,99502,145400,181700,181200,152800,GR-AK,Boeing,2017-08-25,08/28/2017,,,1,1,2,HGS-6000,1,4,ET,ETOPS,PERM,NO,SBAS,Anuvu,,,